      7 1.747214543    10.0.1.11             10.0.2.22             TCP      74     33422 → 4444 [SYN] Seq=0 Win=29200 Len=0 MSS=1460 SACK_PERM=1 TSval=1333008 TSecr=0 WS=128

Frame 7: 74 bytes on wire (592 bits), 74 bytes captured (592 bits) on interface 0
Ethernet II, Src: 68:05:ca:36:33:a0, Dst: 68:05:ca:36:39:c7
Internet Protocol Version 4, Src: 10.0.1.11, Dst: 10.0.2.22
Transmission Control Protocol, Src Port: 33422 (33422), Dst Port: 4444 (4444), Seq: 0, Len: 0

      8 1.747897726    10.0.2.22             10.0.1.11             TCP      74     4444 → 33422 [SYN, ACK] Seq=0 Ack=1 Win=8960 Len=0 MSS=460 SACK_PERM=1 TSval=1332748 TSecr=1333008 WS=128

Frame 8: 74 bytes on wire (592 bits), 74 bytes captured (592 bits) on interface 0
Ethernet II, Src: 68:05:ca:36:39:c7, Dst: 68:05:ca:36:33:a0
Internet Protocol Version 4, Src: 10.0.2.22, Dst: 10.0.1.11
Transmission Control Protocol, Src Port: 4444 (4444), Dst Port: 33422 (33422), Seq: 0, Ack: 1, Len: 0

      9 1.747930500    10.0.1.11             10.0.2.22             TCP      66     33422 → 4444 [ACK] Seq=1 Ack=1 Win=29312 Len=0 TSval=1333008 TSecr=1332748

Frame 9: 66 bytes on wire (528 bits), 66 bytes captured (528 bits) on interface 0
Ethernet II, Src: 68:05:ca:36:33:a0, Dst: 68:05:ca:36:39:c7
Internet Protocol Version 4, Src: 10.0.1.11, Dst: 10.0.2.22
Transmission Control Protocol, Src Port: 33422 (33422), Dst Port: 4444 (4444), Seq: 1, Ack: 1, Len: 0

     10 1.748057786    10.0.1.11             10.0.2.22             TCP      144    33422 → 4444 [PSH, ACK] Seq=1 Ack=1 Win=29312 Len=78 TSval=1333009 TSecr=1332748

Frame 10: 144 bytes on wire (1152 bits), 144 bytes captured (1152 bits) on interface 0
Ethernet II, Src: 68:05:ca:36:33:a0, Dst: 68:05:ca:36:39:c7
Internet Protocol Version 4, Src: 10.0.1.11, Dst: 10.0.2.22
Transmission Control Protocol, Src Port: 33422 (33422), Dst Port: 4444 (4444), Seq: 1, Ack: 1, Len: 78
Data (78 bytes)

0000  6e 74 74 63 70 40 2d 72 40 2d 6c 31 30 32 34 40   nttcp@-r@-l1024@
0010  2d 6e 32 40 2d 66 40 25 39 62 25 38 2e 32 72 74   -n2@-f@%9b%8.2rt
0020  25 38 2e 32 63 74 25 31 32 2e 34 72 62 72 25 31   %8.2ct%12.4rbr%1
0030  32 2e 34 63 62 72 25 38 63 25 31 30 2e 32 72 63   2.4cbr%8c%10.2rc
0040  72 25 31 30 2e 31 63 63 72 40 2d 4e 31 0a         r%10.1ccr@-N1.

     11 1.748948252    10.0.2.22             10.0.1.11             TCP      66     4444 → 33422 [ACK] Seq=1 Ack=79 Win=8960 Len=0 TSval=1332748 TSecr=1333009

Frame 11: 66 bytes on wire (528 bits), 66 bytes captured (528 bits) on interface 0
Ethernet II, Src: 68:05:ca:36:39:c7, Dst: 68:05:ca:36:33:a0
Internet Protocol Version 4, Src: 10.0.2.22, Dst: 10.0.1.11
Transmission Control Protocol, Src Port: 4444 (4444), Dst Port: 33422 (33422), Seq: 1, Ack: 79, Len: 0

     20 11.760484803   10.0.2.22             10.0.1.11             TCP      81     4444 → 33422 [PSH, ACK] Seq=1 Ack=79 Win=8960 Len=15 TSval=1335251 TSecr=1333009

Frame 20: 81 bytes on wire (648 bits), 81 bytes captured (648 bits) on interface 0
Ethernet II, Src: 68:05:ca:36:39:c7, Dst: 68:05:ca:36:33:a0
Internet Protocol Version 4, Src: 10.0.2.22, Dst: 10.0.1.11
Transmission Control Protocol, Src Port: 4444 (4444), Dst Port: 33422 (33422), Seq: 1, Ack: 79, Len: 15
Data (15 bytes)

0000  64 61 74 61 70 6f 72 74 3a 20 35 30 33 38 0a      dataport: 5038.

     21 11.760561490   10.0.1.11             10.0.2.22             TCP      66     33422 → 4444 [ACK] Seq=79 Ack=16 Win=29312 Len=0 TSval=1335512 TSecr=1335251

Frame 21: 66 bytes on wire (528 bits), 66 bytes captured (528 bits) on interface 0
Ethernet II, Src: 68:05:ca:36:33:a0, Dst: 68:05:ca:36:39:c7
Internet Protocol Version 4, Src: 10.0.1.11, Dst: 10.0.2.22
Transmission Control Protocol, Src Port: 33422 (33422), Dst Port: 4444 (4444), Seq: 79, Ack: 16, Len: 0

     22 11.760619347   10.0.1.11             10.0.2.22             TCP      74     49606 → 5038 [SYN] Seq=0 Win=29200 Len=0 MSS=1460 SACK_PERM=1 TSval=1335512 TSecr=0 WS=128

Frame 22: 74 bytes on wire (592 bits), 74 bytes captured (592 bits) on interface 0
Ethernet II, Src: 68:05:ca:36:33:a0, Dst: 68:05:ca:36:39:c7
Internet Protocol Version 4, Src: 10.0.1.11, Dst: 10.0.2.22
Transmission Control Protocol, Src Port: 49606 (49606), Dst Port: 5038 (5038), Seq: 0, Len: 0

     23 11.761490375   10.0.2.22             10.0.1.11             TCP      74     5038 → 49606 [SYN, ACK] Seq=0 Ack=1 Win=8960 Len=0 MSS=460 SACK_PERM=1 TSval=1335252 TSecr=1335512 WS=128

Frame 23: 74 bytes on wire (592 bits), 74 bytes captured (592 bits) on interface 0
Ethernet II, Src: 68:05:ca:36:39:c7, Dst: 68:05:ca:36:33:a0
Internet Protocol Version 4, Src: 10.0.2.22, Dst: 10.0.1.11
Transmission Control Protocol, Src Port: 5038 (5038), Dst Port: 49606 (49606), Seq: 0, Ack: 1, Len: 0

     24 11.761525240   10.0.1.11             10.0.2.22             TCP      66     49606 → 5038 [ACK] Seq=1 Ack=1 Win=29312 Len=0 TSval=1335512 TSecr=1335252

Frame 24: 66 bytes on wire (528 bits), 66 bytes captured (528 bits) on interface 0
Ethernet II, Src: 68:05:ca:36:33:a0, Dst: 68:05:ca:36:39:c7
Internet Protocol Version 4, Src: 10.0.1.11, Dst: 10.0.2.22
Transmission Control Protocol, Src Port: 49606 (49606), Dst Port: 5038 (5038), Seq: 1, Ack: 1, Len: 0

     25 11.761664485   10.0.1.11             10.0.2.22             TCP      514    49606 → 5038 [ACK] Seq=1 Ack=1 Win=29312 Len=448 TSval=1335512 TSecr=1335252

Frame 25: 514 bytes on wire (4112 bits), 514 bytes captured (4112 bits) on interface 0
Ethernet II, Src: 68:05:ca:36:33:a0, Dst: 68:05:ca:36:39:c7
Internet Protocol Version 4, Src: 10.0.1.11, Dst: 10.0.2.22
Transmission Control Protocol, Src Port: 49606 (49606), Dst Port: 5038 (5038), Seq: 1, Ack: 1, Len: 448
Data (448 bytes)

0000  88 7f b7 6a d4 7f 00 00 88 7f b7 6a d4 7f 00 00   ...j.......j....
0010  40 72 a8 00 00 00 00 00 40 72 a8 00 00 00 00 00   @r......@r......
0020  00 00 00 00 00 00 00 00 00 00 00 00 00 00 00 00   ................
0030  00 00 00 00 00 00 00 00 00 00 00 00 00 00 00 00   ................
0040  00 00 00 00 00 00 00 00 00 00 00 00 00 00 00 00   ................
0050  00 00 00 00 00 00 00 00 00 00 00 00 00 00 00 00   ................
0060  00 00 00 00 00 00 00 00 00 00 00 00 00 00 00 00   ................
0070  00 00 00 00 00 00 00 00 00 00 00 00 00 00 00 00   ................
0080  00 00 00 00 00 00 00 00 00 00 00 00 00 00 00 00   ................
0090  00 00 00 00 00 00 00 00 00 00 00 00 00 00 00 00   ................
00a0  00 00 00 00 00 00 00 00 00 00 00 00 00 00 00 00   ................
00b0  00 00 00 00 00 00 00 00 00 00 00 00 00 00 00 00   ................
00c0  00 00 00 00 00 00 00 00 00 00 00 00 00 00 00 00   ................
00d0  00 00 00 00 00 00 00 00 00 00 00 00 00 00 00 00   ................
00e0  00 00 00 00 00 00 00 00 00 00 00 00 00 00 00 00   ................
00f0  00 00 00 00 00 00 00 00 00 00 00 00 00 00 00 00   ................
0100  00 00 00 00 00 00 00 00 00 00 00 00 00 00 00 00   ................
0110  00 00 00 00 00 00 00 00 00 00 00 00 00 00 00 00   ................
0120  00 00 00 00 00 00 00 00 00 00 00 00 00 00 00 00   ................
0130  00 00 00 00 00 00 00 00 00 00 00 00 00 00 00 00   ................
0140  00 00 00 00 00 00 00 00 00 00 00 00 00 00 00 00   ................
0150  00 00 00 00 00 00 00 00 00 00 00 00 00 00 00 00   ................
0160  00 00 00 00 00 00 00 00 00 00 00 00 00 00 00 00   ................
0170  00 00 00 00 00 00 00 00 00 00 00 00 00 00 00 00   ................
0180  00 00 00 00 00 00 00 00 00 00 00 00 00 00 00 00   ................
0190  00 00 00 00 00 00 00 00 00 00 00 00 00 00 00 00   ................
01a0  00 00 00 00 00 00 00 00 00 00 00 00 00 00 00 00   ................
01b0  00 00 00 00 00 00 00 00 00 00 00 00 00 00 00 00   ................

     26 11.761669462   10.0.1.11             10.0.2.22             TCP      514    49606 → 5038 [ACK] Seq=449 Ack=1 Win=29312 Len=448 TSval=1335512 TSecr=1335252

Frame 26: 514 bytes on wire (4112 bits), 514 bytes captured (4112 bits) on interface 0
Ethernet II, Src: 68:05:ca:36:33:a0, Dst: 68:05:ca:36:39:c7
Internet Protocol Version 4, Src: 10.0.1.11, Dst: 10.0.2.22
Transmission Control Protocol, Src Port: 49606 (49606), Dst Port: 5038 (5038), Seq: 449, Ack: 1, Len: 448
Data (448 bytes)

0000  00 00 00 00 00 00 00 00 00 00 00 00 00 00 00 00   ................
0010  00 00 00 00 00 00 00 00 00 00 00 00 00 00 00 00   ................
0020  00 00 00 00 00 00 00 00 00 00 00 00 00 00 00 00   ................
0030  00 00 00 00 00 00 00 00 00 00 00 00 00 00 00 00   ................
0040  00 00 00 00 00 00 00 00 00 00 00 00 00 00 00 00   ................
0050  00 00 00 00 00 00 00 00 00 00 00 00 00 00 00 00   ................
0060  00 00 00 00 00 00 00 00 00 00 00 00 00 00 00 00   ................
0070  00 00 00 00 00 00 00 00 00 00 00 00 00 00 00 00   ................
0080  00 00 00 00 00 00 00 00 00 00 00 00 00 00 00 00   ................
0090  00 00 00 00 00 00 00 00 00 00 00 00 00 00 00 00   ................
00a0  00 00 00 00 00 00 00 00 00 00 00 00 00 00 00 00   ................
00b0  00 00 00 00 00 00 00 00 00 00 00 00 00 00 00 00   ................
00c0  00 00 00 00 00 00 00 00 00 00 00 00 00 00 00 00   ................
00d0  00 00 00 00 00 00 00 00 00 00 00 00 00 00 00 00   ................
00e0  00 00 00 00 00 00 00 00 00 00 00 00 00 00 00 00   ................
00f0  00 00 00 00 00 00 00 00 00 00 00 00 00 00 00 00   ................
0100  00 00 00 00 00 00 00 00 00 00 00 00 00 00 00 00   ................
0110  00 00 00 00 00 00 00 00 00 00 00 00 00 00 00 00   ................
0120  00 00 00 00 00 00 00 00 00 00 00 00 00 00 00 00   ................
0130  00 00 00 00 00 00 00 00 00 00 00 00 00 00 00 00   ................
0140  00 00 00 00 00 00 00 00 00 00 00 00 00 00 00 00   ................
0150  00 00 00 00 00 00 00 00 00 00 00 00 00 00 00 00   ................
0160  00 00 00 00 00 00 00 00 00 00 00 00 00 00 00 00   ................
0170  00 00 00 00 00 00 00 00 00 00 00 00 00 00 00 00   ................
0180  00 00 00 00 00 00 00 00 00 00 00 00 00 00 00 00   ................
0190  00 00 00 00 00 00 00 00 00 00 00 00 00 00 00 00   ................
01a0  00 00 00 00 00 00 00 00 00 00 00 00 00 00 00 00   ................
01b0  00 00 00 00 00 00 00 00 00 00 00 00 00 00 00 00   ................

     27 11.761670717   10.0.1.11             10.0.2.22             TCP      194    49606 → 5038 [PSH, ACK] Seq=897 Ack=1 Win=29312 Len=128 TSval=1335512 TSecr=1335252

Frame 27: 194 bytes on wire (1552 bits), 194 bytes captured (1552 bits) on interface 0
Ethernet II, Src: 68:05:ca:36:33:a0, Dst: 68:05:ca:36:39:c7
Internet Protocol Version 4, Src: 10.0.1.11, Dst: 10.0.2.22
Transmission Control Protocol, Src Port: 49606 (49606), Dst Port: 5038 (5038), Seq: 897, Ack: 1, Len: 128
Data (128 bytes)

0000  00 00 00 00 00 00 00 00 00 00 00 00 00 00 00 00   ................
0010  00 00 00 00 00 00 00 00 00 00 00 00 00 00 00 00   ................
0020  00 00 00 00 00 00 00 00 00 00 00 00 00 00 00 00   ................
0030  00 00 00 00 00 00 00 00 00 00 00 00 00 00 00 00   ................
0040  00 00 00 00 00 00 00 00 00 00 00 00 00 00 00 00   ................
0050  00 00 00 00 00 00 00 00 00 00 00 00 00 00 00 00   ................
0060  00 00 00 00 00 00 00 00 00 00 00 00 00 00 00 00   ................
0070  00 00 00 00 00 00 00 00 00 00 00 00 00 00 00 00   ................

     28 11.761690763   10.0.1.11             10.0.2.22             TCP      514    49606 → 5038 [ACK] Seq=1025 Ack=1 Win=29312 Len=448 TSval=1335512 TSecr=1335252

Frame 28: 514 bytes on wire (4112 bits), 514 bytes captured (4112 bits) on interface 0
Ethernet II, Src: 68:05:ca:36:33:a0, Dst: 68:05:ca:36:39:c7
Internet Protocol Version 4, Src: 10.0.1.11, Dst: 10.0.2.22
Transmission Control Protocol, Src Port: 49606 (49606), Dst Port: 5038 (5038), Seq: 1025, Ack: 1, Len: 448
Data (448 bytes)

0000  88 7f b7 6a d4 7f 00 00 88 7f b7 6a d4 7f 00 00   ...j.......j....
0010  40 72 a8 00 00 00 00 00 40 72 a8 00 00 00 00 00   @r......@r......
0020  00 00 00 00 00 00 00 00 00 00 00 00 00 00 00 00   ................
0030  00 00 00 00 00 00 00 00 00 00 00 00 00 00 00 00   ................
0040  00 00 00 00 00 00 00 00 00 00 00 00 00 00 00 00   ................
0050  00 00 00 00 00 00 00 00 00 00 00 00 00 00 00 00   ................
0060  00 00 00 00 00 00 00 00 00 00 00 00 00 00 00 00   ................
0070  00 00 00 00 00 00 00 00 00 00 00 00 00 00 00 00   ................
0080  00 00 00 00 00 00 00 00 00 00 00 00 00 00 00 00   ................
0090  00 00 00 00 00 00 00 00 00 00 00 00 00 00 00 00   ................
00a0  00 00 00 00 00 00 00 00 00 00 00 00 00 00 00 00   ................
00b0  00 00 00 00 00 00 00 00 00 00 00 00 00 00 00 00   ................
00c0  00 00 00 00 00 00 00 00 00 00 00 00 00 00 00 00   ................
00d0  00 00 00 00 00 00 00 00 00 00 00 00 00 00 00 00   ................
00e0  00 00 00 00 00 00 00 00 00 00 00 00 00 00 00 00   ................
00f0  00 00 00 00 00 00 00 00 00 00 00 00 00 00 00 00   ................
0100  00 00 00 00 00 00 00 00 00 00 00 00 00 00 00 00   ................
0110  00 00 00 00 00 00 00 00 00 00 00 00 00 00 00 00   ................
0120  00 00 00 00 00 00 00 00 00 00 00 00 00 00 00 00   ................
0130  00 00 00 00 00 00 00 00 00 00 00 00 00 00 00 00   ................
0140  00 00 00 00 00 00 00 00 00 00 00 00 00 00 00 00   ................
0150  00 00 00 00 00 00 00 00 00 00 00 00 00 00 00 00   ................
0160  00 00 00 00 00 00 00 00 00 00 00 00 00 00 00 00   ................
0170  00 00 00 00 00 00 00 00 00 00 00 00 00 00 00 00   ................
0180  00 00 00 00 00 00 00 00 00 00 00 00 00 00 00 00   ................
0190  00 00 00 00 00 00 00 00 00 00 00 00 00 00 00 00   ................
01a0  00 00 00 00 00 00 00 00 00 00 00 00 00 00 00 00   ................
01b0  00 00 00 00 00 00 00 00 00 00 00 00 00 00 00 00   ................

     29 11.761692148   10.0.1.11             10.0.2.22             TCP      514    49606 → 5038 [ACK] Seq=1473 Ack=1 Win=29312 Len=448 TSval=1335512 TSecr=1335252

Frame 29: 514 bytes on wire (4112 bits), 514 bytes captured (4112 bits) on interface 0
Ethernet II, Src: 68:05:ca:36:33:a0, Dst: 68:05:ca:36:39:c7
Internet Protocol Version 4, Src: 10.0.1.11, Dst: 10.0.2.22
Transmission Control Protocol, Src Port: 49606 (49606), Dst Port: 5038 (5038), Seq: 1473, Ack: 1, Len: 448
Data (448 bytes)

0000  00 00 00 00 00 00 00 00 00 00 00 00 00 00 00 00   ................
0010  00 00 00 00 00 00 00 00 00 00 00 00 00 00 00 00   ................
0020  00 00 00 00 00 00 00 00 00 00 00 00 00 00 00 00   ................
0030  00 00 00 00 00 00 00 00 00 00 00 00 00 00 00 00   ................
0040  00 00 00 00 00 00 00 00 00 00 00 00 00 00 00 00   ................
0050  00 00 00 00 00 00 00 00 00 00 00 00 00 00 00 00   ................
0060  00 00 00 00 00 00 00 00 00 00 00 00 00 00 00 00   ................
0070  00 00 00 00 00 00 00 00 00 00 00 00 00 00 00 00   ................
0080  00 00 00 00 00 00 00 00 00 00 00 00 00 00 00 00   ................
0090  00 00 00 00 00 00 00 00 00 00 00 00 00 00 00 00   ................
00a0  00 00 00 00 00 00 00 00 00 00 00 00 00 00 00 00   ................
00b0  00 00 00 00 00 00 00 00 00 00 00 00 00 00 00 00   ................
00c0  00 00 00 00 00 00 00 00 00 00 00 00 00 00 00 00   ................
00d0  00 00 00 00 00 00 00 00 00 00 00 00 00 00 00 00   ................
00e0  00 00 00 00 00 00 00 00 00 00 00 00 00 00 00 00   ................
00f0  00 00 00 00 00 00 00 00 00 00 00 00 00 00 00 00   ................
0100  00 00 00 00 00 00 00 00 00 00 00 00 00 00 00 00   ................
0110  00 00 00 00 00 00 00 00 00 00 00 00 00 00 00 00   ................
0120  00 00 00 00 00 00 00 00 00 00 00 00 00 00 00 00   ................
0130  00 00 00 00 00 00 00 00 00 00 00 00 00 00 00 00   ................
0140  00 00 00 00 00 00 00 00 00 00 00 00 00 00 00 00   ................
0150  00 00 00 00 00 00 00 00 00 00 00 00 00 00 00 00   ................
0160  00 00 00 00 00 00 00 00 00 00 00 00 00 00 00 00   ................
0170  00 00 00 00 00 00 00 00 00 00 00 00 00 00 00 00   ................
0180  00 00 00 00 00 00 00 00 00 00 00 00 00 00 00 00   ................
0190  00 00 00 00 00 00 00 00 00 00 00 00 00 00 00 00   ................
01a0  00 00 00 00 00 00 00 00 00 00 00 00 00 00 00 00   ................
01b0  00 00 00 00 00 00 00 00 00 00 00 00 00 00 00 00   ................

     30 11.761693349   10.0.1.11             10.0.2.22             TCP      194    49606 → 5038 [FIN, PSH, ACK] Seq=1921 Ack=1 Win=29312 Len=128 TSval=1335512 TSecr=1335252

Frame 30: 194 bytes on wire (1552 bits), 194 bytes captured (1552 bits) on interface 0
Ethernet II, Src: 68:05:ca:36:33:a0, Dst: 68:05:ca:36:39:c7
Internet Protocol Version 4, Src: 10.0.1.11, Dst: 10.0.2.22
Transmission Control Protocol, Src Port: 49606 (49606), Dst Port: 5038 (5038), Seq: 1921, Ack: 1, Len: 128
Data (128 bytes)

0000  00 00 00 00 00 00 00 00 00 00 00 00 00 00 00 00   ................
0010  00 00 00 00 00 00 00 00 00 00 00 00 00 00 00 00   ................
0020  00 00 00 00 00 00 00 00 00 00 00 00 00 00 00 00   ................
0030  00 00 00 00 00 00 00 00 00 00 00 00 00 00 00 00   ................
0040  00 00 00 00 00 00 00 00 00 00 00 00 00 00 00 00   ................
0050  00 00 00 00 00 00 00 00 00 00 00 00 00 00 00 00   ................
0060  00 00 00 00 00 00 00 00 00 00 00 00 00 00 00 00   ................
0070  00 00 00 00 00 00 00 00 00 00 00 00 00 00 00 00   ................

     31 11.763863749   10.0.2.22             10.0.1.11             TCP      66     5038 → 49606 [ACK] Seq=1 Ack=449 Win=9856 Len=0 TSval=1335252 TSecr=1335512

Frame 31: 66 bytes on wire (528 bits), 66 bytes captured (528 bits) on interface 0
Ethernet II, Src: 68:05:ca:36:39:c7, Dst: 68:05:ca:36:33:a0
Internet Protocol Version 4, Src: 10.0.2.22, Dst: 10.0.1.11
Transmission Control Protocol, Src Port: 5038 (5038), Dst Port: 49606 (49606), Seq: 1, Ack: 449, Len: 0

     32 11.764850086   10.0.2.22             10.0.1.11             TCP      66     5038 → 49606 [ACK] Seq=1 Ack=897 Win=10752 Len=0 TSval=1335252 TSecr=1335512

Frame 32: 66 bytes on wire (528 bits), 66 bytes captured (528 bits) on interface 0
Ethernet II, Src: 68:05:ca:36:39:c7, Dst: 68:05:ca:36:33:a0
Internet Protocol Version 4, Src: 10.0.2.22, Dst: 10.0.1.11
Transmission Control Protocol, Src Port: 5038 (5038), Dst Port: 49606 (49606), Seq: 1, Ack: 897, Len: 0

     33 11.765100589   10.0.2.22             10.0.1.11             TCP      66     5038 → 49606 [ACK] Seq=1 Ack=1025 Win=11648 Len=0 TSval=1335252 TSecr=1335512

Frame 33: 66 bytes on wire (528 bits), 66 bytes captured (528 bits) on interface 0
Ethernet II, Src: 68:05:ca:36:39:c7, Dst: 68:05:ca:36:33:a0
Internet Protocol Version 4, Src: 10.0.2.22, Dst: 10.0.1.11
Transmission Control Protocol, Src Port: 5038 (5038), Dst Port: 49606 (49606), Seq: 1, Ack: 1025, Len: 0

     34 11.765119059   10.0.2.22             10.0.1.11             TCP      66     5038 → 49606 [ACK] Seq=1 Ack=1473 Win=12544 Len=0 TSval=1335252 TSecr=1335512

Frame 34: 66 bytes on wire (528 bits), 66 bytes captured (528 bits) on interface 0
Ethernet II, Src: 68:05:ca:36:39:c7, Dst: 68:05:ca:36:33:a0
Internet Protocol Version 4, Src: 10.0.2.22, Dst: 10.0.1.11
Transmission Control Protocol, Src Port: 5038 (5038), Dst Port: 49606 (49606), Seq: 1, Ack: 1473, Len: 0

     35 11.765350792   10.0.2.22             10.0.1.11             TCP      66     5038 → 49606 [ACK] Seq=1 Ack=1921 Win=13440 Len=0 TSval=1335252 TSecr=1335512

Frame 35: 66 bytes on wire (528 bits), 66 bytes captured (528 bits) on interface 0
Ethernet II, Src: 68:05:ca:36:39:c7, Dst: 68:05:ca:36:33:a0
Internet Protocol Version 4, Src: 10.0.2.22, Dst: 10.0.1.11
Transmission Control Protocol, Src Port: 5038 (5038), Dst Port: 49606 (49606), Seq: 1, Ack: 1921, Len: 0

     36 11.765600629   10.0.2.22             10.0.1.11             TCP      145    4444 → 33422 [PSH, ACK] Seq=16 Ack=79 Win=8960 Len=79 TSval=1335252 TSecr=1335512

Frame 36: 145 bytes on wire (1160 bits), 145 bytes captured (1160 bits) on interface 0
Ethernet II, Src: 68:05:ca:36:39:c7, Dst: 68:05:ca:36:33:a0
Internet Protocol Version 4, Src: 10.0.2.22, Dst: 10.0.1.11
Transmission Control Protocol, Src Port: 4444 (4444), Dst Port: 33422 (33422), Seq: 16, Ack: 79, Len: 79
Data (79 bytes)

0000  31 20 20 20 20 20 32 30 34 38 20 20 20 20 30 2e   1     2048    0.
0010  30 30 20 20 20 20 30 2e 30 30 20 20 20 20 20 20   00    0.00      
0020  36 2e 30 31 36 39 20 20 20 31 36 33 38 2e 34 30   6.0169   1638.40
0030  30 30 20 20 20 20 20 20 20 37 20 20 20 32 35 37   00       7   257
0040  30 2e 36 39 20 20 37 30 30 30 30 30 2e 30 0a      0.69  700000.0.

     37 11.765623961   10.0.1.11             10.0.2.22             TCP      66     33422 → 4444 [ACK] Seq=79 Ack=95 Win=29312 Len=0 TSval=1335513 TSecr=1335252

Frame 37: 66 bytes on wire (528 bits), 66 bytes captured (528 bits) on interface 0
Ethernet II, Src: 68:05:ca:36:33:a0, Dst: 68:05:ca:36:39:c7
Internet Protocol Version 4, Src: 10.0.1.11, Dst: 10.0.2.22
Transmission Control Protocol, Src Port: 33422 (33422), Dst Port: 4444 (4444), Seq: 79, Ack: 95, Len: 0

     38 11.765629343   10.0.2.22             10.0.1.11             TCP      66     4444 → 33422 [FIN, ACK] Seq=95 Ack=79 Win=8960 Len=0 TSval=1335252 TSecr=1335512

Frame 38: 66 bytes on wire (528 bits), 66 bytes captured (528 bits) on interface 0
Ethernet II, Src: 68:05:ca:36:39:c7, Dst: 68:05:ca:36:33:a0
Internet Protocol Version 4, Src: 10.0.2.22, Dst: 10.0.1.11
Transmission Control Protocol, Src Port: 4444 (4444), Dst Port: 33422 (33422), Seq: 95, Ack: 79, Len: 0

     39 11.765639816   10.0.2.22             10.0.1.11             TCP      66     5038 → 49606 [FIN, ACK] Seq=1 Ack=2050 Win=14336 Len=0 TSval=1335252 TSecr=1335512

Frame 39: 66 bytes on wire (528 bits), 66 bytes captured (528 bits) on interface 0
Ethernet II, Src: 68:05:ca:36:39:c7, Dst: 68:05:ca:36:33:a0
Internet Protocol Version 4, Src: 10.0.2.22, Dst: 10.0.1.11
Transmission Control Protocol, Src Port: 5038 (5038), Dst Port: 49606 (49606), Seq: 1, Ack: 2050, Len: 0

     40 11.765651669   10.0.1.11             10.0.2.22             TCP      66     49606 → 5038 [ACK] Seq=2050 Ack=2 Win=29312 Len=0 TSval=1335513 TSecr=1335252

Frame 40: 66 bytes on wire (528 bits), 66 bytes captured (528 bits) on interface 0
Ethernet II, Src: 68:05:ca:36:33:a0, Dst: 68:05:ca:36:39:c7
Internet Protocol Version 4, Src: 10.0.1.11, Dst: 10.0.2.22
Transmission Control Protocol, Src Port: 49606 (49606), Dst Port: 5038 (5038), Seq: 2050, Ack: 2, Len: 0

     41 11.765700948   10.0.1.11             10.0.2.22             TCP      66     33422 → 4444 [FIN, ACK] Seq=79 Ack=96 Win=29312 Len=0 TSval=1335513 TSecr=1335252

Frame 41: 66 bytes on wire (528 bits), 66 bytes captured (528 bits) on interface 0
Ethernet II, Src: 68:05:ca:36:33:a0, Dst: 68:05:ca:36:39:c7
Internet Protocol Version 4, Src: 10.0.1.11, Dst: 10.0.2.22
Transmission Control Protocol, Src Port: 33422 (33422), Dst Port: 4444 (4444), Seq: 79, Ack: 96, Len: 0

     42 11.766542783   10.0.2.22             10.0.1.11             TCP      66     4444 → 33422 [ACK] Seq=96 Ack=80 Win=8960 Len=0 TSval=1335253 TSecr=1335513

Frame 42: 66 bytes on wire (528 bits), 66 bytes captured (528 bits) on interface 0
Ethernet II, Src: 68:05:ca:36:39:c7, Dst: 68:05:ca:36:33:a0
Internet Protocol Version 4, Src: 10.0.2.22, Dst: 10.0.1.11
Transmission Control Protocol, Src Port: 4444 (4444), Dst Port: 33422 (33422), Seq: 96, Ack: 80, Len: 0

    109 86.873593025   10.0.1.11             10.0.2.22             TCP      74     60758 → 4444 [SYN] Seq=0 Win=29200 Len=0 MSS=1460 SACK_PERM=1 TSval=1354290 TSecr=0 WS=128

Frame 109: 74 bytes on wire (592 bits), 74 bytes captured (592 bits) on interface 0
Ethernet II, Src: 68:05:ca:36:33:a0, Dst: 68:05:ca:36:39:c7
Internet Protocol Version 4, Src: 10.0.1.11, Dst: 10.0.2.22
Transmission Control Protocol, Src Port: 60758 (60758), Dst Port: 4444 (4444), Seq: 0, Len: 0

    110 86.874310579   10.0.2.22             10.0.1.11             TCP      74     4444 → 60758 [SYN, ACK] Seq=0 Ack=1 Win=28960 Len=0 MSS=1460 SACK_PERM=1 TSval=1354030 TSecr=1354290 WS=128

Frame 110: 74 bytes on wire (592 bits), 74 bytes captured (592 bits) on interface 0
Ethernet II, Src: 68:05:ca:36:39:c7, Dst: 68:05:ca:36:33:a0
Internet Protocol Version 4, Src: 10.0.2.22, Dst: 10.0.1.11
Transmission Control Protocol, Src Port: 4444 (4444), Dst Port: 60758 (60758), Seq: 0, Ack: 1, Len: 0

    111 86.874322752   10.0.1.11             10.0.2.22             TCP      66     60758 → 4444 [ACK] Seq=1 Ack=1 Win=29312 Len=0 TSval=1354290 TSecr=1354030

Frame 111: 66 bytes on wire (528 bits), 66 bytes captured (528 bits) on interface 0
Ethernet II, Src: 68:05:ca:36:33:a0, Dst: 68:05:ca:36:39:c7
Internet Protocol Version 4, Src: 10.0.1.11, Dst: 10.0.2.22
Transmission Control Protocol, Src Port: 60758 (60758), Dst Port: 4444 (4444), Seq: 1, Ack: 1, Len: 0

    112 86.874352805   10.0.1.11             10.0.2.22             TCP      144    60758 → 4444 [PSH, ACK] Seq=1 Ack=1 Win=29312 Len=78 TSval=1354290 TSecr=1354030

Frame 112: 144 bytes on wire (1152 bits), 144 bytes captured (1152 bits) on interface 0
Ethernet II, Src: 68:05:ca:36:33:a0, Dst: 68:05:ca:36:39:c7
Internet Protocol Version 4, Src: 10.0.1.11, Dst: 10.0.2.22
Transmission Control Protocol, Src Port: 60758 (60758), Dst Port: 4444 (4444), Seq: 1, Ack: 1, Len: 78
Data (78 bytes)

0000  6e 74 74 63 70 40 2d 72 40 2d 6c 31 30 32 34 40   nttcp@-r@-l1024@
0010  2d 6e 32 40 2d 66 40 25 39 62 25 38 2e 32 72 74   -n2@-f@%9b%8.2rt
0020  25 38 2e 32 63 74 25 31 32 2e 34 72 62 72 25 31   %8.2ct%12.4rbr%1
0030  32 2e 34 63 62 72 25 38 63 25 31 30 2e 32 72 63   2.4cbr%8c%10.2rc
0040  72 25 31 30 2e 31 63 63 72 40 2d 4e 31 0a         r%10.1ccr@-N1.

    113 86.875258772   10.0.2.22             10.0.1.11             TCP      66     4444 → 60758 [ACK] Seq=1 Ack=79 Win=29056 Len=0 TSval=1354030 TSecr=1354290

Frame 113: 66 bytes on wire (528 bits), 66 bytes captured (528 bits) on interface 0
Ethernet II, Src: 68:05:ca:36:39:c7, Dst: 68:05:ca:36:33:a0
Internet Protocol Version 4, Src: 10.0.2.22, Dst: 10.0.1.11
Transmission Control Protocol, Src Port: 4444 (4444), Dst Port: 60758 (60758), Seq: 1, Ack: 79, Len: 0

    122 96.886760007   10.0.2.22             10.0.1.11             TCP      81     4444 → 60758 [PSH, ACK] Seq=1 Ack=79 Win=29056 Len=15 TSval=1356533 TSecr=1354290

Frame 122: 81 bytes on wire (648 bits), 81 bytes captured (648 bits) on interface 0
Ethernet II, Src: 68:05:ca:36:39:c7, Dst: 68:05:ca:36:33:a0
Internet Protocol Version 4, Src: 10.0.2.22, Dst: 10.0.1.11
Transmission Control Protocol, Src Port: 4444 (4444), Dst Port: 60758 (60758), Seq: 1, Ack: 79, Len: 15
Data (15 bytes)

0000  64 61 74 61 70 6f 72 74 3a 20 35 30 33 38 0a      dataport: 5038.

    123 96.886809481   10.0.1.11             10.0.2.22             TCP      66     60758 → 4444 [ACK] Seq=79 Ack=16 Win=29312 Len=0 TSval=1356793 TSecr=1356533

Frame 123: 66 bytes on wire (528 bits), 66 bytes captured (528 bits) on interface 0
Ethernet II, Src: 68:05:ca:36:33:a0, Dst: 68:05:ca:36:39:c7
Internet Protocol Version 4, Src: 10.0.1.11, Dst: 10.0.2.22
Transmission Control Protocol, Src Port: 60758 (60758), Dst Port: 4444 (4444), Seq: 79, Ack: 16, Len: 0

    124 96.886880277   10.0.1.11             10.0.2.22             TCP      74     54353 → 5038 [SYN] Seq=0 Win=29200 Len=0 MSS=1460 SACK_PERM=1 TSval=1356793 TSecr=0 WS=128

Frame 124: 74 bytes on wire (592 bits), 74 bytes captured (592 bits) on interface 0
Ethernet II, Src: 68:05:ca:36:33:a0, Dst: 68:05:ca:36:39:c7
Internet Protocol Version 4, Src: 10.0.1.11, Dst: 10.0.2.22
Transmission Control Protocol, Src Port: 54353 (54353), Dst Port: 5038 (5038), Seq: 0, Len: 0

    125 96.887798053   10.0.2.22             10.0.1.11             TCP      74     5038 → 54353 [SYN, ACK] Seq=0 Ack=1 Win=28960 Len=0 MSS=1460 SACK_PERM=1 TSval=1356533 TSecr=1356793 WS=128

Frame 125: 74 bytes on wire (592 bits), 74 bytes captured (592 bits) on interface 0
Ethernet II, Src: 68:05:ca:36:39:c7, Dst: 68:05:ca:36:33:a0
Internet Protocol Version 4, Src: 10.0.2.22, Dst: 10.0.1.11
Transmission Control Protocol, Src Port: 5038 (5038), Dst Port: 54353 (54353), Seq: 0, Ack: 1, Len: 0

    126 96.887832528   10.0.1.11             10.0.2.22             TCP      66     54353 → 5038 [ACK] Seq=1 Ack=1 Win=29312 Len=0 TSval=1356793 TSecr=1356533

Frame 126: 66 bytes on wire (528 bits), 66 bytes captured (528 bits) on interface 0
Ethernet II, Src: 68:05:ca:36:33:a0, Dst: 68:05:ca:36:39:c7
Internet Protocol Version 4, Src: 10.0.1.11, Dst: 10.0.2.22
Transmission Control Protocol, Src Port: 54353 (54353), Dst Port: 5038 (5038), Seq: 1, Ack: 1, Len: 0

    127 96.887958375   10.0.1.11             10.0.2.22             TCP      1090   54353 → 5038 [PSH, ACK] Seq=1 Ack=1 Win=29312 Len=1024 TSval=1356793 TSecr=1356533

Frame 127: 1090 bytes on wire (8720 bits), 1090 bytes captured (8720 bits) on interface 0
Ethernet II, Src: 68:05:ca:36:33:a0, Dst: 68:05:ca:36:39:c7
Internet Protocol Version 4, Src: 10.0.1.11, Dst: 10.0.2.22
Transmission Control Protocol, Src Port: 54353 (54353), Dst Port: 5038 (5038), Seq: 1, Ack: 1, Len: 1024
Data (1024 bytes)

0000  88 af 34 68 f0 7f 00 00 88 af 34 68 f0 7f 00 00   ..4h......4h....
0010  40 12 9a 00 00 00 00 00 40 12 9a 00 00 00 00 00   @.......@.......
0020  00 00 00 00 00 00 00 00 00 00 00 00 00 00 00 00   ................
0030  00 00 00 00 00 00 00 00 00 00 00 00 00 00 00 00   ................
0040  00 00 00 00 00 00 00 00 00 00 00 00 00 00 00 00   ................
0050  00 00 00 00 00 00 00 00 00 00 00 00 00 00 00 00   ................
0060  00 00 00 00 00 00 00 00 00 00 00 00 00 00 00 00   ................
0070  00 00 00 00 00 00 00 00 00 00 00 00 00 00 00 00   ................
0080  00 00 00 00 00 00 00 00 00 00 00 00 00 00 00 00   ................
0090  00 00 00 00 00 00 00 00 00 00 00 00 00 00 00 00   ................
00a0  00 00 00 00 00 00 00 00 00 00 00 00 00 00 00 00   ................
00b0  00 00 00 00 00 00 00 00 00 00 00 00 00 00 00 00   ................
00c0  00 00 00 00 00 00 00 00 00 00 00 00 00 00 00 00   ................
00d0  00 00 00 00 00 00 00 00 00 00 00 00 00 00 00 00   ................
00e0  00 00 00 00 00 00 00 00 00 00 00 00 00 00 00 00   ................
00f0  00 00 00 00 00 00 00 00 00 00 00 00 00 00 00 00   ................
0100  00 00 00 00 00 00 00 00 00 00 00 00 00 00 00 00   ................
0110  00 00 00 00 00 00 00 00 00 00 00 00 00 00 00 00   ................
0120  00 00 00 00 00 00 00 00 00 00 00 00 00 00 00 00   ................
0130  00 00 00 00 00 00 00 00 00 00 00 00 00 00 00 00   ................
0140  00 00 00 00 00 00 00 00 00 00 00 00 00 00 00 00   ................
0150  00 00 00 00 00 00 00 00 00 00 00 00 00 00 00 00   ................
0160  00 00 00 00 00 00 00 00 00 00 00 00 00 00 00 00   ................
0170  00 00 00 00 00 00 00 00 00 00 00 00 00 00 00 00   ................
0180  00 00 00 00 00 00 00 00 00 00 00 00 00 00 00 00   ................
0190  00 00 00 00 00 00 00 00 00 00 00 00 00 00 00 00   ................
01a0  00 00 00 00 00 00 00 00 00 00 00 00 00 00 00 00   ................
01b0  00 00 00 00 00 00 00 00 00 00 00 00 00 00 00 00   ................
01c0  00 00 00 00 00 00 00 00 00 00 00 00 00 00 00 00   ................
01d0  00 00 00 00 00 00 00 00 00 00 00 00 00 00 00 00   ................
01e0  00 00 00 00 00 00 00 00 00 00 00 00 00 00 00 00   ................
01f0  00 00 00 00 00 00 00 00 00 00 00 00 00 00 00 00   ................
0200  00 00 00 00 00 00 00 00 00 00 00 00 00 00 00 00   ................
0210  00 00 00 00 00 00 00 00 00 00 00 00 00 00 00 00   ................
0220  00 00 00 00 00 00 00 00 00 00 00 00 00 00 00 00   ................
0230  00 00 00 00 00 00 00 00 00 00 00 00 00 00 00 00   ................
0240  00 00 00 00 00 00 00 00 00 00 00 00 00 00 00 00   ................
0250  00 00 00 00 00 00 00 00 00 00 00 00 00 00 00 00   ................
0260  00 00 00 00 00 00 00 00 00 00 00 00 00 00 00 00   ................
0270  00 00 00 00 00 00 00 00 00 00 00 00 00 00 00 00   ................
0280  00 00 00 00 00 00 00 00 00 00 00 00 00 00 00 00   ................
0290  00 00 00 00 00 00 00 00 00 00 00 00 00 00 00 00   ................
02a0  00 00 00 00 00 00 00 00 00 00 00 00 00 00 00 00   ................
02b0  00 00 00 00 00 00 00 00 00 00 00 00 00 00 00 00   ................
02c0  00 00 00 00 00 00 00 00 00 00 00 00 00 00 00 00   ................
02d0  00 00 00 00 00 00 00 00 00 00 00 00 00 00 00 00   ................
02e0  00 00 00 00 00 00 00 00 00 00 00 00 00 00 00 00   ................
02f0  00 00 00 00 00 00 00 00 00 00 00 00 00 00 00 00   ................
0300  00 00 00 00 00 00 00 00 00 00 00 00 00 00 00 00   ................
0310  00 00 00 00 00 00 00 00 00 00 00 00 00 00 00 00   ................
0320  00 00 00 00 00 00 00 00 00 00 00 00 00 00 00 00   ................
0330  00 00 00 00 00 00 00 00 00 00 00 00 00 00 00 00   ................
0340  00 00 00 00 00 00 00 00 00 00 00 00 00 00 00 00   ................
0350  00 00 00 00 00 00 00 00 00 00 00 00 00 00 00 00   ................
0360  00 00 00 00 00 00 00 00 00 00 00 00 00 00 00 00   ................
0370  00 00 00 00 00 00 00 00 00 00 00 00 00 00 00 00   ................
0380  00 00 00 00 00 00 00 00 00 00 00 00 00 00 00 00   ................
0390  00 00 00 00 00 00 00 00 00 00 00 00 00 00 00 00   ................
03a0  00 00 00 00 00 00 00 00 00 00 00 00 00 00 00 00   ................
03b0  00 00 00 00 00 00 00 00 00 00 00 00 00 00 00 00   ................
03c0  00 00 00 00 00 00 00 00 00 00 00 00 00 00 00 00   ................
03d0  00 00 00 00 00 00 00 00 00 00 00 00 00 00 00 00   ................
03e0  00 00 00 00 00 00 00 00 00 00 00 00 00 00 00 00   ................
03f0  00 00 00 00 00 00 00 00 00 00 00 00 00 00 00 00   ................

    128 96.887978126   10.0.1.11             10.0.2.22             TCP      1090   54353 → 5038 [FIN, PSH, ACK] Seq=1025 Ack=1 Win=29312 Len=1024 TSval=1356793 TSecr=1356533

Frame 128: 1090 bytes on wire (8720 bits), 1090 bytes captured (8720 bits) on interface 0
Ethernet II, Src: 68:05:ca:36:33:a0, Dst: 68:05:ca:36:39:c7
Internet Protocol Version 4, Src: 10.0.1.11, Dst: 10.0.2.22
Transmission Control Protocol, Src Port: 54353 (54353), Dst Port: 5038 (5038), Seq: 1025, Ack: 1, Len: 1024
Data (1024 bytes)

0000  88 af 34 68 f0 7f 00 00 88 af 34 68 f0 7f 00 00   ..4h......4h....
0010  40 12 9a 00 00 00 00 00 40 12 9a 00 00 00 00 00   @.......@.......
0020  00 00 00 00 00 00 00 00 00 00 00 00 00 00 00 00   ................
0030  00 00 00 00 00 00 00 00 00 00 00 00 00 00 00 00   ................
0040  00 00 00 00 00 00 00 00 00 00 00 00 00 00 00 00   ................
0050  00 00 00 00 00 00 00 00 00 00 00 00 00 00 00 00   ................
0060  00 00 00 00 00 00 00 00 00 00 00 00 00 00 00 00   ................
0070  00 00 00 00 00 00 00 00 00 00 00 00 00 00 00 00   ................
0080  00 00 00 00 00 00 00 00 00 00 00 00 00 00 00 00   ................
0090  00 00 00 00 00 00 00 00 00 00 00 00 00 00 00 00   ................
00a0  00 00 00 00 00 00 00 00 00 00 00 00 00 00 00 00   ................
00b0  00 00 00 00 00 00 00 00 00 00 00 00 00 00 00 00   ................
00c0  00 00 00 00 00 00 00 00 00 00 00 00 00 00 00 00   ................
00d0  00 00 00 00 00 00 00 00 00 00 00 00 00 00 00 00   ................
00e0  00 00 00 00 00 00 00 00 00 00 00 00 00 00 00 00   ................
00f0  00 00 00 00 00 00 00 00 00 00 00 00 00 00 00 00   ................
0100  00 00 00 00 00 00 00 00 00 00 00 00 00 00 00 00   ................
0110  00 00 00 00 00 00 00 00 00 00 00 00 00 00 00 00   ................
0120  00 00 00 00 00 00 00 00 00 00 00 00 00 00 00 00   ................
0130  00 00 00 00 00 00 00 00 00 00 00 00 00 00 00 00   ................
0140  00 00 00 00 00 00 00 00 00 00 00 00 00 00 00 00   ................
0150  00 00 00 00 00 00 00 00 00 00 00 00 00 00 00 00   ................
0160  00 00 00 00 00 00 00 00 00 00 00 00 00 00 00 00   ................
0170  00 00 00 00 00 00 00 00 00 00 00 00 00 00 00 00   ................
0180  00 00 00 00 00 00 00 00 00 00 00 00 00 00 00 00   ................
0190  00 00 00 00 00 00 00 00 00 00 00 00 00 00 00 00   ................
01a0  00 00 00 00 00 00 00 00 00 00 00 00 00 00 00 00   ................
01b0  00 00 00 00 00 00 00 00 00 00 00 00 00 00 00 00   ................
01c0  00 00 00 00 00 00 00 00 00 00 00 00 00 00 00 00   ................
01d0  00 00 00 00 00 00 00 00 00 00 00 00 00 00 00 00   ................
01e0  00 00 00 00 00 00 00 00 00 00 00 00 00 00 00 00   ................
01f0  00 00 00 00 00 00 00 00 00 00 00 00 00 00 00 00   ................
0200  00 00 00 00 00 00 00 00 00 00 00 00 00 00 00 00   ................
0210  00 00 00 00 00 00 00 00 00 00 00 00 00 00 00 00   ................
0220  00 00 00 00 00 00 00 00 00 00 00 00 00 00 00 00   ................
0230  00 00 00 00 00 00 00 00 00 00 00 00 00 00 00 00   ................
0240  00 00 00 00 00 00 00 00 00 00 00 00 00 00 00 00   ................
0250  00 00 00 00 00 00 00 00 00 00 00 00 00 00 00 00   ................
0260  00 00 00 00 00 00 00 00 00 00 00 00 00 00 00 00   ................
0270  00 00 00 00 00 00 00 00 00 00 00 00 00 00 00 00   ................
0280  00 00 00 00 00 00 00 00 00 00 00 00 00 00 00 00   ................
0290  00 00 00 00 00 00 00 00 00 00 00 00 00 00 00 00   ................
02a0  00 00 00 00 00 00 00 00 00 00 00 00 00 00 00 00   ................
02b0  00 00 00 00 00 00 00 00 00 00 00 00 00 00 00 00   ................
02c0  00 00 00 00 00 00 00 00 00 00 00 00 00 00 00 00   ................
02d0  00 00 00 00 00 00 00 00 00 00 00 00 00 00 00 00   ................
02e0  00 00 00 00 00 00 00 00 00 00 00 00 00 00 00 00   ................
02f0  00 00 00 00 00 00 00 00 00 00 00 00 00 00 00 00   ................
0300  00 00 00 00 00 00 00 00 00 00 00 00 00 00 00 00   ................
0310  00 00 00 00 00 00 00 00 00 00 00 00 00 00 00 00   ................
0320  00 00 00 00 00 00 00 00 00 00 00 00 00 00 00 00   ................
0330  00 00 00 00 00 00 00 00 00 00 00 00 00 00 00 00   ................
0340  00 00 00 00 00 00 00 00 00 00 00 00 00 00 00 00   ................
0350  00 00 00 00 00 00 00 00 00 00 00 00 00 00 00 00   ................
0360  00 00 00 00 00 00 00 00 00 00 00 00 00 00 00 00   ................
0370  00 00 00 00 00 00 00 00 00 00 00 00 00 00 00 00   ................
0380  00 00 00 00 00 00 00 00 00 00 00 00 00 00 00 00   ................
0390  00 00 00 00 00 00 00 00 00 00 00 00 00 00 00 00   ................
03a0  00 00 00 00 00 00 00 00 00 00 00 00 00 00 00 00   ................
03b0  00 00 00 00 00 00 00 00 00 00 00 00 00 00 00 00   ................
03c0  00 00 00 00 00 00 00 00 00 00 00 00 00 00 00 00   ................
03d0  00 00 00 00 00 00 00 00 00 00 00 00 00 00 00 00   ................
03e0  00 00 00 00 00 00 00 00 00 00 00 00 00 00 00 00   ................
03f0  00 00 00 00 00 00 00 00 00 00 00 00 00 00 00 00   ................

    129 96.890336811   10.0.1.33             10.0.1.11             ICMP     590    Destination unreachable (Fragmentation needed)

Frame 129: 590 bytes on wire (4720 bits), 590 bytes captured (4720 bits) on interface 0
Ethernet II, Src: 68:05:ca:36:39:c7, Dst: 68:05:ca:36:33:a0
Internet Protocol Version 4, Src: 10.0.1.33, Dst: 10.0.1.11
Internet Control Message Protocol

    130 96.890386561   10.0.1.11             10.0.2.22             TCP      566    [TCP Retransmission] 54353 → 5038 [ACK] Seq=1 Ack=1 Win=29312 Len=500 TSval=1356794 TSecr=1356533

Frame 130: 566 bytes on wire (4528 bits), 566 bytes captured (4528 bits) on interface 0
Ethernet II, Src: 68:05:ca:36:33:a0, Dst: 68:05:ca:36:39:c7
Internet Protocol Version 4, Src: 10.0.1.11, Dst: 10.0.2.22
Transmission Control Protocol, Src Port: 54353 (54353), Dst Port: 5038 (5038), Seq: 1, Ack: 1, Len: 500

    131 96.890394283   10.0.1.11             10.0.2.22             TCP      566    [TCP Retransmission] 54353 → 5038 [ACK] Seq=501 Ack=1 Win=29312 Len=500 TSval=1356794 TSecr=1356533

Frame 131: 566 bytes on wire (4528 bits), 566 bytes captured (4528 bits) on interface 0
Ethernet II, Src: 68:05:ca:36:33:a0, Dst: 68:05:ca:36:39:c7
Internet Protocol Version 4, Src: 10.0.1.11, Dst: 10.0.2.22
Transmission Control Protocol, Src Port: 54353 (54353), Dst Port: 5038 (5038), Seq: 501, Ack: 1, Len: 500

    132 96.890397359   10.0.1.11             10.0.2.22             TCP      90     [TCP Retransmission] 54353 → 5038 [PSH, ACK] Seq=1001 Ack=1 Win=29312 Len=24 TSval=1356794 TSecr=1356533

Frame 132: 90 bytes on wire (720 bits), 90 bytes captured (720 bits) on interface 0
Ethernet II, Src: 68:05:ca:36:33:a0, Dst: 68:05:ca:36:39:c7
Internet Protocol Version 4, Src: 10.0.1.11, Dst: 10.0.2.22
Transmission Control Protocol, Src Port: 54353 (54353), Dst Port: 5038 (5038), Seq: 1001, Ack: 1, Len: 24

    133 96.890400800   10.0.1.11             10.0.2.22             TCP      566    [TCP Retransmission] 54353 → 5038 [ACK] Seq=1025 Ack=1 Win=29312 Len=500 TSval=1356794 TSecr=1356533

Frame 133: 566 bytes on wire (4528 bits), 566 bytes captured (4528 bits) on interface 0
Ethernet II, Src: 68:05:ca:36:33:a0, Dst: 68:05:ca:36:39:c7
Internet Protocol Version 4, Src: 10.0.1.11, Dst: 10.0.2.22
Transmission Control Protocol, Src Port: 54353 (54353), Dst Port: 5038 (5038), Seq: 1025, Ack: 1, Len: 500

    134 96.890408032   10.0.1.11             10.0.2.22             TCP      566    [TCP Retransmission] 54353 → 5038 [ACK] Seq=1525 Ack=1 Win=29312 Len=500 TSval=1356794 TSecr=1356533

Frame 134: 566 bytes on wire (4528 bits), 566 bytes captured (4528 bits) on interface 0
Ethernet II, Src: 68:05:ca:36:33:a0, Dst: 68:05:ca:36:39:c7
Internet Protocol Version 4, Src: 10.0.1.11, Dst: 10.0.2.22
Transmission Control Protocol, Src Port: 54353 (54353), Dst Port: 5038 (5038), Seq: 1525, Ack: 1, Len: 500

    135 96.890410603   10.0.1.11             10.0.2.22             TCP      90     [TCP Retransmission] 54353 → 5038 [FIN, PSH, ACK] Seq=2025 Ack=1 Win=29312 Len=24 TSval=1356794 TSecr=1356533

Frame 135: 90 bytes on wire (720 bits), 90 bytes captured (720 bits) on interface 0
Ethernet II, Src: 68:05:ca:36:33:a0, Dst: 68:05:ca:36:39:c7
Internet Protocol Version 4, Src: 10.0.1.11, Dst: 10.0.2.22
Transmission Control Protocol, Src Port: 54353 (54353), Dst Port: 5038 (5038), Seq: 2025, Ack: 1, Len: 24

    136 96.890796095   10.0.1.33             10.0.1.11             ICMP     590    Destination unreachable (Fragmentation needed)

Frame 136: 590 bytes on wire (4720 bits), 590 bytes captured (4720 bits) on interface 0
Ethernet II, Src: 68:05:ca:36:39:c7, Dst: 68:05:ca:36:33:a0
Internet Protocol Version 4, Src: 10.0.1.33, Dst: 10.0.1.11
Internet Control Message Protocol

    137 96.892395704   10.0.1.33             10.0.1.11             ICMP     590    Destination unreachable (Fragmentation needed)

Frame 137: 590 bytes on wire (4720 bits), 590 bytes captured (4720 bits) on interface 0
Ethernet II, Src: 68:05:ca:36:39:c7, Dst: 68:05:ca:36:33:a0
Internet Protocol Version 4, Src: 10.0.1.33, Dst: 10.0.1.11
Internet Control Message Protocol

    138 96.893037131   10.0.1.33             10.0.1.11             ICMP     590    Destination unreachable (Fragmentation needed)

Frame 138: 590 bytes on wire (4720 bits), 590 bytes captured (4720 bits) on interface 0
Ethernet II, Src: 68:05:ca:36:39:c7, Dst: 68:05:ca:36:33:a0
Internet Protocol Version 4, Src: 10.0.1.33, Dst: 10.0.1.11
Internet Control Message Protocol

    139 96.894537672   10.0.2.22             10.0.1.11             TCP      78     [TCP Window Update] 5038 → 54353 [ACK] Seq=1 Ack=1 Win=30080 Len=0 TSval=1356535 TSecr=1356793 SLE=1001 SRE=1025

Frame 139: 78 bytes on wire (624 bits), 78 bytes captured (624 bits) on interface 0
Ethernet II, Src: 68:05:ca:36:39:c7, Dst: 68:05:ca:36:33:a0
Internet Protocol Version 4, Src: 10.0.2.22, Dst: 10.0.1.11
Transmission Control Protocol, Src Port: 5038 (5038), Dst Port: 54353 (54353), Seq: 1, Ack: 1, Len: 0

    140 96.894998026   10.0.1.33             10.0.1.11             ICMP     590    Destination unreachable (Fragmentation needed)

Frame 140: 590 bytes on wire (4720 bits), 590 bytes captured (4720 bits) on interface 0
Ethernet II, Src: 68:05:ca:36:39:c7, Dst: 68:05:ca:36:33:a0
Internet Protocol Version 4, Src: 10.0.1.33, Dst: 10.0.1.11
Internet Control Message Protocol

    141 96.895521373   10.0.1.33             10.0.1.11             ICMP     590    Destination unreachable (Fragmentation needed)

Frame 141: 590 bytes on wire (4720 bits), 590 bytes captured (4720 bits) on interface 0
Ethernet II, Src: 68:05:ca:36:39:c7, Dst: 68:05:ca:36:33:a0
Internet Protocol Version 4, Src: 10.0.1.33, Dst: 10.0.1.11
Internet Control Message Protocol

    142 96.895758612   10.0.2.22             10.0.1.11             TCP      86     [TCP Window Update] 5038 → 54353 [ACK] Seq=1 Ack=1 Win=31104 Len=0 TSval=1356535 TSecr=1356793 SLE=2025 SRE=2050 SLE=1001 SRE=1025

Frame 142: 86 bytes on wire (688 bits), 86 bytes captured (688 bits) on interface 0
Ethernet II, Src: 68:05:ca:36:39:c7, Dst: 68:05:ca:36:33:a0
Internet Protocol Version 4, Src: 10.0.2.22, Dst: 10.0.1.11
Transmission Control Protocol, Src Port: 5038 (5038), Dst Port: 54353 (54353), Seq: 1, Ack: 1, Len: 0

    143 97.088015833   10.0.1.11             10.0.2.22             TCP      566    [TCP Retransmission] 54353 → 5038 [ACK] Seq=1 Ack=1 Win=29312 Len=500 TSval=1356844 TSecr=1356535

Frame 143: 566 bytes on wire (4528 bits), 566 bytes captured (4528 bits) on interface 0
Ethernet II, Src: 68:05:ca:36:33:a0, Dst: 68:05:ca:36:39:c7
Internet Protocol Version 4, Src: 10.0.1.11, Dst: 10.0.2.22
Transmission Control Protocol, Src Port: 54353 (54353), Dst Port: 5038 (5038), Seq: 1, Ack: 1, Len: 500

    144 97.089212829   10.0.1.33             10.0.1.11             ICMP     590    Destination unreachable (Fragmentation needed)

Frame 144: 590 bytes on wire (4720 bits), 590 bytes captured (4720 bits) on interface 0
Ethernet II, Src: 68:05:ca:36:39:c7, Dst: 68:05:ca:36:33:a0
Internet Protocol Version 4, Src: 10.0.1.33, Dst: 10.0.1.11
Internet Control Message Protocol

    145 97.488027222   10.0.1.11             10.0.2.22             TCP      566    [TCP Retransmission] 54353 → 5038 [ACK] Seq=1 Ack=1 Win=29312 Len=500 TSval=1356944 TSecr=1356535

Frame 145: 566 bytes on wire (4528 bits), 566 bytes captured (4528 bits) on interface 0
Ethernet II, Src: 68:05:ca:36:33:a0, Dst: 68:05:ca:36:39:c7
Internet Protocol Version 4, Src: 10.0.1.11, Dst: 10.0.2.22
Transmission Control Protocol, Src Port: 54353 (54353), Dst Port: 5038 (5038), Seq: 1, Ack: 1, Len: 500

    146 97.489175006   10.0.1.33             10.0.1.11             ICMP     590    Destination unreachable (Fragmentation needed)

Frame 146: 590 bytes on wire (4720 bits), 590 bytes captured (4720 bits) on interface 0
Ethernet II, Src: 68:05:ca:36:39:c7, Dst: 68:05:ca:36:33:a0
Internet Protocol Version 4, Src: 10.0.1.33, Dst: 10.0.1.11
Internet Control Message Protocol

    147 98.288043271   10.0.1.11             10.0.2.22             TCP      566    [TCP Retransmission] 54353 → 5038 [ACK] Seq=1 Ack=1 Win=29312 Len=500 TSval=1357144 TSecr=1356535

Frame 147: 566 bytes on wire (4528 bits), 566 bytes captured (4528 bits) on interface 0
Ethernet II, Src: 68:05:ca:36:33:a0, Dst: 68:05:ca:36:39:c7
Internet Protocol Version 4, Src: 10.0.1.11, Dst: 10.0.2.22
Transmission Control Protocol, Src Port: 54353 (54353), Dst Port: 5038 (5038), Seq: 1, Ack: 1, Len: 500

    148 98.289225051   10.0.1.33             10.0.1.11             ICMP     590    Destination unreachable (Fragmentation needed)

Frame 148: 590 bytes on wire (4720 bits), 590 bytes captured (4720 bits) on interface 0
Ethernet II, Src: 68:05:ca:36:39:c7, Dst: 68:05:ca:36:33:a0
Internet Protocol Version 4, Src: 10.0.1.33, Dst: 10.0.1.11
Internet Control Message Protocol

    149 99.892040038   10.0.1.11             10.0.2.22             TCP      566    [TCP Retransmission] 54353 → 5038 [ACK] Seq=1 Ack=1 Win=29312 Len=500 TSval=1357545 TSecr=1356535

Frame 149: 566 bytes on wire (4528 bits), 566 bytes captured (4528 bits) on interface 0
Ethernet II, Src: 68:05:ca:36:33:a0, Dst: 68:05:ca:36:39:c7
Internet Protocol Version 4, Src: 10.0.1.11, Dst: 10.0.2.22
Transmission Control Protocol, Src Port: 54353 (54353), Dst Port: 5038 (5038), Seq: 1, Ack: 1, Len: 500

    150 99.893246958   10.0.1.33             10.0.1.11             ICMP     590    Destination unreachable (Fragmentation needed)

Frame 150: 590 bytes on wire (4720 bits), 590 bytes captured (4720 bits) on interface 0
Ethernet II, Src: 68:05:ca:36:39:c7, Dst: 68:05:ca:36:33:a0
Internet Protocol Version 4, Src: 10.0.1.33, Dst: 10.0.1.11
Internet Control Message Protocol

    157 103.104071949  10.0.1.11             10.0.2.22             TCP      566    [TCP Retransmission] 54353 → 5038 [ACK] Seq=1 Ack=1 Win=29312 Len=500 TSval=1358348 TSecr=1356535

Frame 157: 566 bytes on wire (4528 bits), 566 bytes captured (4528 bits) on interface 0
Ethernet II, Src: 68:05:ca:36:33:a0, Dst: 68:05:ca:36:39:c7
Internet Protocol Version 4, Src: 10.0.1.11, Dst: 10.0.2.22
Transmission Control Protocol, Src Port: 54353 (54353), Dst Port: 5038 (5038), Seq: 1, Ack: 1, Len: 500

    158 103.105274189  10.0.1.33             10.0.1.11             ICMP     590    Destination unreachable (Fragmentation needed)

Frame 158: 590 bytes on wire (4720 bits), 590 bytes captured (4720 bits) on interface 0
Ethernet II, Src: 68:05:ca:36:39:c7, Dst: 68:05:ca:36:33:a0
Internet Protocol Version 4, Src: 10.0.1.33, Dst: 10.0.1.11
Internet Control Message Protocol

    163 106.898429233  10.0.1.11             10.0.2.22             TCP      66     60758 → 4444 [FIN, ACK] Seq=79 Ack=16 Win=29312 Len=0 TSval=1359296 TSecr=1356533

Frame 163: 66 bytes on wire (528 bits), 66 bytes captured (528 bits) on interface 0
Ethernet II, Src: 68:05:ca:36:33:a0, Dst: 68:05:ca:36:39:c7
Internet Protocol Version 4, Src: 10.0.1.11, Dst: 10.0.2.22
Transmission Control Protocol, Src Port: 60758 (60758), Dst Port: 4444 (4444), Seq: 79, Ack: 16, Len: 0

    164 106.937874430  10.0.2.22             10.0.1.11             TCP      66     4444 → 60758 [ACK] Seq=16 Ack=80 Win=29056 Len=0 TSval=1359046 TSecr=1359296

Frame 164: 66 bytes on wire (528 bits), 66 bytes captured (528 bits) on interface 0
Ethernet II, Src: 68:05:ca:36:39:c7, Dst: 68:05:ca:36:33:a0
Internet Protocol Version 4, Src: 10.0.2.22, Dst: 10.0.1.11
Transmission Control Protocol, Src Port: 4444 (4444), Dst Port: 60758 (60758), Seq: 16, Ack: 80, Len: 0

    165 109.520058720  10.0.1.11             10.0.2.22             TCP      566    [TCP Retransmission] 54353 → 5038 [ACK] Seq=1 Ack=1 Win=29312 Len=500 TSval=1359952 TSecr=1356535

Frame 165: 566 bytes on wire (4528 bits), 566 bytes captured (4528 bits) on interface 0
Ethernet II, Src: 68:05:ca:36:33:a0, Dst: 68:05:ca:36:39:c7
Internet Protocol Version 4, Src: 10.0.1.11, Dst: 10.0.2.22
Transmission Control Protocol, Src Port: 54353 (54353), Dst Port: 5038 (5038), Seq: 1, Ack: 1, Len: 500

    166 109.521277363  10.0.1.33             10.0.1.11             ICMP     590    Destination unreachable (Fragmentation needed)

Frame 166: 590 bytes on wire (4720 bits), 590 bytes captured (4720 bits) on interface 0
Ethernet II, Src: 68:05:ca:36:39:c7, Dst: 68:05:ca:36:33:a0
Internet Protocol Version 4, Src: 10.0.1.33, Dst: 10.0.1.11
Internet Control Message Protocol

    179 122.352023996  10.0.1.11             10.0.2.22             TCP      566    [TCP Retransmission] 54353 → 5038 [ACK] Seq=1 Ack=1 Win=29312 Len=500 TSval=1363160 TSecr=1356535

Frame 179: 566 bytes on wire (4528 bits), 566 bytes captured (4528 bits) on interface 0
Ethernet II, Src: 68:05:ca:36:33:a0, Dst: 68:05:ca:36:39:c7
Internet Protocol Version 4, Src: 10.0.1.11, Dst: 10.0.2.22
Transmission Control Protocol, Src Port: 54353 (54353), Dst Port: 5038 (5038), Seq: 1, Ack: 1, Len: 500

    180 122.353193179  10.0.1.33             10.0.1.11             ICMP     590    Destination unreachable (Fragmentation needed)

Frame 180: 590 bytes on wire (4720 bits), 590 bytes captured (4720 bits) on interface 0
Ethernet II, Src: 68:05:ca:36:39:c7, Dst: 68:05:ca:36:33:a0
Internet Protocol Version 4, Src: 10.0.1.33, Dst: 10.0.1.11
Internet Control Message Protocol

    203 147.984068813  10.0.1.11             10.0.2.22             TCP      566    [TCP Retransmission] 54353 → 5038 [ACK] Seq=1 Ack=1 Win=29312 Len=500 TSval=1369568 TSecr=1356535

Frame 203: 566 bytes on wire (4528 bits), 566 bytes captured (4528 bits) on interface 0
Ethernet II, Src: 68:05:ca:36:33:a0, Dst: 68:05:ca:36:39:c7
Internet Protocol Version 4, Src: 10.0.1.11, Dst: 10.0.2.22
Transmission Control Protocol, Src Port: 54353 (54353), Dst Port: 5038 (5038), Seq: 1, Ack: 1, Len: 500

    204 147.985216761  10.0.1.33             10.0.1.11             ICMP     590    Destination unreachable (Fragmentation needed)

Frame 204: 590 bytes on wire (4720 bits), 590 bytes captured (4720 bits) on interface 0
Ethernet II, Src: 68:05:ca:36:39:c7, Dst: 68:05:ca:36:33:a0
Internet Protocol Version 4, Src: 10.0.1.33, Dst: 10.0.1.11
Internet Control Message Protocol
