      1 0.000000000    10.0.5.11             10.0.5.22             TCP      74     33230 → 23 [SYN] Seq=0 Win=29200 Len=0 MSS=1460 SACK_PERM=1 TSval=1525233 TSecr=0 WS=128

Frame 1: 74 bytes on wire (592 bits), 74 bytes captured (592 bits) on interface 0
Ethernet II, Src: 68:05:ca:39:cc:79, Dst: 68:05:ca:39:e1:36
Internet Protocol Version 4, Src: 10.0.5.11, Dst: 10.0.5.22
Transmission Control Protocol, Src Port: 33230 (33230), Dst Port: 23 (23), Seq: 0, Len: 0
    Source Port: 33230
    Destination Port: 23
    [Stream index: 0]
    [TCP Segment Len: 0]
    Sequence number: 0    (relative sequence number)
    Acknowledgment number: 0
    Header Length: 40 bytes
    Flags: 0x002 (SYN)
    Window size value: 29200
    [Calculated window size: 29200]
    Checksum: 0x1e4f [validation disabled]
    Urgent pointer: 0
    Options: (20 bytes), Maximum segment size, SACK permitted, Timestamps, No-Operation (NOP), Window scale

      2 0.000388357    10.0.5.22             10.0.5.11             TCP      74     23 → 33230 [SYN, ACK] Seq=0 Ack=1 Win=28960 Len=0 MSS=1460 SACK_PERM=1 TSval=1524972 TSecr=1525233 WS=128

Frame 2: 74 bytes on wire (592 bits), 74 bytes captured (592 bits) on interface 0
Ethernet II, Src: 68:05:ca:39:e1:36, Dst: 68:05:ca:39:cc:79
Internet Protocol Version 4, Src: 10.0.5.22, Dst: 10.0.5.11
Transmission Control Protocol, Src Port: 23 (23), Dst Port: 33230 (33230), Seq: 0, Ack: 1, Len: 0
    Source Port: 23
    Destination Port: 33230
    [Stream index: 0]
    [TCP Segment Len: 0]
    Sequence number: 0    (relative sequence number)
    Acknowledgment number: 1    (relative ack number)
    Header Length: 40 bytes
    Flags: 0x012 (SYN, ACK)
    Window size value: 28960
    [Calculated window size: 28960]
    Checksum: 0x479a [validation disabled]
    Urgent pointer: 0
    Options: (20 bytes), Maximum segment size, SACK permitted, Timestamps, No-Operation (NOP), Window scale
    [SEQ/ACK analysis]

      3 0.000417125    10.0.5.11             10.0.5.22             TCP      66     33230 → 23 [ACK] Seq=1 Ack=1 Win=29312 Len=0 TSval=1525233 TSecr=1524972

Frame 3: 66 bytes on wire (528 bits), 66 bytes captured (528 bits) on interface 0
Ethernet II, Src: 68:05:ca:39:cc:79, Dst: 68:05:ca:39:e1:36
Internet Protocol Version 4, Src: 10.0.5.11, Dst: 10.0.5.22
Transmission Control Protocol, Src Port: 33230 (33230), Dst Port: 23 (23), Seq: 1, Ack: 1, Len: 0
    Source Port: 33230
    Destination Port: 23
    [Stream index: 0]
    [TCP Segment Len: 0]
    Sequence number: 1    (relative sequence number)
    Acknowledgment number: 1    (relative ack number)
    Header Length: 32 bytes
    Flags: 0x010 (ACK)
    Window size value: 229
    [Calculated window size: 29312]
    [Window size scaling factor: 128]
    Checksum: 0x1e47 [validation disabled]
    Urgent pointer: 0
    Options: (12 bytes), No-Operation (NOP), No-Operation (NOP), Timestamps
    [SEQ/ACK analysis]

      4 0.000556972    10.0.5.11             10.0.5.22             TELNET   93     Telnet Data ...

Frame 4: 93 bytes on wire (744 bits), 93 bytes captured (744 bits) on interface 0
Ethernet II, Src: 68:05:ca:39:cc:79, Dst: 68:05:ca:39:e1:36
Internet Protocol Version 4, Src: 10.0.5.11, Dst: 10.0.5.22
Transmission Control Protocol, Src Port: 33230 (33230), Dst Port: 23 (23), Seq: 1, Ack: 1, Len: 27
    Source Port: 33230
    Destination Port: 23
    [Stream index: 0]
    [TCP Segment Len: 27]
    Sequence number: 1    (relative sequence number)
    [Next sequence number: 28    (relative sequence number)]
    Acknowledgment number: 1    (relative ack number)
    Header Length: 32 bytes
    Flags: 0x018 (PSH, ACK)
    Window size value: 229
    [Calculated window size: 29312]
    [Window size scaling factor: 128]
    Checksum: 0x1e62 [validation disabled]
    Urgent pointer: 0
    Options: (12 bytes), No-Operation (NOP), No-Operation (NOP), Timestamps
    [SEQ/ACK analysis]
Telnet

      5 0.000987380    10.0.5.22             10.0.5.11             TCP      66     23 → 33230 [ACK] Seq=1 Ack=28 Win=29056 Len=0 TSval=1524972 TSecr=1525233

Frame 5: 66 bytes on wire (528 bits), 66 bytes captured (528 bits) on interface 0
Ethernet II, Src: 68:05:ca:39:e1:36, Dst: 68:05:ca:39:cc:79
Internet Protocol Version 4, Src: 10.0.5.22, Dst: 10.0.5.11
Transmission Control Protocol, Src Port: 23 (23), Dst Port: 33230 (33230), Seq: 1, Ack: 28, Len: 0
    Source Port: 23
    Destination Port: 33230
    [Stream index: 0]
    [TCP Segment Len: 0]
    Sequence number: 1    (relative sequence number)
    Acknowledgment number: 28    (relative ack number)
    Header Length: 32 bytes
    Flags: 0x010 (ACK)
    Window size value: 227
    [Calculated window size: 29056]
    [Window size scaling factor: 128]
    Checksum: 0xe688 [validation disabled]
    Urgent pointer: 0
    Options: (12 bytes), No-Operation (NOP), No-Operation (NOP), Timestamps
    [SEQ/ACK analysis]

      6 5.003486973    68:05:ca:39:cc:79     68:05:ca:39:e1:36     ARP      42     Who has 10.0.5.22? Tell 10.0.5.11

Frame 6: 42 bytes on wire (336 bits), 42 bytes captured (336 bits) on interface 0
Ethernet II, Src: 68:05:ca:39:cc:79, Dst: 68:05:ca:39:e1:36
Address Resolution Protocol (request)

      7 5.003770435    68:05:ca:39:e1:36     68:05:ca:39:cc:79     ARP      60     10.0.5.22 is at 68:05:ca:39:e1:36

Frame 7: 60 bytes on wire (480 bits), 60 bytes captured (480 bits) on interface 0
Ethernet II, Src: 68:05:ca:39:e1:36, Dst: 68:05:ca:39:cc:79
Address Resolution Protocol (reply)

      8 10.487115293   10.0.5.22             10.0.5.11             TELNET   78     Telnet Data ...

Frame 8: 78 bytes on wire (624 bits), 78 bytes captured (624 bits) on interface 0
Ethernet II, Src: 68:05:ca:39:e1:36, Dst: 68:05:ca:39:cc:79
Internet Protocol Version 4, Src: 10.0.5.22, Dst: 10.0.5.11
Transmission Control Protocol, Src Port: 23 (23), Dst Port: 33230 (33230), Seq: 1, Ack: 28, Len: 12
    Source Port: 23
    Destination Port: 33230
    [Stream index: 0]
    [TCP Segment Len: 12]
    Sequence number: 1    (relative sequence number)
    [Next sequence number: 13    (relative sequence number)]
    Acknowledgment number: 28    (relative ack number)
    Header Length: 32 bytes
    Flags: 0x018 (PSH, ACK)
    Window size value: 227
    [Calculated window size: 29056]
    [Window size scaling factor: 128]
    Checksum: 0xa4f4 [validation disabled]
    Urgent pointer: 0
    Options: (12 bytes), No-Operation (NOP), No-Operation (NOP), Timestamps
    [SEQ/ACK analysis]
Telnet

      9 10.487143932   10.0.5.11             10.0.5.22             TCP      66     33230 → 23 [ACK] Seq=28 Ack=13 Win=29312 Len=0 TSval=1527854 TSecr=1527593

Frame 9: 66 bytes on wire (528 bits), 66 bytes captured (528 bits) on interface 0
Ethernet II, Src: 68:05:ca:39:cc:79, Dst: 68:05:ca:39:e1:36
Internet Protocol Version 4, Src: 10.0.5.11, Dst: 10.0.5.22
Transmission Control Protocol, Src Port: 33230 (33230), Dst Port: 23 (23), Seq: 28, Ack: 13, Len: 0
    Source Port: 33230
    Destination Port: 23
    [Stream index: 0]
    [TCP Segment Len: 0]
    Sequence number: 28    (relative sequence number)
    Acknowledgment number: 13    (relative ack number)
    Header Length: 32 bytes
    Flags: 0x010 (ACK)
    Window size value: 229
    [Calculated window size: 29312]
    [Window size scaling factor: 128]
    Checksum: 0x1e47 [validation disabled]
    Urgent pointer: 0
    Options: (12 bytes), No-Operation (NOP), No-Operation (NOP), Timestamps
    [SEQ/ACK analysis]

     10 10.487528999   10.0.5.22             10.0.5.11             TELNET   105    Telnet Data ...

Frame 10: 105 bytes on wire (840 bits), 105 bytes captured (840 bits) on interface 0
Ethernet II, Src: 68:05:ca:39:e1:36, Dst: 68:05:ca:39:cc:79
Internet Protocol Version 4, Src: 10.0.5.22, Dst: 10.0.5.11
Transmission Control Protocol, Src Port: 23 (23), Dst Port: 33230 (33230), Seq: 13, Ack: 28, Len: 39
    Source Port: 23
    Destination Port: 33230
    [Stream index: 0]
    [TCP Segment Len: 39]
    Sequence number: 13    (relative sequence number)
    [Next sequence number: 52    (relative sequence number)]
    Acknowledgment number: 28    (relative ack number)
    Header Length: 32 bytes
    Flags: 0x018 (PSH, ACK)
    Window size value: 227
    [Calculated window size: 29056]
    [Window size scaling factor: 128]
    Checksum: 0xf71a [validation disabled]
    Urgent pointer: 0
    Options: (12 bytes), No-Operation (NOP), No-Operation (NOP), Timestamps
    [SEQ/ACK analysis]
Telnet

     11 10.487543883   10.0.5.11             10.0.5.22             TCP      66     33230 → 23 [ACK] Seq=28 Ack=52 Win=29312 Len=0 TSval=1527855 TSecr=1527593

Frame 11: 66 bytes on wire (528 bits), 66 bytes captured (528 bits) on interface 0
Ethernet II, Src: 68:05:ca:39:cc:79, Dst: 68:05:ca:39:e1:36
Internet Protocol Version 4, Src: 10.0.5.11, Dst: 10.0.5.22
Transmission Control Protocol, Src Port: 33230 (33230), Dst Port: 23 (23), Seq: 28, Ack: 52, Len: 0
    Source Port: 33230
    Destination Port: 23
    [Stream index: 0]
    [TCP Segment Len: 0]
    Sequence number: 28    (relative sequence number)
    Acknowledgment number: 52    (relative ack number)
    Header Length: 32 bytes
    Flags: 0x010 (ACK)
    Window size value: 229
    [Calculated window size: 29312]
    [Window size scaling factor: 128]
    Checksum: 0x1e47 [validation disabled]
    Urgent pointer: 0
    Options: (12 bytes), No-Operation (NOP), No-Operation (NOP), Timestamps
    [SEQ/ACK analysis]

     12 10.487649812   10.0.5.11             10.0.5.22             TELNET   147    Telnet Data ...

Frame 12: 147 bytes on wire (1176 bits), 147 bytes captured (1176 bits) on interface 0
Ethernet II, Src: 68:05:ca:39:cc:79, Dst: 68:05:ca:39:e1:36
Internet Protocol Version 4, Src: 10.0.5.11, Dst: 10.0.5.22
Transmission Control Protocol, Src Port: 33230 (33230), Dst Port: 23 (23), Seq: 28, Ack: 52, Len: 81
    Source Port: 33230
    Destination Port: 23
    [Stream index: 0]
    [TCP Segment Len: 81]
    Sequence number: 28    (relative sequence number)
    [Next sequence number: 109    (relative sequence number)]
    Acknowledgment number: 52    (relative ack number)
    Header Length: 32 bytes
    Flags: 0x018 (PSH, ACK)
    Window size value: 229
    [Calculated window size: 29312]
    [Window size scaling factor: 128]
    Checksum: 0x1e98 [validation disabled]
    Urgent pointer: 0
    Options: (12 bytes), No-Operation (NOP), No-Operation (NOP), Timestamps
    [SEQ/ACK analysis]
Telnet

     13 10.488165233   10.0.5.22             10.0.5.11             TCP      66     23 → 33230 [ACK] Seq=52 Ack=109 Win=29056 Len=0 TSval=1527594 TSecr=1527855

Frame 13: 66 bytes on wire (528 bits), 66 bytes captured (528 bits) on interface 0
Ethernet II, Src: 68:05:ca:39:e1:36, Dst: 68:05:ca:39:cc:79
Internet Protocol Version 4, Src: 10.0.5.22, Dst: 10.0.5.11
Transmission Control Protocol, Src Port: 23 (23), Dst Port: 33230 (33230), Seq: 52, Ack: 109, Len: 0
    Source Port: 23
    Destination Port: 33230
    [Stream index: 0]
    [TCP Segment Len: 0]
    Sequence number: 52    (relative sequence number)
    Acknowledgment number: 109    (relative ack number)
    Header Length: 32 bytes
    Flags: 0x010 (ACK)
    Window size value: 227
    [Calculated window size: 29056]
    [Window size scaling factor: 128]
    Checksum: 0xd188 [validation disabled]
    Urgent pointer: 0
    Options: (12 bytes), No-Operation (NOP), No-Operation (NOP), Timestamps
    [SEQ/ACK analysis]

     14 10.488443883   10.0.5.22             10.0.5.11             TELNET   69     Telnet Data ...

Frame 14: 69 bytes on wire (552 bits), 69 bytes captured (552 bits) on interface 0
Ethernet II, Src: 68:05:ca:39:e1:36, Dst: 68:05:ca:39:cc:79
Internet Protocol Version 4, Src: 10.0.5.22, Dst: 10.0.5.11
Transmission Control Protocol, Src Port: 23 (23), Dst Port: 33230 (33230), Seq: 52, Ack: 109, Len: 3
    Source Port: 23
    Destination Port: 33230
    [Stream index: 0]
    [TCP Segment Len: 3]
    Sequence number: 52    (relative sequence number)
    [Next sequence number: 55    (relative sequence number)]
    Acknowledgment number: 109    (relative ack number)
    Header Length: 32 bytes
    Flags: 0x018 (PSH, ACK)
    Window size value: 227
    [Calculated window size: 29056]
    [Window size scaling factor: 128]
    Checksum: 0xd07f [validation disabled]
    Urgent pointer: 0
    Options: (12 bytes), No-Operation (NOP), No-Operation (NOP), Timestamps
    [SEQ/ACK analysis]
Telnet

     15 10.488496774   10.0.5.11             10.0.5.22             TELNET   69     Telnet Data ...

Frame 15: 69 bytes on wire (552 bits), 69 bytes captured (552 bits) on interface 0
Ethernet II, Src: 68:05:ca:39:cc:79, Dst: 68:05:ca:39:e1:36
Internet Protocol Version 4, Src: 10.0.5.11, Dst: 10.0.5.22
Transmission Control Protocol, Src Port: 33230 (33230), Dst Port: 23 (23), Seq: 109, Ack: 55, Len: 3
    Source Port: 33230
    Destination Port: 23
    [Stream index: 0]
    [TCP Segment Len: 3]
    Sequence number: 109    (relative sequence number)
    [Next sequence number: 112    (relative sequence number)]
    Acknowledgment number: 55    (relative ack number)
    Header Length: 32 bytes
    Flags: 0x018 (PSH, ACK)
    Window size value: 229
    [Calculated window size: 29312]
    [Window size scaling factor: 128]
    Checksum: 0x1e4a [validation disabled]
    Urgent pointer: 0
    Options: (12 bytes), No-Operation (NOP), No-Operation (NOP), Timestamps
    [SEQ/ACK analysis]
Telnet

     16 10.489760648   10.0.5.22             10.0.5.11             TELNET   69     Telnet Data ...

Frame 16: 69 bytes on wire (552 bits), 69 bytes captured (552 bits) on interface 0
Ethernet II, Src: 68:05:ca:39:e1:36, Dst: 68:05:ca:39:cc:79
Internet Protocol Version 4, Src: 10.0.5.22, Dst: 10.0.5.11
Transmission Control Protocol, Src Port: 23 (23), Dst Port: 33230 (33230), Seq: 55, Ack: 112, Len: 3
    Source Port: 23
    Destination Port: 33230
    [Stream index: 0]
    [TCP Segment Len: 3]
    Sequence number: 55    (relative sequence number)
    [Next sequence number: 58    (relative sequence number)]
    Acknowledgment number: 112    (relative ack number)
    Header Length: 32 bytes
    Flags: 0x018 (PSH, ACK)
    Window size value: 227
    [Calculated window size: 29056]
    [Window size scaling factor: 128]
    Checksum: 0xd07b [validation disabled]
    Urgent pointer: 0
    Options: (12 bytes), No-Operation (NOP), No-Operation (NOP), Timestamps
    [SEQ/ACK analysis]
Telnet

     17 10.489824440   10.0.5.11             10.0.5.22             TELNET   69     Telnet Data ...

Frame 17: 69 bytes on wire (552 bits), 69 bytes captured (552 bits) on interface 0
Ethernet II, Src: 68:05:ca:39:cc:79, Dst: 68:05:ca:39:e1:36
Internet Protocol Version 4, Src: 10.0.5.11, Dst: 10.0.5.22
Transmission Control Protocol, Src Port: 33230 (33230), Dst Port: 23 (23), Seq: 112, Ack: 58, Len: 3
    Source Port: 33230
    Destination Port: 23
    [Stream index: 0]
    [TCP Segment Len: 3]
    Sequence number: 112    (relative sequence number)
    [Next sequence number: 115    (relative sequence number)]
    Acknowledgment number: 58    (relative ack number)
    Header Length: 32 bytes
    Flags: 0x018 (PSH, ACK)
    Window size value: 229
    [Calculated window size: 29312]
    [Window size scaling factor: 128]
    Checksum: 0x1e4a [validation disabled]
    Urgent pointer: 0
    Options: (12 bytes), No-Operation (NOP), No-Operation (NOP), Timestamps
    [SEQ/ACK analysis]
Telnet

     18 10.490207823   10.0.5.22             10.0.5.11             TELNET   86     Telnet Data ...

Frame 18: 86 bytes on wire (688 bits), 86 bytes captured (688 bits) on interface 0
Ethernet II, Src: 68:05:ca:39:e1:36, Dst: 68:05:ca:39:cc:79
Internet Protocol Version 4, Src: 10.0.5.22, Dst: 10.0.5.11
Transmission Control Protocol, Src Port: 23 (23), Dst Port: 33230 (33230), Seq: 58, Ack: 115, Len: 20
    Source Port: 23
    Destination Port: 33230
    [Stream index: 0]
    [TCP Segment Len: 20]
    Sequence number: 58    (relative sequence number)
    [Next sequence number: 78    (relative sequence number)]
    Acknowledgment number: 115    (relative ack number)
    Header Length: 32 bytes
    Flags: 0x018 (PSH, ACK)
    Window size value: 227
    [Calculated window size: 29056]
    [Window size scaling factor: 128]
    Checksum: 0x5bac [validation disabled]
    Urgent pointer: 0
    Options: (12 bytes), No-Operation (NOP), No-Operation (NOP), Timestamps
    [SEQ/ACK analysis]
Telnet

     19 10.527496749   10.0.5.11             10.0.5.22             TCP      66     33230 → 23 [ACK] Seq=115 Ack=78 Win=29312 Len=0 TSval=1527865 TSecr=1527594

Frame 19: 66 bytes on wire (528 bits), 66 bytes captured (528 bits) on interface 0
Ethernet II, Src: 68:05:ca:39:cc:79, Dst: 68:05:ca:39:e1:36
Internet Protocol Version 4, Src: 10.0.5.11, Dst: 10.0.5.22
Transmission Control Protocol, Src Port: 33230 (33230), Dst Port: 23 (23), Seq: 115, Ack: 78, Len: 0
    Source Port: 33230
    Destination Port: 23
    [Stream index: 0]
    [TCP Segment Len: 0]
    Sequence number: 115    (relative sequence number)
    Acknowledgment number: 78    (relative ack number)
    Header Length: 32 bytes
    Flags: 0x010 (ACK)
    Window size value: 229
    [Calculated window size: 29312]
    [Window size scaling factor: 128]
    Checksum: 0x1e47 [validation disabled]
    Urgent pointer: 0
    Options: (12 bytes), No-Operation (NOP), No-Operation (NOP), Timestamps
    [SEQ/ACK analysis]

     20 10.599860171   10.0.5.22             10.0.5.11             TELNET   79     Telnet Data ...

Frame 20: 79 bytes on wire (632 bits), 79 bytes captured (632 bits) on interface 0
Ethernet II, Src: 68:05:ca:39:e1:36, Dst: 68:05:ca:39:cc:79
Internet Protocol Version 4, Src: 10.0.5.22, Dst: 10.0.5.11
Transmission Control Protocol, Src Port: 23 (23), Dst Port: 33230 (33230), Seq: 78, Ack: 115, Len: 13
    Source Port: 23
    Destination Port: 33230
    [Stream index: 0]
    [TCP Segment Len: 13]
    Sequence number: 78    (relative sequence number)
    [Next sequence number: 91    (relative sequence number)]
    Acknowledgment number: 115    (relative ack number)
    Header Length: 32 bytes
    Flags: 0x018 (PSH, ACK)
    Window size value: 227
    [Calculated window size: 29056]
    [Window size scaling factor: 128]
    Checksum: 0x3d28 [validation disabled]
    Urgent pointer: 0
    Options: (12 bytes), No-Operation (NOP), No-Operation (NOP), Timestamps
    [SEQ/ACK analysis]
Telnet

     21 10.599874735   10.0.5.11             10.0.5.22             TCP      66     33230 → 23 [ACK] Seq=115 Ack=91 Win=29312 Len=0 TSval=1527883 TSecr=1527622

Frame 21: 66 bytes on wire (528 bits), 66 bytes captured (528 bits) on interface 0
Ethernet II, Src: 68:05:ca:39:cc:79, Dst: 68:05:ca:39:e1:36
Internet Protocol Version 4, Src: 10.0.5.11, Dst: 10.0.5.22
Transmission Control Protocol, Src Port: 33230 (33230), Dst Port: 23 (23), Seq: 115, Ack: 91, Len: 0
    Source Port: 33230
    Destination Port: 23
    [Stream index: 0]
    [TCP Segment Len: 0]
    Sequence number: 115    (relative sequence number)
    Acknowledgment number: 91    (relative ack number)
    Header Length: 32 bytes
    Flags: 0x010 (ACK)
    Window size value: 229
    [Calculated window size: 29312]
    [Window size scaling factor: 128]
    Checksum: 0x1e47 [validation disabled]
    Urgent pointer: 0
    Options: (12 bytes), No-Operation (NOP), No-Operation (NOP), Timestamps
    [SEQ/ACK analysis]

     22 21.444032914   10.0.5.11             10.0.5.22             TELNET   67     Telnet Data ...

Frame 22: 67 bytes on wire (536 bits), 67 bytes captured (536 bits) on interface 0
Ethernet II, Src: 68:05:ca:39:cc:79, Dst: 68:05:ca:39:e1:36
Internet Protocol Version 4, Src: 10.0.5.11, Dst: 10.0.5.22
Transmission Control Protocol, Src Port: 33230 (33230), Dst Port: 23 (23), Seq: 115, Ack: 91, Len: 1
    Source Port: 33230
    Destination Port: 23
    [Stream index: 0]
    [TCP Segment Len: 1]
    Sequence number: 115    (relative sequence number)
    [Next sequence number: 116    (relative sequence number)]
    Acknowledgment number: 91    (relative ack number)
    Header Length: 32 bytes
    Flags: 0x018 (PSH, ACK)
    Window size value: 229
    [Calculated window size: 29312]
    [Window size scaling factor: 128]
    Checksum: 0x1e48 [validation disabled]
    Urgent pointer: 0
    Options: (12 bytes), No-Operation (NOP), No-Operation (NOP), Timestamps
    [SEQ/ACK analysis]
Telnet

     23 21.444490532   10.0.5.22             10.0.5.11             TELNET   67     Telnet Data ...

Frame 23: 67 bytes on wire (536 bits), 67 bytes captured (536 bits) on interface 0
Ethernet II, Src: 68:05:ca:39:e1:36, Dst: 68:05:ca:39:cc:79
Internet Protocol Version 4, Src: 10.0.5.22, Dst: 10.0.5.11
Transmission Control Protocol, Src Port: 23 (23), Dst Port: 33230 (33230), Seq: 91, Ack: 116, Len: 1
    Source Port: 23
    Destination Port: 33230
    [Stream index: 0]
    [TCP Segment Len: 1]
    Sequence number: 91    (relative sequence number)
    [Next sequence number: 92    (relative sequence number)]
    Acknowledgment number: 116    (relative ack number)
    Header Length: 32 bytes
    Flags: 0x018 (PSH, ACK)
    Window size value: 227
    [Calculated window size: 29056]
    [Window size scaling factor: 128]
    Checksum: 0x48eb [validation disabled]
    Urgent pointer: 0
    Options: (12 bytes), No-Operation (NOP), No-Operation (NOP), Timestamps
    [SEQ/ACK analysis]
Telnet

     24 21.444514569   10.0.5.11             10.0.5.22             TCP      66     33230 → 23 [ACK] Seq=116 Ack=92 Win=29312 Len=0 TSval=1530594 TSecr=1530333

Frame 24: 66 bytes on wire (528 bits), 66 bytes captured (528 bits) on interface 0
Ethernet II, Src: 68:05:ca:39:cc:79, Dst: 68:05:ca:39:e1:36
Internet Protocol Version 4, Src: 10.0.5.11, Dst: 10.0.5.22
Transmission Control Protocol, Src Port: 33230 (33230), Dst Port: 23 (23), Seq: 116, Ack: 92, Len: 0
    Source Port: 33230
    Destination Port: 23
    [Stream index: 0]
    [TCP Segment Len: 0]
    Sequence number: 116    (relative sequence number)
    Acknowledgment number: 92    (relative ack number)
    Header Length: 32 bytes
    Flags: 0x010 (ACK)
    Window size value: 229
    [Calculated window size: 29312]
    [Window size scaling factor: 128]
    Checksum: 0x1e47 [validation disabled]
    Urgent pointer: 0
    Options: (12 bytes), No-Operation (NOP), No-Operation (NOP), Timestamps
    [SEQ/ACK analysis]

     25 21.579721360   10.0.5.11             10.0.5.22             TELNET   67     Telnet Data ...

Frame 25: 67 bytes on wire (536 bits), 67 bytes captured (536 bits) on interface 0
Ethernet II, Src: 68:05:ca:39:cc:79, Dst: 68:05:ca:39:e1:36
Internet Protocol Version 4, Src: 10.0.5.11, Dst: 10.0.5.22
Transmission Control Protocol, Src Port: 33230 (33230), Dst Port: 23 (23), Seq: 116, Ack: 92, Len: 1
    Source Port: 33230
    Destination Port: 23
    [Stream index: 0]
    [TCP Segment Len: 1]
    Sequence number: 116    (relative sequence number)
    [Next sequence number: 117    (relative sequence number)]
    Acknowledgment number: 92    (relative ack number)
    Header Length: 32 bytes
    Flags: 0x018 (PSH, ACK)
    Window size value: 229
    [Calculated window size: 29312]
    [Window size scaling factor: 128]
    Checksum: 0x1e48 [validation disabled]
    Urgent pointer: 0
    Options: (12 bytes), No-Operation (NOP), No-Operation (NOP), Timestamps
    [SEQ/ACK analysis]
Telnet

     26 21.580231903   10.0.5.22             10.0.5.11             TELNET   67     Telnet Data ...

Frame 26: 67 bytes on wire (536 bits), 67 bytes captured (536 bits) on interface 0
Ethernet II, Src: 68:05:ca:39:e1:36, Dst: 68:05:ca:39:cc:79
Internet Protocol Version 4, Src: 10.0.5.22, Dst: 10.0.5.11
Transmission Control Protocol, Src Port: 23 (23), Dst Port: 33230 (33230), Seq: 92, Ack: 117, Len: 1
    Source Port: 23
    Destination Port: 33230
    [Stream index: 0]
    [TCP Segment Len: 1]
    Sequence number: 92    (relative sequence number)
    [Next sequence number: 93    (relative sequence number)]
    Acknowledgment number: 117    (relative ack number)
    Header Length: 32 bytes
    Flags: 0x018 (PSH, ACK)
    Window size value: 227
    [Calculated window size: 29056]
    [Window size scaling factor: 128]
    Checksum: 0x47a5 [validation disabled]
    Urgent pointer: 0
    Options: (12 bytes), No-Operation (NOP), No-Operation (NOP), Timestamps
    [SEQ/ACK analysis]
Telnet

     27 21.580253635   10.0.5.11             10.0.5.22             TCP      66     33230 → 23 [ACK] Seq=117 Ack=93 Win=29312 Len=0 TSval=1530628 TSecr=1530367

Frame 27: 66 bytes on wire (528 bits), 66 bytes captured (528 bits) on interface 0
Ethernet II, Src: 68:05:ca:39:cc:79, Dst: 68:05:ca:39:e1:36
Internet Protocol Version 4, Src: 10.0.5.11, Dst: 10.0.5.22
Transmission Control Protocol, Src Port: 33230 (33230), Dst Port: 23 (23), Seq: 117, Ack: 93, Len: 0
    Source Port: 33230
    Destination Port: 23
    [Stream index: 0]
    [TCP Segment Len: 0]
    Sequence number: 117    (relative sequence number)
    Acknowledgment number: 93    (relative ack number)
    Header Length: 32 bytes
    Flags: 0x010 (ACK)
    Window size value: 229
    [Calculated window size: 29312]
    [Window size scaling factor: 128]
    Checksum: 0x1e47 [validation disabled]
    Urgent pointer: 0
    Options: (12 bytes), No-Operation (NOP), No-Operation (NOP), Timestamps
    [SEQ/ACK analysis]

     28 21.811201267   10.0.5.11             10.0.5.22             TELNET   67     Telnet Data ...

Frame 28: 67 bytes on wire (536 bits), 67 bytes captured (536 bits) on interface 0
Ethernet II, Src: 68:05:ca:39:cc:79, Dst: 68:05:ca:39:e1:36
Internet Protocol Version 4, Src: 10.0.5.11, Dst: 10.0.5.22
Transmission Control Protocol, Src Port: 33230 (33230), Dst Port: 23 (23), Seq: 117, Ack: 93, Len: 1
    Source Port: 33230
    Destination Port: 23
    [Stream index: 0]
    [TCP Segment Len: 1]
    Sequence number: 117    (relative sequence number)
    [Next sequence number: 118    (relative sequence number)]
    Acknowledgment number: 93    (relative ack number)
    Header Length: 32 bytes
    Flags: 0x018 (PSH, ACK)
    Window size value: 229
    [Calculated window size: 29312]
    [Window size scaling factor: 128]
    Checksum: 0x1e48 [validation disabled]
    Urgent pointer: 0
    Options: (12 bytes), No-Operation (NOP), No-Operation (NOP), Timestamps
    [SEQ/ACK analysis]
Telnet

     29 21.811692839   10.0.5.22             10.0.5.11             TELNET   67     Telnet Data ...

Frame 29: 67 bytes on wire (536 bits), 67 bytes captured (536 bits) on interface 0
Ethernet II, Src: 68:05:ca:39:e1:36, Dst: 68:05:ca:39:cc:79
Internet Protocol Version 4, Src: 10.0.5.22, Dst: 10.0.5.11
Transmission Control Protocol, Src Port: 23 (23), Dst Port: 33230 (33230), Seq: 93, Ack: 118, Len: 1
    Source Port: 23
    Destination Port: 33230
    [Stream index: 0]
    [TCP Segment Len: 1]
    Sequence number: 93    (relative sequence number)
    [Next sequence number: 94    (relative sequence number)]
    Acknowledgment number: 118    (relative ack number)
    Header Length: 32 bytes
    Flags: 0x018 (PSH, ACK)
    Window size value: 227
    [Calculated window size: 29056]
    [Window size scaling factor: 128]
    Checksum: 0x4630 [validation disabled]
    Urgent pointer: 0
    Options: (12 bytes), No-Operation (NOP), No-Operation (NOP), Timestamps
    [SEQ/ACK analysis]
Telnet

     30 21.811712582   10.0.5.11             10.0.5.22             TCP      66     33230 → 23 [ACK] Seq=118 Ack=94 Win=29312 Len=0 TSval=1530686 TSecr=1530425

Frame 30: 66 bytes on wire (528 bits), 66 bytes captured (528 bits) on interface 0
Ethernet II, Src: 68:05:ca:39:cc:79, Dst: 68:05:ca:39:e1:36
Internet Protocol Version 4, Src: 10.0.5.11, Dst: 10.0.5.22
Transmission Control Protocol, Src Port: 33230 (33230), Dst Port: 23 (23), Seq: 118, Ack: 94, Len: 0
    Source Port: 33230
    Destination Port: 23
    [Stream index: 0]
    [TCP Segment Len: 0]
    Sequence number: 118    (relative sequence number)
    Acknowledgment number: 94    (relative ack number)
    Header Length: 32 bytes
    Flags: 0x010 (ACK)
    Window size value: 229
    [Calculated window size: 29312]
    [Window size scaling factor: 128]
    Checksum: 0x1e47 [validation disabled]
    Urgent pointer: 0
    Options: (12 bytes), No-Operation (NOP), No-Operation (NOP), Timestamps
    [SEQ/ACK analysis]

     31 21.962432511   10.0.5.11             10.0.5.22             TELNET   67     Telnet Data ...

Frame 31: 67 bytes on wire (536 bits), 67 bytes captured (536 bits) on interface 0
Ethernet II, Src: 68:05:ca:39:cc:79, Dst: 68:05:ca:39:e1:36
Internet Protocol Version 4, Src: 10.0.5.11, Dst: 10.0.5.22
Transmission Control Protocol, Src Port: 33230 (33230), Dst Port: 23 (23), Seq: 118, Ack: 94, Len: 1
    Source Port: 33230
    Destination Port: 23
    [Stream index: 0]
    [TCP Segment Len: 1]
    Sequence number: 118    (relative sequence number)
    [Next sequence number: 119    (relative sequence number)]
    Acknowledgment number: 94    (relative ack number)
    Header Length: 32 bytes
    Flags: 0x018 (PSH, ACK)
    Window size value: 229
    [Calculated window size: 29312]
    [Window size scaling factor: 128]
    Checksum: 0x1e48 [validation disabled]
    Urgent pointer: 0
    Options: (12 bytes), No-Operation (NOP), No-Operation (NOP), Timestamps
    [SEQ/ACK analysis]
Telnet

     32 21.962942994   10.0.5.22             10.0.5.11             TELNET   67     Telnet Data ...

Frame 32: 67 bytes on wire (536 bits), 67 bytes captured (536 bits) on interface 0
Ethernet II, Src: 68:05:ca:39:e1:36, Dst: 68:05:ca:39:cc:79
Internet Protocol Version 4, Src: 10.0.5.22, Dst: 10.0.5.11
Transmission Control Protocol, Src Port: 23 (23), Dst Port: 33230 (33230), Seq: 94, Ack: 119, Len: 1
    Source Port: 23
    Destination Port: 33230
    [Stream index: 0]
    [TCP Segment Len: 1]
    Sequence number: 94    (relative sequence number)
    [Next sequence number: 95    (relative sequence number)]
    Acknowledgment number: 119    (relative ack number)
    Header Length: 32 bytes
    Flags: 0x018 (PSH, ACK)
    Window size value: 227
    [Calculated window size: 29056]
    [Window size scaling factor: 128]
    Checksum: 0x56e3 [validation disabled]
    Urgent pointer: 0
    Options: (12 bytes), No-Operation (NOP), No-Operation (NOP), Timestamps
    [SEQ/ACK analysis]
Telnet

     33 21.962960053   10.0.5.11             10.0.5.22             TCP      66     33230 → 23 [ACK] Seq=119 Ack=95 Win=29312 Len=0 TSval=1530723 TSecr=1530462

Frame 33: 66 bytes on wire (528 bits), 66 bytes captured (528 bits) on interface 0
Ethernet II, Src: 68:05:ca:39:cc:79, Dst: 68:05:ca:39:e1:36
Internet Protocol Version 4, Src: 10.0.5.11, Dst: 10.0.5.22
Transmission Control Protocol, Src Port: 33230 (33230), Dst Port: 23 (23), Seq: 119, Ack: 95, Len: 0
    Source Port: 33230
    Destination Port: 23
    [Stream index: 0]
    [TCP Segment Len: 0]
    Sequence number: 119    (relative sequence number)
    Acknowledgment number: 95    (relative ack number)
    Header Length: 32 bytes
    Flags: 0x010 (ACK)
    Window size value: 229
    [Calculated window size: 29312]
    [Window size scaling factor: 128]
    Checksum: 0x1e47 [validation disabled]
    Urgent pointer: 0
    Options: (12 bytes), No-Operation (NOP), No-Operation (NOP), Timestamps
    [SEQ/ACK analysis]

     34 22.331366578   10.0.5.11             10.0.5.22             TELNET   67     Telnet Data ...

Frame 34: 67 bytes on wire (536 bits), 67 bytes captured (536 bits) on interface 0
Ethernet II, Src: 68:05:ca:39:cc:79, Dst: 68:05:ca:39:e1:36
Internet Protocol Version 4, Src: 10.0.5.11, Dst: 10.0.5.22
Transmission Control Protocol, Src Port: 33230 (33230), Dst Port: 23 (23), Seq: 119, Ack: 95, Len: 1
    Source Port: 33230
    Destination Port: 23
    [Stream index: 0]
    [TCP Segment Len: 1]
    Sequence number: 119    (relative sequence number)
    [Next sequence number: 120    (relative sequence number)]
    Acknowledgment number: 95    (relative ack number)
    Header Length: 32 bytes
    Flags: 0x018 (PSH, ACK)
    Window size value: 229
    [Calculated window size: 29312]
    [Window size scaling factor: 128]
    Checksum: 0x1e48 [validation disabled]
    Urgent pointer: 0
    Options: (12 bytes), No-Operation (NOP), No-Operation (NOP), Timestamps
    [SEQ/ACK analysis]
Telnet

     35 22.331826516   10.0.5.22             10.0.5.11             TELNET   67     Telnet Data ...

Frame 35: 67 bytes on wire (536 bits), 67 bytes captured (536 bits) on interface 0
Ethernet II, Src: 68:05:ca:39:e1:36, Dst: 68:05:ca:39:cc:79
Internet Protocol Version 4, Src: 10.0.5.22, Dst: 10.0.5.11
Transmission Control Protocol, Src Port: 23 (23), Dst Port: 33230 (33230), Seq: 95, Ack: 120, Len: 1
    Source Port: 23
    Destination Port: 33230
    [Stream index: 0]
    [TCP Segment Len: 1]
    Sequence number: 95    (relative sequence number)
    [Next sequence number: 96    (relative sequence number)]
    Acknowledgment number: 120    (relative ack number)
    Header Length: 32 bytes
    Flags: 0x018 (PSH, ACK)
    Window size value: 227
    [Calculated window size: 29056]
    [Window size scaling factor: 128]
    Checksum: 0x5528 [validation disabled]
    Urgent pointer: 0
    Options: (12 bytes), No-Operation (NOP), No-Operation (NOP), Timestamps
    [SEQ/ACK analysis]
Telnet

     36 22.331848825   10.0.5.11             10.0.5.22             TCP      66     33230 → 23 [ACK] Seq=120 Ack=96 Win=29312 Len=0 TSval=1530816 TSecr=1530555

Frame 36: 66 bytes on wire (528 bits), 66 bytes captured (528 bits) on interface 0
Ethernet II, Src: 68:05:ca:39:cc:79, Dst: 68:05:ca:39:e1:36
Internet Protocol Version 4, Src: 10.0.5.11, Dst: 10.0.5.22
Transmission Control Protocol, Src Port: 33230 (33230), Dst Port: 23 (23), Seq: 120, Ack: 96, Len: 0
    Source Port: 33230
    Destination Port: 23
    [Stream index: 0]
    [TCP Segment Len: 0]
    Sequence number: 120    (relative sequence number)
    Acknowledgment number: 96    (relative ack number)
    Header Length: 32 bytes
    Flags: 0x010 (ACK)
    Window size value: 229
    [Calculated window size: 29312]
    [Window size scaling factor: 128]
    Checksum: 0x1e47 [validation disabled]
    Urgent pointer: 0
    Options: (12 bytes), No-Operation (NOP), No-Operation (NOP), Timestamps
    [SEQ/ACK analysis]

     37 22.442632628   10.0.5.11             10.0.5.22             TELNET   67     Telnet Data ...

Frame 37: 67 bytes on wire (536 bits), 67 bytes captured (536 bits) on interface 0
Ethernet II, Src: 68:05:ca:39:cc:79, Dst: 68:05:ca:39:e1:36
Internet Protocol Version 4, Src: 10.0.5.11, Dst: 10.0.5.22
Transmission Control Protocol, Src Port: 33230 (33230), Dst Port: 23 (23), Seq: 120, Ack: 96, Len: 1
    Source Port: 33230
    Destination Port: 23
    [Stream index: 0]
    [TCP Segment Len: 1]
    Sequence number: 120    (relative sequence number)
    [Next sequence number: 121    (relative sequence number)]
    Acknowledgment number: 96    (relative ack number)
    Header Length: 32 bytes
    Flags: 0x018 (PSH, ACK)
    Window size value: 229
    [Calculated window size: 29312]
    [Window size scaling factor: 128]
    Checksum: 0x1e48 [validation disabled]
    Urgent pointer: 0
    Options: (12 bytes), No-Operation (NOP), No-Operation (NOP), Timestamps
    [SEQ/ACK analysis]
Telnet

     38 22.443154577   10.0.5.22             10.0.5.11             TELNET   67     Telnet Data ...

Frame 38: 67 bytes on wire (536 bits), 67 bytes captured (536 bits) on interface 0
Ethernet II, Src: 68:05:ca:39:e1:36, Dst: 68:05:ca:39:cc:79
Internet Protocol Version 4, Src: 10.0.5.22, Dst: 10.0.5.11
Transmission Control Protocol, Src Port: 23 (23), Dst Port: 33230 (33230), Seq: 96, Ack: 121, Len: 1
    Source Port: 23
    Destination Port: 33230
    [Stream index: 0]
    [TCP Segment Len: 1]
    Sequence number: 96    (relative sequence number)
    [Next sequence number: 97    (relative sequence number)]
    Acknowledgment number: 121    (relative ack number)
    Header Length: 32 bytes
    Flags: 0x018 (PSH, ACK)
    Window size value: 227
    [Calculated window size: 29056]
    [Window size scaling factor: 128]
    Checksum: 0x4bef [validation disabled]
    Urgent pointer: 0
    Options: (12 bytes), No-Operation (NOP), No-Operation (NOP), Timestamps
    [SEQ/ACK analysis]
Telnet

     39 22.443175399   10.0.5.11             10.0.5.22             TCP      66     33230 → 23 [ACK] Seq=121 Ack=97 Win=29312 Len=0 TSval=1530843 TSecr=1530582

Frame 39: 66 bytes on wire (528 bits), 66 bytes captured (528 bits) on interface 0
Ethernet II, Src: 68:05:ca:39:cc:79, Dst: 68:05:ca:39:e1:36
Internet Protocol Version 4, Src: 10.0.5.11, Dst: 10.0.5.22
Transmission Control Protocol, Src Port: 33230 (33230), Dst Port: 23 (23), Seq: 121, Ack: 97, Len: 0
    Source Port: 33230
    Destination Port: 23
    [Stream index: 0]
    [TCP Segment Len: 0]
    Sequence number: 121    (relative sequence number)
    Acknowledgment number: 97    (relative ack number)
    Header Length: 32 bytes
    Flags: 0x010 (ACK)
    Window size value: 229
    [Calculated window size: 29312]
    [Window size scaling factor: 128]
    Checksum: 0x1e47 [validation disabled]
    Urgent pointer: 0
    Options: (12 bytes), No-Operation (NOP), No-Operation (NOP), Timestamps
    [SEQ/ACK analysis]

     40 22.578349538   10.0.5.11             10.0.5.22             TELNET   67     Telnet Data ...

Frame 40: 67 bytes on wire (536 bits), 67 bytes captured (536 bits) on interface 0
Ethernet II, Src: 68:05:ca:39:cc:79, Dst: 68:05:ca:39:e1:36
Internet Protocol Version 4, Src: 10.0.5.11, Dst: 10.0.5.22
Transmission Control Protocol, Src Port: 33230 (33230), Dst Port: 23 (23), Seq: 121, Ack: 97, Len: 1
    Source Port: 33230
    Destination Port: 23
    [Stream index: 0]
    [TCP Segment Len: 1]
    Sequence number: 121    (relative sequence number)
    [Next sequence number: 122    (relative sequence number)]
    Acknowledgment number: 97    (relative ack number)
    Header Length: 32 bytes
    Flags: 0x018 (PSH, ACK)
    Window size value: 229
    [Calculated window size: 29312]
    [Window size scaling factor: 128]
    Checksum: 0x1e48 [validation disabled]
    Urgent pointer: 0
    Options: (12 bytes), No-Operation (NOP), No-Operation (NOP), Timestamps
    [SEQ/ACK analysis]
Telnet

     41 22.578830300   10.0.5.22             10.0.5.11             TELNET   67     Telnet Data ...

Frame 41: 67 bytes on wire (536 bits), 67 bytes captured (536 bits) on interface 0
Ethernet II, Src: 68:05:ca:39:e1:36, Dst: 68:05:ca:39:cc:79
Internet Protocol Version 4, Src: 10.0.5.22, Dst: 10.0.5.11
Transmission Control Protocol, Src Port: 23 (23), Dst Port: 33230 (33230), Seq: 97, Ack: 122, Len: 1
    Source Port: 23
    Destination Port: 33230
    [Stream index: 0]
    [TCP Segment Len: 1]
    Sequence number: 97    (relative sequence number)
    [Next sequence number: 98    (relative sequence number)]
    Acknowledgment number: 122    (relative ack number)
    Header Length: 32 bytes
    Flags: 0x018 (PSH, ACK)
    Window size value: 227
    [Calculated window size: 29056]
    [Window size scaling factor: 128]
    Checksum: 0x45a9 [validation disabled]
    Urgent pointer: 0
    Options: (12 bytes), No-Operation (NOP), No-Operation (NOP), Timestamps
    [SEQ/ACK analysis]
Telnet

     42 22.578846178   10.0.5.11             10.0.5.22             TCP      66     33230 → 23 [ACK] Seq=122 Ack=98 Win=29312 Len=0 TSval=1530877 TSecr=1530616

Frame 42: 66 bytes on wire (528 bits), 66 bytes captured (528 bits) on interface 0
Ethernet II, Src: 68:05:ca:39:cc:79, Dst: 68:05:ca:39:e1:36
Internet Protocol Version 4, Src: 10.0.5.11, Dst: 10.0.5.22
Transmission Control Protocol, Src Port: 33230 (33230), Dst Port: 23 (23), Seq: 122, Ack: 98, Len: 0
    Source Port: 33230
    Destination Port: 23
    [Stream index: 0]
    [TCP Segment Len: 0]
    Sequence number: 122    (relative sequence number)
    Acknowledgment number: 98    (relative ack number)
