      1 0.000000000    00:12:00:d4:bd:b0     01:80:c2:00:00:00     STP      60     Conf. Root = 32768/0/00:12:00:d4:bd:b4  Cost = 0  Port = 0x8001

Frame 1: 60 bytes on wire (480 bits), 60 bytes captured (480 bits) on interface 0
IEEE 802.3 Ethernet 
Logical-Link Control
Spanning Tree Protocol

      2 2.003349724    00:12:00:d4:bd:b0     01:80:c2:00:00:00     STP      60     Conf. Root = 32768/0/00:12:00:d4:bd:b4  Cost = 0  Port = 0x8001

Frame 2: 60 bytes on wire (480 bits), 60 bytes captured (480 bits) on interface 0
IEEE 802.3 Ethernet 
Logical-Link Control
Spanning Tree Protocol

      3 3.188701259    10.0.1.11             143.129.77.30         DNS      95     Standard query 0x4cce A ntp.ubuntu.com.mosaic.uantwerpen.be

Frame 3: 95 bytes on wire (760 bits), 95 bytes captured (760 bits) on interface 0
Ethernet II, Src: 68:05:ca:36:33:a0, Dst: 00:0d:bc:ef:eb:24
Internet Protocol Version 4, Src: 10.0.1.11, Dst: 143.129.77.30
User Datagram Protocol, Src Port: 39271 (39271), Dst Port: 53 (53)
Domain Name System (query)

      4 3.188708352    10.0.1.11             143.129.77.30         DNS      95     Standard query 0x36fd AAAA ntp.ubuntu.com.mosaic.uantwerpen.be

Frame 4: 95 bytes on wire (760 bits), 95 bytes captured (760 bits) on interface 0
Ethernet II, Src: 68:05:ca:36:33:a0, Dst: 00:0d:bc:ef:eb:24
Internet Protocol Version 4, Src: 10.0.1.11, Dst: 143.129.77.30
User Datagram Protocol, Src Port: 39271 (39271), Dst Port: 53 (53)
Domain Name System (query)

      5 3.894412734    10.0.1.11             10.0.2.22             TCP      74     45030 → 23 [SYN] Seq=0 Win=29200 Len=0 MSS=1460 SACK_PERM=1 TSval=2030929 TSecr=0 WS=128

Frame 5: 74 bytes on wire (592 bits), 74 bytes captured (592 bits) on interface 0
Ethernet II, Src: 68:05:ca:36:33:a0, Dst: 00:0d:bc:ef:eb:24
Internet Protocol Version 4, Src: 10.0.1.11, Dst: 10.0.2.22
Transmission Control Protocol, Src Port: 45030 (45030), Dst Port: 23 (23), Seq: 0, Len: 0

      6 3.895643477    10.0.4.4              10.0.1.11             ICMP     70     Time-to-live exceeded (Time to live exceeded in transit)

Frame 6: 70 bytes on wire (560 bits), 70 bytes captured (560 bits) on interface 0
Ethernet II, Src: 00:0d:bc:ef:eb:24, Dst: 68:05:ca:36:33:a0
Internet Protocol Version 4, Src: 10.0.4.4, Dst: 10.0.1.11
Internet Control Message Protocol

      7 3.895892384    10.0.2.22             10.0.1.11             TCP      74     23 → 45030 [SYN, ACK] Seq=0 Ack=1 Win=28960 Len=0 MSS=1460 SACK_PERM=1 TSval=2030667 TSecr=2030929 WS=128

Frame 7: 74 bytes on wire (592 bits), 74 bytes captured (592 bits) on interface 0
Ethernet II, Src: 00:0d:bc:ef:eb:24, Dst: 68:05:ca:36:33:a0
Internet Protocol Version 4, Src: 10.0.2.22, Dst: 10.0.1.11
Transmission Control Protocol, Src Port: 23 (23), Dst Port: 45030 (45030), Seq: 0, Ack: 1, Len: 0

      8 3.895928190    10.0.1.11             10.0.2.22             TCP      66     45030 → 23 [ACK] Seq=1 Ack=1 Win=29312 Len=0 TSval=2030930 TSecr=2030667

Frame 8: 66 bytes on wire (528 bits), 66 bytes captured (528 bits) on interface 0
Ethernet II, Src: 68:05:ca:36:33:a0, Dst: 00:0d:bc:ef:eb:24
Internet Protocol Version 4, Src: 10.0.1.11, Dst: 10.0.2.22
Transmission Control Protocol, Src Port: 45030 (45030), Dst Port: 23 (23), Seq: 1, Ack: 1, Len: 0

      9 3.896053141    10.0.1.11             10.0.2.22             TELNET   93     Telnet Data ...

Frame 9: 93 bytes on wire (744 bits), 93 bytes captured (744 bits) on interface 0
Ethernet II, Src: 68:05:ca:36:33:a0, Dst: 00:0d:bc:ef:eb:24
Internet Protocol Version 4, Src: 10.0.1.11, Dst: 10.0.2.22
Transmission Control Protocol, Src Port: 45030 (45030), Dst Port: 23 (23), Seq: 1, Ack: 1, Len: 27
Telnet

     10 3.896324105    10.0.4.4              10.0.1.11             ICMP     70     Time-to-live exceeded (Time to live exceeded in transit)

Frame 10: 70 bytes on wire (560 bits), 70 bytes captured (560 bits) on interface 0
Ethernet II, Src: 00:0d:bc:ef:eb:24, Dst: 68:05:ca:36:33:a0
Internet Protocol Version 4, Src: 10.0.4.4, Dst: 10.0.1.11
Internet Control Message Protocol

     11 3.897361246    10.0.2.22             10.0.1.11             TCP      66     23 → 45030 [ACK] Seq=1 Ack=28 Win=29056 Len=0 TSval=2030667 TSecr=2030930

Frame 11: 66 bytes on wire (528 bits), 66 bytes captured (528 bits) on interface 0
Ethernet II, Src: 00:0d:bc:ef:eb:24, Dst: 68:05:ca:36:33:a0
Internet Protocol Version 4, Src: 10.0.2.22, Dst: 10.0.1.11
Transmission Control Protocol, Src Port: 23 (23), Dst Port: 45030 (45030), Seq: 1, Ack: 28, Len: 0

     12 4.002703059    00:12:00:d4:bd:b0     01:80:c2:00:00:00     STP      60     Conf. Root = 32768/0/00:12:00:d4:bd:b4  Cost = 0  Port = 0x8001

Frame 12: 60 bytes on wire (480 bits), 60 bytes captured (480 bits) on interface 0
IEEE 802.3 Ethernet 
Logical-Link Control
Spanning Tree Protocol

     13 6.005971214    00:12:00:d4:bd:b0     01:80:c2:00:00:00     STP      60     Conf. Root = 32768/0/00:12:00:d4:bd:b4  Cost = 0  Port = 0x8001

Frame 13: 60 bytes on wire (480 bits), 60 bytes captured (480 bits) on interface 0
IEEE 802.3 Ethernet 
Logical-Link Control
Spanning Tree Protocol

     14 8.009349161    00:12:00:d4:bd:b0     01:80:c2:00:00:00     STP      60     Conf. Root = 32768/0/00:12:00:d4:bd:b4  Cost = 0  Port = 0x8001

Frame 14: 60 bytes on wire (480 bits), 60 bytes captured (480 bits) on interface 0
IEEE 802.3 Ethernet 
Logical-Link Control
Spanning Tree Protocol

     15 8.193781981    10.0.1.11             143.129.77.30         DNS      95     Standard query 0x4cce A ntp.ubuntu.com.mosaic.uantwerpen.be

Frame 15: 95 bytes on wire (760 bits), 95 bytes captured (760 bits) on interface 0
Ethernet II, Src: 68:05:ca:36:33:a0, Dst: 00:0d:bc:ef:eb:24
Internet Protocol Version 4, Src: 10.0.1.11, Dst: 143.129.77.30
User Datagram Protocol, Src Port: 39271 (39271), Dst Port: 53 (53)
Domain Name System (query)

     16 8.193791999    10.0.1.11             143.129.77.30         DNS      95     Standard query 0x36fd AAAA ntp.ubuntu.com.mosaic.uantwerpen.be

Frame 16: 95 bytes on wire (760 bits), 95 bytes captured (760 bits) on interface 0
Ethernet II, Src: 68:05:ca:36:33:a0, Dst: 00:0d:bc:ef:eb:24
Internet Protocol Version 4, Src: 10.0.1.11, Dst: 143.129.77.30
User Datagram Protocol, Src Port: 39271 (39271), Dst Port: 53 (53)
Domain Name System (query)

     17 8.899820013    10.0.4.4              10.0.1.11             ICMP     70     Time-to-live exceeded (Time to live exceeded in transit)

Frame 17: 70 bytes on wire (560 bits), 70 bytes captured (560 bits) on interface 0
Ethernet II, Src: 00:0d:bc:ef:eb:24, Dst: 68:05:ca:36:33:a0
Internet Protocol Version 4, Src: 10.0.4.4, Dst: 10.0.1.11
Internet Control Message Protocol

     18 8.900226984    10.0.4.4              10.0.1.11             ICMP     70     Time-to-live exceeded (Time to live exceeded in transit)

Frame 18: 70 bytes on wire (560 bits), 70 bytes captured (560 bits) on interface 0
Ethernet II, Src: 00:0d:bc:ef:eb:24, Dst: 68:05:ca:36:33:a0
Internet Protocol Version 4, Src: 10.0.4.4, Dst: 10.0.1.11
Internet Control Message Protocol

     19 10.012689861   00:12:00:d4:bd:b0     01:80:c2:00:00:00     STP      60     Conf. Root = 32768/0/00:12:00:d4:bd:b4  Cost = 0  Port = 0x8001

Frame 19: 60 bytes on wire (480 bits), 60 bytes captured (480 bits) on interface 0
IEEE 802.3 Ethernet 
Logical-Link Control
Spanning Tree Protocol

     20 12.012024503   00:12:00:d4:bd:b0     01:80:c2:00:00:00     STP      60     Conf. Root = 32768/0/00:12:00:d4:bd:b4  Cost = 0  Port = 0x8001

Frame 20: 60 bytes on wire (480 bits), 60 bytes captured (480 bits) on interface 0
IEEE 802.3 Ethernet 
Logical-Link Control
Spanning Tree Protocol

     21 13.199329531   10.0.1.11             143.129.77.30         DNS      74     Standard query 0x86e2 A ntp.ubuntu.com

Frame 21: 74 bytes on wire (592 bits), 74 bytes captured (592 bits) on interface 0
Ethernet II, Src: 68:05:ca:36:33:a0, Dst: 00:0d:bc:ef:eb:24
Internet Protocol Version 4, Src: 10.0.1.11, Dst: 143.129.77.30
User Datagram Protocol, Src Port: 46116 (46116), Dst Port: 53 (53)
Domain Name System (query)

     22 13.199340774   10.0.1.11             143.129.77.30         DNS      74     Standard query 0xc6e3 AAAA ntp.ubuntu.com

Frame 22: 74 bytes on wire (592 bits), 74 bytes captured (592 bits) on interface 0
Ethernet II, Src: 68:05:ca:36:33:a0, Dst: 00:0d:bc:ef:eb:24
Internet Protocol Version 4, Src: 10.0.1.11, Dst: 143.129.77.30
User Datagram Protocol, Src Port: 46116 (46116), Dst Port: 53 (53)
Domain Name System (query)

     23 13.747949731   10.0.4.4              10.0.1.11             ICMP     70     Time-to-live exceeded (Time to live exceeded in transit)

Frame 23: 70 bytes on wire (560 bits), 70 bytes captured (560 bits) on interface 0
Ethernet II, Src: 00:0d:bc:ef:eb:24, Dst: 68:05:ca:36:33:a0
Internet Protocol Version 4, Src: 10.0.4.4, Dst: 10.0.1.11
Internet Control Message Protocol

     24 13.748352359   10.0.4.4              10.0.1.11             ICMP     70     Time-to-live exceeded (Time to live exceeded in transit)

Frame 24: 70 bytes on wire (560 bits), 70 bytes captured (560 bits) on interface 0
Ethernet II, Src: 00:0d:bc:ef:eb:24, Dst: 68:05:ca:36:33:a0
Internet Protocol Version 4, Src: 10.0.4.4, Dst: 10.0.1.11
Internet Control Message Protocol

     25 13.912806301   10.0.2.22             10.0.1.11             TELNET   78     Telnet Data ...

Frame 25: 78 bytes on wire (624 bits), 78 bytes captured (624 bits) on interface 0
Ethernet II, Src: 00:0d:bc:ef:eb:24, Dst: 68:05:ca:36:33:a0
Internet Protocol Version 4, Src: 10.0.2.22, Dst: 10.0.1.11
Transmission Control Protocol, Src Port: 23 (23), Dst Port: 45030 (45030), Seq: 1, Ack: 28, Len: 12
Telnet

     26 13.912834292   10.0.1.11             10.0.2.22             TCP      66     45030 → 23 [ACK] Seq=28 Ack=13 Win=29312 Len=0 TSval=2033434 TSecr=2033171

Frame 26: 66 bytes on wire (528 bits), 66 bytes captured (528 bits) on interface 0
Ethernet II, Src: 68:05:ca:36:33:a0, Dst: 00:0d:bc:ef:eb:24
Internet Protocol Version 4, Src: 10.0.1.11, Dst: 10.0.2.22
Transmission Control Protocol, Src Port: 45030 (45030), Dst Port: 23 (23), Seq: 28, Ack: 13, Len: 0

     27 13.914154138   10.0.2.22             10.0.1.11             TELNET   105    Telnet Data ...

Frame 27: 105 bytes on wire (840 bits), 105 bytes captured (840 bits) on interface 0
Ethernet II, Src: 00:0d:bc:ef:eb:24, Dst: 68:05:ca:36:33:a0
Internet Protocol Version 4, Src: 10.0.2.22, Dst: 10.0.1.11
Transmission Control Protocol, Src Port: 23 (23), Dst Port: 45030 (45030), Seq: 13, Ack: 28, Len: 39
Telnet

     28 13.914168226   10.0.1.11             10.0.2.22             TCP      66     45030 → 23 [ACK] Seq=28 Ack=52 Win=29312 Len=0 TSval=2033434 TSecr=2033171

Frame 28: 66 bytes on wire (528 bits), 66 bytes captured (528 bits) on interface 0
Ethernet II, Src: 68:05:ca:36:33:a0, Dst: 00:0d:bc:ef:eb:24
Internet Protocol Version 4, Src: 10.0.1.11, Dst: 10.0.2.22
Transmission Control Protocol, Src Port: 45030 (45030), Dst Port: 23 (23), Seq: 28, Ack: 52, Len: 0

     29 13.914276484   10.0.1.11             10.0.2.22             TELNET   147    Telnet Data ...

Frame 29: 147 bytes on wire (1176 bits), 147 bytes captured (1176 bits) on interface 0
Ethernet II, Src: 68:05:ca:36:33:a0, Dst: 00:0d:bc:ef:eb:24
Internet Protocol Version 4, Src: 10.0.1.11, Dst: 10.0.2.22
Transmission Control Protocol, Src Port: 45030 (45030), Dst Port: 23 (23), Seq: 28, Ack: 52, Len: 81
Telnet

     30 13.915661336   10.0.2.22             10.0.1.11             TCP      66     23 → 45030 [ACK] Seq=52 Ack=109 Win=29056 Len=0 TSval=2033172 TSecr=2033434

Frame 30: 66 bytes on wire (528 bits), 66 bytes captured (528 bits) on interface 0
Ethernet II, Src: 00:0d:bc:ef:eb:24, Dst: 68:05:ca:36:33:a0
Internet Protocol Version 4, Src: 10.0.2.22, Dst: 10.0.1.11
Transmission Control Protocol, Src Port: 23 (23), Dst Port: 45030 (45030), Seq: 52, Ack: 109, Len: 0

     31 13.915908941   10.0.2.22             10.0.1.11             TELNET   69     Telnet Data ...

Frame 31: 69 bytes on wire (552 bits), 69 bytes captured (552 bits) on interface 0
Ethernet II, Src: 00:0d:bc:ef:eb:24, Dst: 68:05:ca:36:33:a0
Internet Protocol Version 4, Src: 10.0.2.22, Dst: 10.0.1.11
Transmission Control Protocol, Src Port: 23 (23), Dst Port: 45030 (45030), Seq: 52, Ack: 109, Len: 3
Telnet

     32 13.915963210   10.0.1.11             10.0.2.22             TELNET   69     Telnet Data ...

Frame 32: 69 bytes on wire (552 bits), 69 bytes captured (552 bits) on interface 0
Ethernet II, Src: 68:05:ca:36:33:a0, Dst: 00:0d:bc:ef:eb:24
Internet Protocol Version 4, Src: 10.0.1.11, Dst: 10.0.2.22
Transmission Control Protocol, Src Port: 45030 (45030), Dst Port: 23 (23), Seq: 109, Ack: 55, Len: 3
Telnet

     33 13.917216165   10.0.2.22             10.0.1.11             TELNET   69     Telnet Data ...

Frame 33: 69 bytes on wire (552 bits), 69 bytes captured (552 bits) on interface 0
Ethernet II, Src: 00:0d:bc:ef:eb:24, Dst: 68:05:ca:36:33:a0
Internet Protocol Version 4, Src: 10.0.2.22, Dst: 10.0.1.11
Transmission Control Protocol, Src Port: 23 (23), Dst Port: 45030 (45030), Seq: 55, Ack: 112, Len: 3
Telnet

     34 13.917280170   10.0.1.11             10.0.2.22             TELNET   69     Telnet Data ...

Frame 34: 69 bytes on wire (552 bits), 69 bytes captured (552 bits) on interface 0
Ethernet II, Src: 68:05:ca:36:33:a0, Dst: 00:0d:bc:ef:eb:24
Internet Protocol Version 4, Src: 10.0.1.11, Dst: 10.0.2.22
Transmission Control Protocol, Src Port: 45030 (45030), Dst Port: 23 (23), Seq: 112, Ack: 58, Len: 3
Telnet

     35 13.918482934   10.0.2.22             10.0.1.11             TELNET   86     Telnet Data ...

Frame 35: 86 bytes on wire (688 bits), 86 bytes captured (688 bits) on interface 0
Ethernet II, Src: 00:0d:bc:ef:eb:24, Dst: 68:05:ca:36:33:a0
Internet Protocol Version 4, Src: 10.0.2.22, Dst: 10.0.1.11
Transmission Control Protocol, Src Port: 23 (23), Dst Port: 45030 (45030), Seq: 58, Ack: 115, Len: 20
Telnet

     36 13.955020636   10.0.1.11             10.0.2.22             TCP      66     45030 → 23 [ACK] Seq=115 Ack=78 Win=29312 Len=0 TSval=2033445 TSecr=2033172

Frame 36: 66 bytes on wire (528 bits), 66 bytes captured (528 bits) on interface 0
Ethernet II, Src: 68:05:ca:36:33:a0, Dst: 00:0d:bc:ef:eb:24
Internet Protocol Version 4, Src: 10.0.1.11, Dst: 10.0.2.22
Transmission Control Protocol, Src Port: 45030 (45030), Dst Port: 23 (23), Seq: 115, Ack: 78, Len: 0

     37 13.956268484   10.0.2.22             10.0.1.11             TELNET   79     Telnet Data ...

Frame 37: 79 bytes on wire (632 bits), 79 bytes captured (632 bits) on interface 0
Ethernet II, Src: 00:0d:bc:ef:eb:24, Dst: 68:05:ca:36:33:a0
Internet Protocol Version 4, Src: 10.0.2.22, Dst: 10.0.1.11
Transmission Control Protocol, Src Port: 23 (23), Dst Port: 45030 (45030), Seq: 78, Ack: 115, Len: 13
Telnet

     38 13.956287594   10.0.1.11             10.0.2.22             TCP      66     45030 → 23 [ACK] Seq=115 Ack=91 Win=29312 Len=0 TSval=2033445 TSecr=2033182

Frame 38: 66 bytes on wire (528 bits), 66 bytes captured (528 bits) on interface 0
Ethernet II, Src: 68:05:ca:36:33:a0, Dst: 00:0d:bc:ef:eb:24
Internet Protocol Version 4, Src: 10.0.1.11, Dst: 10.0.2.22
Transmission Control Protocol, Src Port: 45030 (45030), Dst Port: 23 (23), Seq: 115, Ack: 91, Len: 0

     39 14.015383282   00:12:00:d4:bd:b0     01:80:c2:00:00:00     STP      60     Conf. Root = 32768/0/00:12:00:d4:bd:b4  Cost = 0  Port = 0x8001

Frame 39: 60 bytes on wire (480 bits), 60 bytes captured (480 bits) on interface 0
IEEE 802.3 Ethernet 
Logical-Link Control
Spanning Tree Protocol

     40 16.018651193   00:12:00:d4:bd:b0     01:80:c2:00:00:00     STP      60     Conf. Root = 32768/0/00:12:00:d4:bd:b4  Cost = 0  Port = 0x8001

Frame 40: 60 bytes on wire (480 bits), 60 bytes captured (480 bits) on interface 0
IEEE 802.3 Ethernet 
Logical-Link Control
Spanning Tree Protocol

     41 18.018017570   00:12:00:d4:bd:b0     01:80:c2:00:00:00     STP      60     Conf. Root = 32768/0/00:12:00:d4:bd:b4  Cost = 0  Port = 0x8001

Frame 41: 60 bytes on wire (480 bits), 60 bytes captured (480 bits) on interface 0
IEEE 802.3 Ethernet 
Logical-Link Control
Spanning Tree Protocol

     42 18.204421752   10.0.1.11             143.129.77.30         DNS      74     Standard query 0x86e2 A ntp.ubuntu.com

Frame 42: 74 bytes on wire (592 bits), 74 bytes captured (592 bits) on interface 0
Ethernet II, Src: 68:05:ca:36:33:a0, Dst: 00:0d:bc:ef:eb:24
Internet Protocol Version 4, Src: 10.0.1.11, Dst: 143.129.77.30
User Datagram Protocol, Src Port: 46116 (46116), Dst Port: 53 (53)
Domain Name System (query)

     43 18.204429679   10.0.1.11             143.129.77.30         DNS      74     Standard query 0xc6e3 AAAA ntp.ubuntu.com

Frame 43: 74 bytes on wire (592 bits), 74 bytes captured (592 bits) on interface 0
Ethernet II, Src: 68:05:ca:36:33:a0, Dst: 00:0d:bc:ef:eb:24
Internet Protocol Version 4, Src: 10.0.1.11, Dst: 143.129.77.30
User Datagram Protocol, Src Port: 46116 (46116), Dst Port: 53 (53)
Domain Name System (query)

     44 18.752423569   10.0.4.4              10.0.1.11             ICMP     70     Time-to-live exceeded (Time to live exceeded in transit)

Frame 44: 70 bytes on wire (560 bits), 70 bytes captured (560 bits) on interface 0
Ethernet II, Src: 00:0d:bc:ef:eb:24, Dst: 68:05:ca:36:33:a0
Internet Protocol Version 4, Src: 10.0.4.4, Dst: 10.0.1.11
Internet Control Message Protocol

     45 18.752832044   10.0.4.4              10.0.1.11             ICMP     70     Time-to-live exceeded (Time to live exceeded in transit)

Frame 45: 70 bytes on wire (560 bits), 70 bytes captured (560 bits) on interface 0
Ethernet II, Src: 00:0d:bc:ef:eb:24, Dst: 68:05:ca:36:33:a0
Internet Protocol Version 4, Src: 10.0.4.4, Dst: 10.0.1.11
Internet Control Message Protocol

     46 20.021333225   00:12:00:d4:bd:b0     01:80:c2:00:00:00     STP      60     Conf. Root = 32768/0/00:12:00:d4:bd:b4  Cost = 0  Port = 0x8001

Frame 46: 60 bytes on wire (480 bits), 60 bytes captured (480 bits) on interface 0
IEEE 802.3 Ethernet 
Logical-Link Control
Spanning Tree Protocol

     47 20.057832619   10.0.1.11             10.0.2.22             TELNET   67     Telnet Data ...

Frame 47: 67 bytes on wire (536 bits), 67 bytes captured (536 bits) on interface 0
Ethernet II, Src: 68:05:ca:36:33:a0, Dst: 00:0d:bc:ef:eb:24
Internet Protocol Version 4, Src: 10.0.1.11, Dst: 10.0.2.22
Transmission Control Protocol, Src Port: 45030 (45030), Dst Port: 23 (23), Seq: 115, Ack: 91, Len: 1
Telnet

     48 20.059312279   10.0.2.22             10.0.1.11             TELNET   67     Telnet Data ...

Frame 48: 67 bytes on wire (536 bits), 67 bytes captured (536 bits) on interface 0
Ethernet II, Src: 00:0d:bc:ef:eb:24, Dst: 68:05:ca:36:33:a0
Internet Protocol Version 4, Src: 10.0.2.22, Dst: 10.0.1.11
Transmission Control Protocol, Src Port: 23 (23), Dst Port: 45030 (45030), Seq: 91, Ack: 116, Len: 1
Telnet

     49 20.059334975   10.0.1.11             10.0.2.22             TCP      66     45030 → 23 [ACK] Seq=116 Ack=92 Win=29312 Len=0 TSval=2034971 TSecr=2034708

Frame 49: 66 bytes on wire (528 bits), 66 bytes captured (528 bits) on interface 0
Ethernet II, Src: 68:05:ca:36:33:a0, Dst: 00:0d:bc:ef:eb:24
Internet Protocol Version 4, Src: 10.0.1.11, Dst: 10.0.2.22
Transmission Control Protocol, Src Port: 45030 (45030), Dst Port: 23 (23), Seq: 116, Ack: 92, Len: 0

     50 20.865262267   10.0.1.11             10.0.2.22             TELNET   67     Telnet Data ...

Frame 50: 67 bytes on wire (536 bits), 67 bytes captured (536 bits) on interface 0
Ethernet II, Src: 68:05:ca:36:33:a0, Dst: 00:0d:bc:ef:eb:24
Internet Protocol Version 4, Src: 10.0.1.11, Dst: 10.0.2.22
Transmission Control Protocol, Src Port: 45030 (45030), Dst Port: 23 (23), Seq: 116, Ack: 92, Len: 1
Telnet

     51 20.866750174   10.0.2.22             10.0.1.11             TELNET   67     Telnet Data ...

Frame 51: 67 bytes on wire (536 bits), 67 bytes captured (536 bits) on interface 0
Ethernet II, Src: 00:0d:bc:ef:eb:24, Dst: 68:05:ca:36:33:a0
Internet Protocol Version 4, Src: 10.0.2.22, Dst: 10.0.1.11
Transmission Control Protocol, Src Port: 23 (23), Dst Port: 45030 (45030), Seq: 92, Ack: 117, Len: 1
Telnet

     52 20.866769668   10.0.1.11             10.0.2.22             TCP      66     45030 → 23 [ACK] Seq=117 Ack=93 Win=29312 Len=0 TSval=2035172 TSecr=2034909

Frame 52: 66 bytes on wire (528 bits), 66 bytes captured (528 bits) on interface 0
Ethernet II, Src: 68:05:ca:36:33:a0, Dst: 00:0d:bc:ef:eb:24
Internet Protocol Version 4, Src: 10.0.1.11, Dst: 10.0.2.22
Transmission Control Protocol, Src Port: 45030 (45030), Dst Port: 23 (23), Seq: 117, Ack: 93, Len: 0

     53 21.721689261   10.0.1.11             10.0.2.22             TELNET   67     Telnet Data ...

Frame 53: 67 bytes on wire (536 bits), 67 bytes captured (536 bits) on interface 0
Ethernet II, Src: 68:05:ca:36:33:a0, Dst: 00:0d:bc:ef:eb:24
Internet Protocol Version 4, Src: 10.0.1.11, Dst: 10.0.2.22
Transmission Control Protocol, Src Port: 45030 (45030), Dst Port: 23 (23), Seq: 117, Ack: 93, Len: 1
Telnet

     54 21.723224285   10.0.2.22             10.0.1.11             TELNET   67     Telnet Data ...

Frame 54: 67 bytes on wire (536 bits), 67 bytes captured (536 bits) on interface 0
Ethernet II, Src: 00:0d:bc:ef:eb:24, Dst: 68:05:ca:36:33:a0
Internet Protocol Version 4, Src: 10.0.2.22, Dst: 10.0.1.11
Transmission Control Protocol, Src Port: 23 (23), Dst Port: 45030 (45030), Seq: 93, Ack: 118, Len: 1
Telnet

     55 21.723248732   10.0.1.11             10.0.2.22             TCP      66     45030 → 23 [ACK] Seq=118 Ack=94 Win=29312 Len=0 TSval=2035387 TSecr=2035124

Frame 55: 66 bytes on wire (528 bits), 66 bytes captured (528 bits) on interface 0
Ethernet II, Src: 68:05:ca:36:33:a0, Dst: 00:0d:bc:ef:eb:24
Internet Protocol Version 4, Src: 10.0.1.11, Dst: 10.0.2.22
Transmission Control Protocol, Src Port: 45030 (45030), Dst Port: 23 (23), Seq: 118, Ack: 94, Len: 0

     56 22.024656836   00:12:00:d4:bd:b0     01:80:c2:00:00:00     STP      60     Conf. Root = 32768/0/00:12:00:d4:bd:b4  Cost = 0  Port = 0x8001

Frame 56: 60 bytes on wire (480 bits), 60 bytes captured (480 bits) on interface 0
IEEE 802.3 Ethernet 
Logical-Link Control
Spanning Tree Protocol

     57 22.504992679   10.0.1.11             10.0.2.22             TELNET   67     Telnet Data ...

Frame 57: 67 bytes on wire (536 bits), 67 bytes captured (536 bits) on interface 0
Ethernet II, Src: 68:05:ca:36:33:a0, Dst: 00:0d:bc:ef:eb:24
Internet Protocol Version 4, Src: 10.0.1.11, Dst: 10.0.2.22
Transmission Control Protocol, Src Port: 45030 (45030), Dst Port: 23 (23), Seq: 118, Ack: 94, Len: 1
Telnet

     58 22.506480539   10.0.2.22             10.0.1.11             TELNET   67     Telnet Data ...

Frame 58: 67 bytes on wire (536 bits), 67 bytes captured (536 bits) on interface 0
Ethernet II, Src: 00:0d:bc:ef:eb:24, Dst: 68:05:ca:36:33:a0
Internet Protocol Version 4, Src: 10.0.2.22, Dst: 10.0.1.11
Transmission Control Protocol, Src Port: 23 (23), Dst Port: 45030 (45030), Seq: 94, Ack: 119, Len: 1
Telnet

     59 22.506499254   10.0.1.11             10.0.2.22             TCP      66     45030 → 23 [ACK] Seq=119 Ack=95 Win=29312 Len=0 TSval=2035582 TSecr=2035319

Frame 59: 66 bytes on wire (528 bits), 66 bytes captured (528 bits) on interface 0
Ethernet II, Src: 68:05:ca:36:33:a0, Dst: 00:0d:bc:ef:eb:24
Internet Protocol Version 4, Src: 10.0.1.11, Dst: 10.0.2.22
Transmission Control Protocol, Src Port: 45030 (45030), Dst Port: 23 (23), Seq: 119, Ack: 95, Len: 0

     60 23.185553962   10.0.1.11             10.0.2.22             TELNET   67     Telnet Data ...

Frame 60: 67 bytes on wire (536 bits), 67 bytes captured (536 bits) on interface 0
Ethernet II, Src: 68:05:ca:36:33:a0, Dst: 00:0d:bc:ef:eb:24
Internet Protocol Version 4, Src: 10.0.1.11, Dst: 10.0.2.22
Transmission Control Protocol, Src Port: 45030 (45030), Dst Port: 23 (23), Seq: 119, Ack: 95, Len: 1
Telnet

     61 23.187067280   10.0.2.22             10.0.1.11             TELNET   67     Telnet Data ...

Frame 61: 67 bytes on wire (536 bits), 67 bytes captured (536 bits) on interface 0
Ethernet II, Src: 00:0d:bc:ef:eb:24, Dst: 68:05:ca:36:33:a0
Internet Protocol Version 4, Src: 10.0.2.22, Dst: 10.0.1.11
Transmission Control Protocol, Src Port: 23 (23), Dst Port: 45030 (45030), Seq: 95, Ack: 120, Len: 1
Telnet

     62 23.187089894   10.0.1.11             10.0.2.22             TCP      66     45030 → 23 [ACK] Seq=120 Ack=96 Win=29312 Len=0 TSval=2035753 TSecr=2035490

Frame 62: 66 bytes on wire (528 bits), 66 bytes captured (528 bits) on interface 0
Ethernet II, Src: 68:05:ca:36:33:a0, Dst: 00:0d:bc:ef:eb:24
Internet Protocol Version 4, Src: 10.0.1.11, Dst: 10.0.2.22
Transmission Control Protocol, Src Port: 45030 (45030), Dst Port: 23 (23), Seq: 120, Ack: 96, Len: 0

     63 23.209525617   10.0.1.11             143.129.77.30         DNS      95     Standard query 0x5d72 A ntp.ubuntu.com.mosaic.uantwerpen.be

Frame 63: 95 bytes on wire (760 bits), 95 bytes captured (760 bits) on interface 0
Ethernet II, Src: 68:05:ca:36:33:a0, Dst: 00:0d:bc:ef:eb:24
Internet Protocol Version 4, Src: 10.0.1.11, Dst: 143.129.77.30
User Datagram Protocol, Src Port: 56134 (56134), Dst Port: 53 (53)
Domain Name System (query)

     64 23.209530981   10.0.1.11             143.129.77.30         DNS      95     Standard query 0x1913 AAAA ntp.ubuntu.com.mosaic.uantwerpen.be

Frame 64: 95 bytes on wire (760 bits), 95 bytes captured (760 bits) on interface 0
Ethernet II, Src: 68:05:ca:36:33:a0, Dst: 00:0d:bc:ef:eb:24
Internet Protocol Version 4, Src: 10.0.1.11, Dst: 143.129.77.30
User Datagram Protocol, Src Port: 56134 (56134), Dst Port: 53 (53)
Domain Name System (query)

     65 23.889049247   10.0.4.4              10.0.1.11             ICMP     70     Time-to-live exceeded (Time to live exceeded in transit)

Frame 65: 70 bytes on wire (560 bits), 70 bytes captured (560 bits) on interface 0
Ethernet II, Src: 00:0d:bc:ef:eb:24, Dst: 68:05:ca:36:33:a0
Internet Protocol Version 4, Src: 10.0.4.4, Dst: 10.0.1.11
Internet Control Message Protocol

     66 23.889438422   10.0.4.4              10.0.1.11             ICMP     70     Time-to-live exceeded (Time to live exceeded in transit)

Frame 66: 70 bytes on wire (560 bits), 70 bytes captured (560 bits) on interface 0
Ethernet II, Src: 00:0d:bc:ef:eb:24, Dst: 68:05:ca:36:33:a0
Internet Protocol Version 4, Src: 10.0.4.4, Dst: 10.0.1.11
Internet Control Message Protocol

     67 23.976093159   10.0.1.11             10.0.2.22             TELNET   67     Telnet Data ...

Frame 67: 67 bytes on wire (536 bits), 67 bytes captured (536 bits) on interface 0
Ethernet II, Src: 68:05:ca:36:33:a0, Dst: 00:0d:bc:ef:eb:24
Internet Protocol Version 4, Src: 10.0.1.11, Dst: 10.0.2.22
Transmission Control Protocol, Src Port: 45030 (45030), Dst Port: 23 (23), Seq: 120, Ack: 96, Len: 1
Telnet

     68 23.977497713   10.0.2.22             10.0.1.11             TELNET   67     Telnet Data ...

Frame 68: 67 bytes on wire (536 bits), 67 bytes captured (536 bits) on interface 0
Ethernet II, Src: 00:0d:bc:ef:eb:24, Dst: 68:05:ca:36:33:a0
Internet Protocol Version 4, Src: 10.0.2.22, Dst: 10.0.1.11
Transmission Control Protocol, Src Port: 23 (23), Dst Port: 45030 (45030), Seq: 96, Ack: 121, Len: 1
Telnet

     69 23.977505312   10.0.1.11             10.0.2.22             TELNET   67     Telnet Data ...

Frame 69: 67 bytes on wire (536 bits), 67 bytes captured (536 bits) on interface 0
Ethernet II, Src: 68:05:ca:36:33:a0, Dst: 00:0d:bc:ef:eb:24
Internet Protocol Version 4, Src: 10.0.1.11, Dst: 10.0.2.22
Transmission Control Protocol, Src Port: 45030 (45030), Dst Port: 23 (23), Seq: 121, Ack: 97, Len: 1
Telnet

     70 23.978760295   10.0.2.22             10.0.1.11             TELNET   67     Telnet Data ...

Frame 70: 67 bytes on wire (536 bits), 67 bytes captured (536 bits) on interface 0
Ethernet II, Src: 00:0d:bc:ef:eb:24, Dst: 68:05:ca:36:33:a0
Internet Protocol Version 4, Src: 10.0.2.22, Dst: 10.0.1.11
Transmission Control Protocol, Src Port: 23 (23), Dst Port: 45030 (45030), Seq: 97, Ack: 122, Len: 1
Telnet

     71 24.015004760   10.0.1.11             10.0.2.22             TCP      66     45030 → 23 [ACK] Seq=122 Ack=98 Win=29312 Len=0 TSval=2035960 TSecr=2035687

Frame 71: 66 bytes on wire (528 bits), 66 bytes captured (528 bits) on interface 0
Ethernet II, Src: 68:05:ca:36:33:a0, Dst: 00:0d:bc:ef:eb:24
Internet Protocol Version 4, Src: 10.0.1.11, Dst: 10.0.2.22
Transmission Control Protocol, Src Port: 45030 (45030), Dst Port: 23 (23), Seq: 122, Ack: 98, Len: 0

     72 24.028055452   00:12:00:d4:bd:b0     01:80:c2:00:00:00     STP      60     Conf. Root = 32768/0/00:12:00:d4:bd:b4  Cost = 0  Port = 0x8001

Frame 72: 60 bytes on wire (480 bits), 60 bytes captured (480 bits) on interface 0
IEEE 802.3 Ethernet 
Logical-Link Control
Spanning Tree Protocol

     73 25.402276197   10.0.1.11             10.0.2.22             TELNET   67     Telnet Data ...

Frame 73: 67 bytes on wire (536 bits), 67 bytes captured (536 bits) on interface 0
Ethernet II, Src: 68:05:ca:36:33:a0, Dst: 00:0d:bc:ef:eb:24
Internet Protocol Version 4, Src: 10.0.1.11, Dst: 10.0.2.22
Transmission Control Protocol, Src Port: 45030 (45030), Dst Port: 23 (23), Seq: 122, Ack: 98, Len: 1
Telnet

     74 25.439195220   10.0.2.22             10.0.1.11             TELNET   69     Telnet Data ...

Frame 74: 69 bytes on wire (552 bits), 69 bytes captured (552 bits) on interface 0
Ethernet II, Src: 00:0d:bc:ef:eb:24, Dst: 68:05:ca:36:33:a0
Internet Protocol Version 4, Src: 10.0.2.22, Dst: 10.0.1.11
Transmission Control Protocol, Src Port: 23 (23), Dst Port: 45030 (45030), Seq: 98, Ack: 123, Len: 3
Telnet

     75 25.439220458   10.0.1.11             10.0.2.22             TCP      66     45030 → 23 [ACK] Seq=123 Ack=101 Win=29312 Len=0 TSval=2036316 TSecr=2036053

Frame 75: 66 bytes on wire (528 bits), 66 bytes captured (528 bits) on interface 0
Ethernet II, Src: 68:05:ca:36:33:a0, Dst: 00:0d:bc:ef:eb:24
Internet Protocol Version 4, Src: 10.0.1.11, Dst: 10.0.2.22
Transmission Control Protocol, Src Port: 45030 (45030), Dst Port: 23 (23), Seq: 123, Ack: 101, Len: 0

     76 25.568911994   10.0.1.11             10.0.2.22             TELNET   67     Telnet Data ...

Frame 76: 67 bytes on wire (536 bits), 67 bytes captured (536 bits) on interface 0
Ethernet II, Src: 68:05:ca:36:33:a0, Dst: 00:0d:bc:ef:eb:24
Internet Protocol Version 4, Src: 10.0.1.11, Dst: 10.0.2.22
Transmission Control Protocol, Src Port: 45030 (45030), Dst Port: 23 (23), Seq: 123, Ack: 101, Len: 1
Telnet

     77 25.595492712   10.0.2.22             10.0.1.11             TELNET   69     Telnet Data ...

Frame 77: 69 bytes on wire (552 bits), 69 bytes captured (552 bits) on interface 0
Ethernet II, Src: 00:0d:bc:ef:eb:24, Dst: 68:05:ca:36:33:a0
Internet Protocol Version 4, Src: 10.0.2.22, Dst: 10.0.1.11
Transmission Control Protocol, Src Port: 23 (23), Dst Port: 45030 (45030), Seq: 101, Ack: 124, Len: 3
Telnet

     78 25.595508146   10.0.1.11             10.0.2.22             TCP      66     45030 → 23 [ACK] Seq=124 Ack=104 Win=29312 Len=0 TSval=2036355 TSecr=2036092

Frame 78: 66 bytes on wire (528 bits), 66 bytes captured (528 bits) on interface 0
Ethernet II, Src: 68:05:ca:36:33:a0, Dst: 00:0d:bc:ef:eb:24
Internet Protocol Version 4, Src: 10.0.1.11, Dst: 10.0.2.22
Transmission Control Protocol, Src Port: 45030 (45030), Dst Port: 23 (23), Seq: 124, Ack: 104, Len: 0

     79 26.027359048   00:12:00:d4:bd:b0     01:80:c2:00:00:00     STP      60     Conf. Root = 32768/0/00:12:00:d4:bd:b4  Cost = 0  Port = 0x8001

Frame 79: 60 bytes on wire (480 bits), 60 bytes captured (480 bits) on interface 0
IEEE 802.3 Ethernet 
Logical-Link Control
Spanning Tree Protocol

     80 26.113389813   10.0.1.11             10.0.2.22             TELNET   67     Telnet Data ...

Frame 80: 67 bytes on wire (536 bits), 67 bytes captured (536 bits) on interface 0
Ethernet II, Src: 68:05:ca:36:33:a0, Dst: 00:0d:bc:ef:eb:24
Internet Protocol Version 4, Src: 10.0.1.11, Dst: 10.0.2.22
Transmission Control Protocol, Src Port: 45030 (45030), Dst Port: 23 (23), Seq: 124, Ack: 104, Len: 1
Telnet

     81 26.114874924   10.0.2.22             10.0.1.11             TELNET   67     Telnet Data ...

Frame 81: 67 bytes on wire (536 bits), 67 bytes captured (536 bits) on interface 0
Ethernet II, Src: 00:0d:bc:ef:eb:24, Dst: 68:05:ca:36:33:a0
Internet Protocol Version 4, Src: 10.0.2.22, Dst: 10.0.1.11
Transmission Control Protocol, Src Port: 23 (23), Dst Port: 45030 (45030), Seq: 104, Ack: 125, Len: 1
Telnet

     82 26.114894000   10.0.1.11             10.0.2.22             TCP      66     45030 → 23 [ACK] Seq=125 Ack=105 Win=29312 Len=0 TSval=2036484 TSecr=2036221

Frame 82: 66 bytes on wire (528 bits), 66 bytes captured (528 bits) on interface 0
Ethernet II, Src: 68:05:ca:36:33:a0, Dst: 00:0d:bc:ef:eb:24
Internet Protocol Version 4, Src: 10.0.1.11, Dst: 10.0.2.22
Transmission Control Protocol, Src Port: 45030 (45030), Dst Port: 23 (23), Seq: 125, Ack: 105, Len: 0

     83 26.905604393   10.0.1.11             10.0.2.22             TELNET   67     Telnet Data ...

Frame 83: 67 bytes on wire (536 bits), 67 bytes captured (536 bits) on interface 0
Ethernet II, Src: 68:05:ca:36:33:a0, Dst: 00:0d:bc:ef:eb:24
Internet Protocol Version 4, Src: 10.0.1.11, Dst: 10.0.2.22
Transmission Control Protocol, Src Port: 45030 (45030), Dst Port: 23 (23), Seq: 125, Ack: 105, Len: 1
Telnet

     84 26.907111135   10.0.2.22             10.0.1.11             TELNET   67     Telnet Data ...

Frame 84: 67 bytes on wire (536 bits), 67 bytes captured (536 bits) on interface 0
Ethernet II, Src: 00:0d:bc:ef:eb:24, Dst: 68:05:ca:36:33:a0
Internet Protocol Version 4, Src: 10.0.2.22, Dst: 10.0.1.11
Transmission Control Protocol, Src Port: 23 (23), Dst Port: 45030 (45030), Seq: 105, Ack: 126, Len: 1
Telnet

     85 26.907133894   10.0.1.11             10.0.2.22             TCP      66     45030 → 23 [ACK] Seq=126 Ack=106 Win=29312 Len=0 TSval=2036683 TSecr=2036420

Frame 85: 66 bytes on wire (528 bits), 66 bytes captured (528 bits) on interface 0
Ethernet II, Src: 68:05:ca:36:33:a0, Dst: 00:0d:bc:ef:eb:24
Internet Protocol Version 4, Src: 10.0.1.11, Dst: 10.0.2.22
Transmission Control Protocol, Src Port: 45030 (45030), Dst Port: 23 (23), Seq: 126, Ack: 106, Len: 0

     86 28.030704205   00:12:00:d4:bd:b0     01:80:c2:00:00:00     STP      60     Conf. Root = 32768/0/00:12:00:d4:bd:b4  Cost = 0  Port = 0x8001

Frame 86: 60 bytes on wire (480 bits), 60 bytes captured (480 bits) on interface 0
IEEE 802.3 Ethernet 
Logical-Link Control
Spanning Tree Protocol

     87 28.214586459   10.0.1.11             143.129.77.30         DNS      95     Standard query 0x5d72 A ntp.ubuntu.com.mosaic.uantwerpen.be

Frame 87: 95 bytes on wire (760 bits), 95 bytes captured (760 bits) on interface 0
Ethernet II, Src: 68:05:ca:36:33:a0, Dst: 00:0d:bc:ef:eb:24
Internet Protocol Version 4, Src: 10.0.1.11, Dst: 143.129.77.30
User Datagram Protocol, Src Port: 56134 (56134), Dst Port: 53 (53)
Domain Name System (query)

     88 28.214591455   10.0.1.11             143.129.77.30         DNS      95     Standard query 0x1913 AAAA ntp.ubuntu.com.mosaic.uantwerpen.be

Frame 88: 95 bytes on wire (760 bits), 95 bytes captured (760 bits) on interface 0
Ethernet II, Src: 68:05:ca:36:33:a0, Dst: 00:0d:bc:ef:eb:24
Internet Protocol Version 4, Src: 10.0.1.11, Dst: 143.129.77.30
User Datagram Protocol, Src Port: 56134 (56134), Dst Port: 53 (53)
Domain Name System (query)

     89 28.273034412   10.0.1.11             10.0.2.22             TELNET   68     Telnet Data ...

Frame 89: 68 bytes on wire (544 bits), 68 bytes captured (544 bits) on interface 0
Ethernet II, Src: 68:05:ca:36:33:a0, Dst: 00:0d:bc:ef:eb:24
Internet Protocol Version 4, Src: 10.0.1.11, Dst: 10.0.2.22
Transmission Control Protocol, Src Port: 45030 (45030), Dst Port: 23 (23), Seq: 126, Ack: 106, Len: 2
Telnet

     90 28.295932025   10.0.2.22             10.0.1.11             TELNET   68     Telnet Data ...

Frame 90: 68 bytes on wire (544 bits), 68 bytes captured (544 bits) on interface 0
Ethernet II, Src: 00:0d:bc:ef:eb:24, Dst: 68:05:ca:36:33:a0
Internet Protocol Version 4, Src: 10.0.2.22, Dst: 10.0.1.11
Transmission Control Protocol, Src Port: 23 (23), Dst Port: 45030 (45030), Seq: 106, Ack: 128, Len: 2
Telnet

     91 28.295945804   10.0.1.11             10.0.2.22             TCP      66     45030 → 23 [ACK] Seq=128 Ack=108 Win=29312 Len=0 TSval=2037030 TSecr=2036767

Frame 91: 66 bytes on wire (528 bits), 66 bytes captured (528 bits) on interface 0
Ethernet II, Src: 68:05:ca:36:33:a0, Dst: 00:0d:bc:ef:eb:24
Internet Protocol Version 4, Src: 10.0.1.11, Dst: 10.0.2.22
Transmission Control Protocol, Src Port: 45030 (45030), Dst Port: 23 (23), Seq: 128, Ack: 108, Len: 0

     92 28.372000168   10.0.2.22             10.0.1.11             TELNET   76     Telnet Data ...

Frame 92: 76 bytes on wire (608 bits), 76 bytes captured (608 bits) on interface 0
Ethernet II, Src: 00:0d:bc:ef:eb:24, Dst: 68:05:ca:36:33:a0
Internet Protocol Version 4, Src: 10.0.2.22, Dst: 10.0.1.11
Transmission Control Protocol, Src Port: 23 (23), Dst Port: 45030 (45030), Seq: 108, Ack: 128, Len: 10
Telnet

     93 28.372012777   10.0.1.11             10.0.2.22             TCP      66     45030 → 23 [ACK] Seq=128 Ack=118 Win=29312 Len=0 TSval=2037049 TSecr=2036786

Frame 93: 66 bytes on wire (528 bits), 66 bytes captured (528 bits) on interface 0
Ethernet II, Src: 68:05:ca:36:33:a0, Dst: 00:0d:bc:ef:eb:24
Internet Protocol Version 4, Src: 10.0.1.11, Dst: 10.0.2.22
Transmission Control Protocol, Src Port: 45030 (45030), Dst Port: 23 (23), Seq: 128, Ack: 118, Len: 0

     94 28.921321023   10.0.4.4              10.0.1.11             ICMP     70     Time-to-live exceeded (Time to live exceeded in transit)

Frame 94: 70 bytes on wire (560 bits), 70 bytes captured (560 bits) on interface 0
Ethernet II, Src: 00:0d:bc:ef:eb:24, Dst: 68:05:ca:36:33:a0
Internet Protocol Version 4, Src: 10.0.4.4, Dst: 10.0.1.11
Internet Control Message Protocol

     95 28.921758679   10.0.4.4              10.0.1.11             ICMP     70     Time-to-live exceeded (Time to live exceeded in transit)

Frame 95: 70 bytes on wire (560 bits), 70 bytes captured (560 bits) on interface 0
Ethernet II, Src: 00:0d:bc:ef:eb:24, Dst: 68:05:ca:36:33:a0
Internet Protocol Version 4, Src: 10.0.4.4, Dst: 10.0.1.11
Internet Control Message Protocol

     96 29.409861101   10.0.1.11             10.0.2.22             TELNET   67     Telnet Data ...

Frame 96: 67 bytes on wire (536 bits), 67 bytes captured (536 bits) on interface 0
Ethernet II, Src: 68:05:ca:36:33:a0, Dst: 00:0d:bc:ef:eb:24
Internet Protocol Version 4, Src: 10.0.1.11, Dst: 10.0.2.22
Transmission Control Protocol, Src Port: 45030 (45030), Dst Port: 23 (23), Seq: 128, Ack: 118, Len: 1
Telnet

     97 29.451126584   10.0.2.22             10.0.1.11             TCP      66     23 → 45030 [ACK] Seq=118 Ack=129 Win=29056 Len=0 TSval=2037056 TSecr=2037308

Frame 97: 66 bytes on wire (528 bits), 66 bytes captured (528 bits) on interface 0
Ethernet II, Src: 00:0d:bc:ef:eb:24, Dst: 68:05:ca:36:33:a0
Internet Protocol Version 4, Src: 10.0.2.22, Dst: 10.0.1.11
Transmission Control Protocol, Src Port: 23 (23), Dst Port: 45030 (45030), Seq: 118, Ack: 129, Len: 0

     98 29.538023616   10.0.1.11             10.0.2.22             TELNET   67     Telnet Data ...

Frame 98: 67 bytes on wire (536 bits), 67 bytes captured (536 bits) on interface 0
Ethernet II, Src: 68:05:ca:36:33:a0, Dst: 00:0d:bc:ef:eb:24
Internet Protocol Version 4, Src: 10.0.1.11, Dst: 10.0.2.22
Transmission Control Protocol, Src Port: 45030 (45030), Dst Port: 23 (23), Seq: 129, Ack: 118, Len: 1
Telnet

     99 29.539314916   10.0.2.22             10.0.1.11             TCP      66     23 → 45030 [ACK] Seq=118 Ack=130 Win=29056 Len=0 TSval=2037078 TSecr=2037340

