13:55:21.190759 ARP, Request who-has 10.0.1.12 tell 10.0.1.11, length 28
13:55:21.191042 ARP, Reply 10.0.1.12 is-at 68:05:ca:36:31:f0, length 46
13:55:21.191047 IP 10.0.1.11 > 10.0.1.12: ICMP echo request, id 4271, seq 1, length 64
13:55:21.191388 IP 10.0.1.12 > 10.0.1.11: ICMP echo reply, id 4271, seq 1, length 64
13:55:22.191039 IP 10.0.1.11 > 10.0.1.12: ICMP echo request, id 4271, seq 2, length 64
13:55:22.191442 IP 10.0.1.12 > 10.0.1.11: ICMP echo reply, id 4271, seq 2, length 64
13:55:23.191051 IP 10.0.1.11 > 10.0.1.12: ICMP echo request, id 4271, seq 3, length 64
13:55:23.191464 IP 10.0.1.12 > 10.0.1.11: ICMP echo reply, id 4271, seq 3, length 64
13:55:24.191074 IP 10.0.1.11 > 10.0.1.12: ICMP echo request, id 4271, seq 4, length 64
13:55:24.191457 IP 10.0.1.12 > 10.0.1.11: ICMP echo reply, id 4271, seq 4, length 64
13:55:25.191055 IP 10.0.1.11 > 10.0.1.12: ICMP echo request, id 4271, seq 5, length 64
13:55:25.191441 IP 10.0.1.12 > 10.0.1.11: ICMP echo reply, id 4271, seq 5, length 64
13:55:26.197939 ARP, Request who-has 10.0.1.11 tell 10.0.1.12, length 46
13:55:26.197948 ARP, Reply 10.0.1.11 is-at 68:05:ca:36:33:a0, length 28

