      1 0.000000000    10.0.1.11             10.0.1.12             TELNET   67     Telnet Data ...

Frame 1: 67 bytes on wire (536 bits), 67 bytes captured (536 bits) on interface 0
    Interface id: 0 (eth0)
    Encapsulation type: Ethernet (1)
    Arrival Time: Mar  2, 2017 15:16:40.531371818 CET
    [Time shift for this packet: 0.000000000 seconds]
    Epoch Time: 1488464200.531371818 seconds
    [Time delta from previous captured frame: 0.000000000 seconds]
    [Time delta from previous displayed frame: 0.000000000 seconds]
    [Time since reference or first frame: 0.000000000 seconds]
    Frame Number: 1
    Frame Length: 67 bytes (536 bits)
    Capture Length: 67 bytes (536 bits)
    [Frame is marked: False]
    [Frame is ignored: False]
    [Protocols in frame: eth:ethertype:ip:tcp:telnet]
    [Coloring Rule Name: TCP]
    [Coloring Rule String: tcp]
Ethernet II, Src: 68:05:ca:1a:7c:70, Dst: 68:05:ca:1a:7c:77
    Destination: 68:05:ca:1a:7c:77
        Address: 68:05:ca:1a:7c:77
        .... ..0. .... .... .... .... = LG bit: Globally unique address (factory default)
        .... ...0 .... .... .... .... = IG bit: Individual address (unicast)
    Source: 68:05:ca:1a:7c:70
        Address: 68:05:ca:1a:7c:70
        .... ..0. .... .... .... .... = LG bit: Globally unique address (factory default)
        .... ...0 .... .... .... .... = IG bit: Individual address (unicast)
    Type: IPv4 (0x0800)
Internet Protocol Version 4, Src: 10.0.1.11, Dst: 10.0.1.12
    0100 .... = Version: 4
    .... 0101 = Header Length: 20 bytes
    Differentiated Services Field: 0x10 (DSCP: Unknown, ECN: Not-ECT)
        0001 00.. = Differentiated Services Codepoint: Unknown (4)
        .... ..00 = Explicit Congestion Notification: Not ECN-Capable Transport (0)
    Total Length: 53
    Identification: 0x22f6 (8950)
    Flags: 0x02 (Don't Fragment)
        0... .... = Reserved bit: Not set
        .1.. .... = Don't fragment: Set
        ..0. .... = More fragments: Not set
    Fragment offset: 0
    Time to live: 64
    Protocol: TCP (6)
    Header checksum: 0x01a7 [validation disabled]
        [Good: False]
        [Bad: False]
    Source: 10.0.1.11
    Destination: 10.0.1.12
    [Source GeoIP: Unknown]
    [Destination GeoIP: Unknown]
Transmission Control Protocol, Src Port: 40168 (40168), Dst Port: 23 (23), Seq: 1, Ack: 1, Len: 1
    Source Port: 40168
    Destination Port: 23
    [Stream index: 0]
    [TCP Segment Len: 1]
    Sequence number: 1    (relative sequence number)
    [Next sequence number: 2    (relative sequence number)]
    Acknowledgment number: 1    (relative ack number)
    Header Length: 32 bytes
    Flags: 0x018 (PSH, ACK)
        000. .... .... = Reserved: Not set
        ...0 .... .... = Nonce: Not set
        .... 0... .... = Congestion Window Reduced (CWR): Not set
        .... .0.. .... = ECN-Echo: Not set
        .... ..0. .... = Urgent: Not set
        .... ...1 .... = Acknowledgment: Set
        .... .... 1... = Push: Set
        .... .... .0.. = Reset: Not set
        .... .... ..0. = Syn: Not set
        .... .... ...0 = Fin: Not set
        [TCP Flags: *******AP***]
    Window size value: 237
    [Calculated window size: 237]
    [Window size scaling factor: -1 (unknown)]
    Checksum: 0x163e [validation disabled]
        [Good Checksum: False]
        [Bad Checksum: False]
    Urgent pointer: 0
    Options: (12 bytes), No-Operation (NOP), No-Operation (NOP), Timestamps
        No-Operation (NOP)
            Type: 1
                0... .... = Copy on fragmentation: No
                .00. .... = Class: Control (0)
                ...0 0001 = Number: No-Operation (NOP) (1)
        No-Operation (NOP)
            Type: 1
                0... .... = Copy on fragmentation: No
                .00. .... = Class: Control (0)
                ...0 0001 = Number: No-Operation (NOP) (1)
        Timestamps: TSval 1577177, TSecr 1567136
            Kind: Time Stamp Option (8)
            Length: 10
            Timestamp value: 1577177
            Timestamp echo reply: 1567136
    [SEQ/ACK analysis]
        [Bytes in flight: 1]
Telnet
    Data: m

      2 0.000556817    10.0.1.12             10.0.1.11             TELNET   67     Telnet Data ...

Frame 2: 67 bytes on wire (536 bits), 67 bytes captured (536 bits) on interface 0
    Interface id: 0 (eth0)
    Encapsulation type: Ethernet (1)
    Arrival Time: Mar  2, 2017 15:16:40.531928635 CET
    [Time shift for this packet: 0.000000000 seconds]
    Epoch Time: 1488464200.531928635 seconds
    [Time delta from previous captured frame: 0.000556817 seconds]
    [Time delta from previous displayed frame: 0.000556817 seconds]
    [Time since reference or first frame: 0.000556817 seconds]
    Frame Number: 2
    Frame Length: 67 bytes (536 bits)
    Capture Length: 67 bytes (536 bits)
    [Frame is marked: False]
    [Frame is ignored: False]
    [Protocols in frame: eth:ethertype:ip:tcp:telnet]
    [Coloring Rule Name: TCP]
    [Coloring Rule String: tcp]
Ethernet II, Src: 68:05:ca:1a:7c:77, Dst: 68:05:ca:1a:7c:70
    Destination: 68:05:ca:1a:7c:70
        Address: 68:05:ca:1a:7c:70
        .... ..0. .... .... .... .... = LG bit: Globally unique address (factory default)
        .... ...0 .... .... .... .... = IG bit: Individual address (unicast)
    Source: 68:05:ca:1a:7c:77
        Address: 68:05:ca:1a:7c:77
        .... ..0. .... .... .... .... = LG bit: Globally unique address (factory default)
        .... ...0 .... .... .... .... = IG bit: Individual address (unicast)
    Type: IPv4 (0x0800)
Internet Protocol Version 4, Src: 10.0.1.12, Dst: 10.0.1.11
    0100 .... = Version: 4
    .... 0101 = Header Length: 20 bytes
    Differentiated Services Field: 0x10 (DSCP: Unknown, ECN: Not-ECT)
        0001 00.. = Differentiated Services Codepoint: Unknown (4)
        .... ..00 = Explicit Congestion Notification: Not ECN-Capable Transport (0)
    Total Length: 53
    Identification: 0xabd5 (43989)
    Flags: 0x02 (Don't Fragment)
        0... .... = Reserved bit: Not set
        .1.. .... = Don't fragment: Set
        ..0. .... = More fragments: Not set
    Fragment offset: 0
    Time to live: 64
    Protocol: TCP (6)
    Header checksum: 0x78c7 [validation disabled]
        [Good: False]
        [Bad: False]
    Source: 10.0.1.12
    Destination: 10.0.1.11
    [Source GeoIP: Unknown]
    [Destination GeoIP: Unknown]
Transmission Control Protocol, Src Port: 23 (23), Dst Port: 40168 (40168), Seq: 1, Ack: 2, Len: 1
    Source Port: 23
    Destination Port: 40168
    [Stream index: 0]
    [TCP Segment Len: 1]
    Sequence number: 1    (relative sequence number)
    [Next sequence number: 2    (relative sequence number)]
    Acknowledgment number: 2    (relative ack number)
    Header Length: 32 bytes
    Flags: 0x018 (PSH, ACK)
        000. .... .... = Reserved: Not set
        ...0 .... .... = Nonce: Not set
        .... 0... .... = Congestion Window Reduced (CWR): Not set
        .... .0.. .... = ECN-Echo: Not set
        .... ..0. .... = Urgent: Not set
        .... ...1 .... = Acknowledgment: Set
        .... .... 1... = Push: Set
        .... .... .0.. = Reset: Not set
        .... .... ..0. = Syn: Not set
        .... .... ...0 = Fin: Not set
        [TCP Flags: *******AP***]
    Window size value: 227
    [Calculated window size: 227]
    [Window size scaling factor: -1 (unknown)]
    Checksum: 0x4b38 [validation disabled]
        [Good Checksum: False]
        [Bad Checksum: False]
    Urgent pointer: 0
    Options: (12 bytes), No-Operation (NOP), No-Operation (NOP), Timestamps
        No-Operation (NOP)
            Type: 1
                0... .... = Copy on fragmentation: No
                .00. .... = Class: Control (0)
                ...0 0001 = Number: No-Operation (NOP) (1)
        No-Operation (NOP)
            Type: 1
                0... .... = Copy on fragmentation: No
                .00. .... = Class: Control (0)
                ...0 0001 = Number: No-Operation (NOP) (1)
        Timestamps: TSval 1577496, TSecr 1577177
            Kind: Time Stamp Option (8)
            Length: 10
            Timestamp value: 1577496
            Timestamp echo reply: 1577177
    [SEQ/ACK analysis]
        [This is an ACK to the segment in frame: 1]
        [The RTT to ACK the segment was: 0.000556817 seconds]
        [Bytes in flight: 1]
Telnet
    Data: m

      3 0.000583495    10.0.1.11             10.0.1.12             TCP      66     40168 → 23 [ACK] Seq=2 Ack=2 Win=237 Len=0 TSval=1577178 TSecr=1577496

Frame 3: 66 bytes on wire (528 bits), 66 bytes captured (528 bits) on interface 0
    Interface id: 0 (eth0)
    Encapsulation type: Ethernet (1)
    Arrival Time: Mar  2, 2017 15:16:40.531955313 CET
    [Time shift for this packet: 0.000000000 seconds]
    Epoch Time: 1488464200.531955313 seconds
    [Time delta from previous captured frame: 0.000026678 seconds]
    [Time delta from previous displayed frame: 0.000026678 seconds]
    [Time since reference or first frame: 0.000583495 seconds]
    Frame Number: 3
    Frame Length: 66 bytes (528 bits)
    Capture Length: 66 bytes (528 bits)
    [Frame is marked: False]
    [Frame is ignored: False]
    [Protocols in frame: eth:ethertype:ip:tcp]
    [Coloring Rule Name: TCP]
    [Coloring Rule String: tcp]
Ethernet II, Src: 68:05:ca:1a:7c:70, Dst: 68:05:ca:1a:7c:77
    Destination: 68:05:ca:1a:7c:77
        Address: 68:05:ca:1a:7c:77
        .... ..0. .... .... .... .... = LG bit: Globally unique address (factory default)
        .... ...0 .... .... .... .... = IG bit: Individual address (unicast)
    Source: 68:05:ca:1a:7c:70
        Address: 68:05:ca:1a:7c:70
        .... ..0. .... .... .... .... = LG bit: Globally unique address (factory default)
        .... ...0 .... .... .... .... = IG bit: Individual address (unicast)
    Type: IPv4 (0x0800)
Internet Protocol Version 4, Src: 10.0.1.11, Dst: 10.0.1.12
    0100 .... = Version: 4
    .... 0101 = Header Length: 20 bytes
    Differentiated Services Field: 0x10 (DSCP: Unknown, ECN: Not-ECT)
        0001 00.. = Differentiated Services Codepoint: Unknown (4)
        .... ..00 = Explicit Congestion Notification: Not ECN-Capable Transport (0)
    Total Length: 52
    Identification: 0x22f7 (8951)
    Flags: 0x02 (Don't Fragment)
        0... .... = Reserved bit: Not set
        .1.. .... = Don't fragment: Set
        ..0. .... = More fragments: Not set
    Fragment offset: 0
    Time to live: 64
    Protocol: TCP (6)
    Header checksum: 0x01a7 [validation disabled]
        [Good: False]
        [Bad: False]
    Source: 10.0.1.11
    Destination: 10.0.1.12
    [Source GeoIP: Unknown]
    [Destination GeoIP: Unknown]
Transmission Control Protocol, Src Port: 40168 (40168), Dst Port: 23 (23), Seq: 2, Ack: 2, Len: 0
    Source Port: 40168
    Destination Port: 23
    [Stream index: 0]
    [TCP Segment Len: 0]
    Sequence number: 2    (relative sequence number)
    Acknowledgment number: 2    (relative ack number)
    Header Length: 32 bytes
    Flags: 0x010 (ACK)
        000. .... .... = Reserved: Not set
        ...0 .... .... = Nonce: Not set
        .... 0... .... = Congestion Window Reduced (CWR): Not set
        .... .0.. .... = ECN-Echo: Not set
        .... ..0. .... = Urgent: Not set
        .... ...1 .... = Acknowledgment: Set
        .... .... 0... = Push: Not set
        .... .... .0.. = Reset: Not set
        .... .... ..0. = Syn: Not set
        .... .... ...0 = Fin: Not set
        [TCP Flags: *******A****]
    Window size value: 237
    [Calculated window size: 237]
    [Window size scaling factor: -1 (unknown)]
    Checksum: 0x163d [validation disabled]
        [Good Checksum: False]
        [Bad Checksum: False]
    Urgent pointer: 0
    Options: (12 bytes), No-Operation (NOP), No-Operation (NOP), Timestamps
        No-Operation (NOP)
            Type: 1
                0... .... = Copy on fragmentation: No
                .00. .... = Class: Control (0)
                ...0 0001 = Number: No-Operation (NOP) (1)
        No-Operation (NOP)
            Type: 1
                0... .... = Copy on fragmentation: No
                .00. .... = Class: Control (0)
                ...0 0001 = Number: No-Operation (NOP) (1)
        Timestamps: TSval 1577178, TSecr 1577496
            Kind: Time Stamp Option (8)
            Length: 10
            Timestamp value: 1577178
            Timestamp echo reply: 1577496
    [SEQ/ACK analysis]
        [This is an ACK to the segment in frame: 2]
        [The RTT to ACK the segment was: 0.000026678 seconds]

      4 0.047399441    10.0.1.11             10.0.1.12             TELNET   67     Telnet Data ...

Frame 4: 67 bytes on wire (536 bits), 67 bytes captured (536 bits) on interface 0
    Interface id: 0 (eth0)
    Encapsulation type: Ethernet (1)
    Arrival Time: Mar  2, 2017 15:16:40.578771259 CET
    [Time shift for this packet: 0.000000000 seconds]
    Epoch Time: 1488464200.578771259 seconds
    [Time delta from previous captured frame: 0.046815946 seconds]
    [Time delta from previous displayed frame: 0.046815946 seconds]
    [Time since reference or first frame: 0.047399441 seconds]
    Frame Number: 4
    Frame Length: 67 bytes (536 bits)
    Capture Length: 67 bytes (536 bits)
    [Frame is marked: False]
    [Frame is ignored: False]
    [Protocols in frame: eth:ethertype:ip:tcp:telnet]
    [Coloring Rule Name: TCP]
    [Coloring Rule String: tcp]
Ethernet II, Src: 68:05:ca:1a:7c:70, Dst: 68:05:ca:1a:7c:77
    Destination: 68:05:ca:1a:7c:77
        Address: 68:05:ca:1a:7c:77
        .... ..0. .... .... .... .... = LG bit: Globally unique address (factory default)
        .... ...0 .... .... .... .... = IG bit: Individual address (unicast)
    Source: 68:05:ca:1a:7c:70
        Address: 68:05:ca:1a:7c:70
        .... ..0. .... .... .... .... = LG bit: Globally unique address (factory default)
        .... ...0 .... .... .... .... = IG bit: Individual address (unicast)
    Type: IPv4 (0x0800)
Internet Protocol Version 4, Src: 10.0.1.11, Dst: 10.0.1.12
    0100 .... = Version: 4
    .... 0101 = Header Length: 20 bytes
    Differentiated Services Field: 0x10 (DSCP: Unknown, ECN: Not-ECT)
        0001 00.. = Differentiated Services Codepoint: Unknown (4)
        .... ..00 = Explicit Congestion Notification: Not ECN-Capable Transport (0)
    Total Length: 53
    Identification: 0x22f8 (8952)
    Flags: 0x02 (Don't Fragment)
        0... .... = Reserved bit: Not set
        .1.. .... = Don't fragment: Set
        ..0. .... = More fragments: Not set
    Fragment offset: 0
    Time to live: 64
    Protocol: TCP (6)
    Header checksum: 0x01a5 [validation disabled]
        [Good: False]
        [Bad: False]
    Source: 10.0.1.11
    Destination: 10.0.1.12
    [Source GeoIP: Unknown]
    [Destination GeoIP: Unknown]
Transmission Control Protocol, Src Port: 40168 (40168), Dst Port: 23 (23), Seq: 2, Ack: 2, Len: 1
    Source Port: 40168
    Destination Port: 23
    [Stream index: 0]
    [TCP Segment Len: 1]
    Sequence number: 2    (relative sequence number)
    [Next sequence number: 3    (relative sequence number)]
    Acknowledgment number: 2    (relative ack number)
    Header Length: 32 bytes
    Flags: 0x018 (PSH, ACK)
        000. .... .... = Reserved: Not set
        ...0 .... .... = Nonce: Not set
        .... 0... .... = Congestion Window Reduced (CWR): Not set
        .... .0.. .... = ECN-Echo: Not set
        .... ..0. .... = Urgent: Not set
        .... ...1 .... = Acknowledgment: Set
        .... .... 1... = Push: Set
        .... .... .0.. = Reset: Not set
        .... .... ..0. = Syn: Not set
        .... .... ...0 = Fin: Not set
        [TCP Flags: *******AP***]
    Window size value: 237
    [Calculated window size: 237]
    [Window size scaling factor: -1 (unknown)]
    Checksum: 0x163e [validation disabled]
        [Good Checksum: False]
        [Bad Checksum: False]
    Urgent pointer: 0
    Options: (12 bytes), No-Operation (NOP), No-Operation (NOP), Timestamps
        No-Operation (NOP)
            Type: 1
                0... .... = Copy on fragmentation: No
                .00. .... = Class: Control (0)
                ...0 0001 = Number: No-Operation (NOP) (1)
        No-Operation (NOP)
            Type: 1
                0... .... = Copy on fragmentation: No
                .00. .... = Class: Control (0)
                ...0 0001 = Number: No-Operation (NOP) (1)
        Timestamps: TSval 1577189, TSecr 1577496
            Kind: Time Stamp Option (8)
            Length: 10
            Timestamp value: 1577189
            Timestamp echo reply: 1577496
    [SEQ/ACK analysis]
        [Bytes in flight: 1]
Telnet
    Data: k

      5 0.047922477    10.0.1.12             10.0.1.11             TELNET   67     Telnet Data ...

Frame 5: 67 bytes on wire (536 bits), 67 bytes captured (536 bits) on interface 0
    Interface id: 0 (eth0)
    Encapsulation type: Ethernet (1)
    Arrival Time: Mar  2, 2017 15:16:40.579294295 CET
    [Time shift for this packet: 0.000000000 seconds]
    Epoch Time: 1488464200.579294295 seconds
    [Time delta from previous captured frame: 0.000523036 seconds]
    [Time delta from previous displayed frame: 0.000523036 seconds]
    [Time since reference or first frame: 0.047922477 seconds]
    Frame Number: 5
    Frame Length: 67 bytes (536 bits)
    Capture Length: 67 bytes (536 bits)
    [Frame is marked: False]
    [Frame is ignored: False]
    [Protocols in frame: eth:ethertype:ip:tcp:telnet]
    [Coloring Rule Name: TCP]
    [Coloring Rule String: tcp]
Ethernet II, Src: 68:05:ca:1a:7c:77, Dst: 68:05:ca:1a:7c:70
    Destination: 68:05:ca:1a:7c:70
        Address: 68:05:ca:1a:7c:70
        .... ..0. .... .... .... .... = LG bit: Globally unique address (factory default)
        .... ...0 .... .... .... .... = IG bit: Individual address (unicast)
    Source: 68:05:ca:1a:7c:77
        Address: 68:05:ca:1a:7c:77
        .... ..0. .... .... .... .... = LG bit: Globally unique address (factory default)
        .... ...0 .... .... .... .... = IG bit: Individual address (unicast)
    Type: IPv4 (0x0800)
Internet Protocol Version 4, Src: 10.0.1.12, Dst: 10.0.1.11
    0100 .... = Version: 4
    .... 0101 = Header Length: 20 bytes
    Differentiated Services Field: 0x10 (DSCP: Unknown, ECN: Not-ECT)
        0001 00.. = Differentiated Services Codepoint: Unknown (4)
        .... ..00 = Explicit Congestion Notification: Not ECN-Capable Transport (0)
    Total Length: 53
    Identification: 0xabd6 (43990)
    Flags: 0x02 (Don't Fragment)
        0... .... = Reserved bit: Not set
        .1.. .... = Don't fragment: Set
        ..0. .... = More fragments: Not set
    Fragment offset: 0
    Time to live: 64
    Protocol: TCP (6)
    Header checksum: 0x78c6 [validation disabled]
        [Good: False]
        [Bad: False]
    Source: 10.0.1.12
    Destination: 10.0.1.11
    [Source GeoIP: Unknown]
    [Destination GeoIP: Unknown]
Transmission Control Protocol, Src Port: 23 (23), Dst Port: 40168 (40168), Seq: 2, Ack: 3, Len: 1
    Source Port: 23
    Destination Port: 40168
    [Stream index: 0]
    [TCP Segment Len: 1]
    Sequence number: 2    (relative sequence number)
    [Next sequence number: 3    (relative sequence number)]
    Acknowledgment number: 3    (relative ack number)
    Header Length: 32 bytes
    Flags: 0x018 (PSH, ACK)
        000. .... .... = Reserved: Not set
        ...0 .... .... = Nonce: Not set
        .... 0... .... = Congestion Window Reduced (CWR): Not set
        .... .0.. .... = ECN-Echo: Not set
        .... ..0. .... = Urgent: Not set
        .... ...1 .... = Acknowledgment: Set
        .... .... 1... = Push: Set
        .... .... .0.. = Reset: Not set
        .... .... ..0. = Syn: Not set
        .... .... ...0 = Fin: Not set
        [TCP Flags: *******AP***]
    Window size value: 227
    [Calculated window size: 227]
    [Window size scaling factor: -1 (unknown)]
    Checksum: 0x4d1e [validation disabled]
        [Good Checksum: False]
        [Bad Checksum: False]
    Urgent pointer: 0
    Options: (12 bytes), No-Operation (NOP), No-Operation (NOP), Timestamps
        No-Operation (NOP)
            Type: 1
                0... .... = Copy on fragmentation: No
                .00. .... = Class: Control (0)
                ...0 0001 = Number: No-Operation (NOP) (1)
        No-Operation (NOP)
            Type: 1
                0... .... = Copy on fragmentation: No
                .00. .... = Class: Control (0)
                ...0 0001 = Number: No-Operation (NOP) (1)
        Timestamps: TSval 1577508, TSecr 1577189
            Kind: Time Stamp Option (8)
            Length: 10
            Timestamp value: 1577508
            Timestamp echo reply: 1577189
    [SEQ/ACK analysis]
        [This is an ACK to the segment in frame: 4]
        [The RTT to ACK the segment was: 0.000523036 seconds]
        [Bytes in flight: 1]
Telnet
    Data: k

      6 0.047941758    10.0.1.11             10.0.1.12             TCP      66     40168 → 23 [ACK] Seq=3 Ack=3 Win=237 Len=0 TSval=1577189 TSecr=1577508

Frame 6: 66 bytes on wire (528 bits), 66 bytes captured (528 bits) on interface 0
    Interface id: 0 (eth0)
    Encapsulation type: Ethernet (1)
    Arrival Time: Mar  2, 2017 15:16:40.579313576 CET
    [Time shift for this packet: 0.000000000 seconds]
    Epoch Time: 1488464200.579313576 seconds
    [Time delta from previous captured frame: 0.000019281 seconds]
    [Time delta from previous displayed frame: 0.000019281 seconds]
    [Time since reference or first frame: 0.047941758 seconds]
    Frame Number: 6
    Frame Length: 66 bytes (528 bits)
    Capture Length: 66 bytes (528 bits)
    [Frame is marked: False]
    [Frame is ignored: False]
    [Protocols in frame: eth:ethertype:ip:tcp]
    [Coloring Rule Name: TCP]
    [Coloring Rule String: tcp]
Ethernet II, Src: 68:05:ca:1a:7c:70, Dst: 68:05:ca:1a:7c:77
    Destination: 68:05:ca:1a:7c:77
        Address: 68:05:ca:1a:7c:77
        .... ..0. .... .... .... .... = LG bit: Globally unique address (factory default)
        .... ...0 .... .... .... .... = IG bit: Individual address (unicast)
    Source: 68:05:ca:1a:7c:70
        Address: 68:05:ca:1a:7c:70
        .... ..0. .... .... .... .... = LG bit: Globally unique address (factory default)
        .... ...0 .... .... .... .... = IG bit: Individual address (unicast)
    Type: IPv4 (0x0800)
Internet Protocol Version 4, Src: 10.0.1.11, Dst: 10.0.1.12
    0100 .... = Version: 4
    .... 0101 = Header Length: 20 bytes
    Differentiated Services Field: 0x10 (DSCP: Unknown, ECN: Not-ECT)
        0001 00.. = Differentiated Services Codepoint: Unknown (4)
        .... ..00 = Explicit Congestion Notification: Not ECN-Capable Transport (0)
    Total Length: 52
    Identification: 0x22f9 (8953)
    Flags: 0x02 (Don't Fragment)
        0... .... = Reserved bit: Not set
        .1.. .... = Don't fragment: Set
        ..0. .... = More fragments: Not set
    Fragment offset: 0
    Time to live: 64
    Protocol: TCP (6)
    Header checksum: 0x01a5 [validation disabled]
        [Good: False]
        [Bad: False]
    Source: 10.0.1.11
    Destination: 10.0.1.12
    [Source GeoIP: Unknown]
    [Destination GeoIP: Unknown]
Transmission Control Protocol, Src Port: 40168 (40168), Dst Port: 23 (23), Seq: 3, Ack: 3, Len: 0
    Source Port: 40168
    Destination Port: 23
    [Stream index: 0]
    [TCP Segment Len: 0]
    Sequence number: 3    (relative sequence number)
    Acknowledgment number: 3    (relative ack number)
    Header Length: 32 bytes
    Flags: 0x010 (ACK)
        000. .... .... = Reserved: Not set
        ...0 .... .... = Nonce: Not set
        .... 0... .... = Congestion Window Reduced (CWR): Not set
        .... .0.. .... = ECN-Echo: Not set
        .... ..0. .... = Urgent: Not set
        .... ...1 .... = Acknowledgment: Set
        .... .... 0... = Push: Not set
        .... .... .0.. = Reset: Not set
        .... .... ..0. = Syn: Not set
        .... .... ...0 = Fin: Not set
        [TCP Flags: *******A****]
    Window size value: 237
    [Calculated window size: 237]
    [Window size scaling factor: -1 (unknown)]
    Checksum: 0x163d [validation disabled]
        [Good Checksum: False]
        [Bad Checksum: False]
    Urgent pointer: 0
    Options: (12 bytes), No-Operation (NOP), No-Operation (NOP), Timestamps
        No-Operation (NOP)
            Type: 1
                0... .... = Copy on fragmentation: No
                .00. .... = Class: Control (0)
                ...0 0001 = Number: No-Operation (NOP) (1)
        No-Operation (NOP)
            Type: 1
                0... .... = Copy on fragmentation: No
                .00. .... = Class: Control (0)
                ...0 0001 = Number: No-Operation (NOP) (1)
        Timestamps: TSval 1577189, TSecr 1577508
            Kind: Time Stamp Option (8)
            Length: 10
            Timestamp value: 1577189
            Timestamp echo reply: 1577508
    [SEQ/ACK analysis]
        [This is an ACK to the segment in frame: 5]
        [The RTT to ACK the segment was: 0.000019281 seconds]

      7 0.199641692    10.0.1.11             10.0.1.12             TELNET   67     Telnet Data ...

Frame 7: 67 bytes on wire (536 bits), 67 bytes captured (536 bits) on interface 0
    Interface id: 0 (eth0)
    Encapsulation type: Ethernet (1)
    Arrival Time: Mar  2, 2017 15:16:40.731013510 CET
    [Time shift for this packet: 0.000000000 seconds]
    Epoch Time: 1488464200.731013510 seconds
    [Time delta from previous captured frame: 0.151699934 seconds]
    [Time delta from previous displayed frame: 0.151699934 seconds]
    [Time since reference or first frame: 0.199641692 seconds]
    Frame Number: 7
    Frame Length: 67 bytes (536 bits)
    Capture Length: 67 bytes (536 bits)
    [Frame is marked: False]
    [Frame is ignored: False]
    [Protocols in frame: eth:ethertype:ip:tcp:telnet]
    [Coloring Rule Name: TCP]
    [Coloring Rule String: tcp]
Ethernet II, Src: 68:05:ca:1a:7c:70, Dst: 68:05:ca:1a:7c:77
    Destination: 68:05:ca:1a:7c:77
        Address: 68:05:ca:1a:7c:77
        .... ..0. .... .... .... .... = LG bit: Globally unique address (factory default)
        .... ...0 .... .... .... .... = IG bit: Individual address (unicast)
    Source: 68:05:ca:1a:7c:70
        Address: 68:05:ca:1a:7c:70
        .... ..0. .... .... .... .... = LG bit: Globally unique address (factory default)
        .... ...0 .... .... .... .... = IG bit: Individual address (unicast)
    Type: IPv4 (0x0800)
Internet Protocol Version 4, Src: 10.0.1.11, Dst: 10.0.1.12
    0100 .... = Version: 4
    .... 0101 = Header Length: 20 bytes
    Differentiated Services Field: 0x10 (DSCP: Unknown, ECN: Not-ECT)
        0001 00.. = Differentiated Services Codepoint: Unknown (4)
        .... ..00 = Explicit Congestion Notification: Not ECN-Capable Transport (0)
    Total Length: 53
    Identification: 0x22fa (8954)
    Flags: 0x02 (Don't Fragment)
        0... .... = Reserved bit: Not set
        .1.. .... = Don't fragment: Set
        ..0. .... = More fragments: Not set
    Fragment offset: 0
    Time to live: 64
    Protocol: TCP (6)
    Header checksum: 0x01a3 [validation disabled]
        [Good: False]
        [Bad: False]
    Source: 10.0.1.11
    Destination: 10.0.1.12
    [Source GeoIP: Unknown]
    [Destination GeoIP: Unknown]
Transmission Control Protocol, Src Port: 40168 (40168), Dst Port: 23 (23), Seq: 3, Ack: 3, Len: 1
    Source Port: 40168
    Destination Port: 23
    [Stream index: 0]
    [TCP Segment Len: 1]
    Sequence number: 3    (relative sequence number)
    [Next sequence number: 4    (relative sequence number)]
    Acknowledgment number: 3    (relative ack number)
    Header Length: 32 bytes
    Flags: 0x018 (PSH, ACK)
        000. .... .... = Reserved: Not set
        ...0 .... .... = Nonce: Not set
        .... 0... .... = Congestion Window Reduced (CWR): Not set
        .... .0.. .... = ECN-Echo: Not set
        .... ..0. .... = Urgent: Not set
        .... ...1 .... = Acknowledgment: Set
        .... .... 1... = Push: Set
        .... .... .0.. = Reset: Not set
        .... .... ..0. = Syn: Not set
        .... .... ...0 = Fin: Not set
        [TCP Flags: *******AP***]
    Window size value: 237
    [Calculated window size: 237]
    [Window size scaling factor: -1 (unknown)]
    Checksum: 0x163e [validation disabled]
        [Good Checksum: False]
        [Bad Checksum: False]
    Urgent pointer: 0
    Options: (12 bytes), No-Operation (NOP), No-Operation (NOP), Timestamps
        No-Operation (NOP)
            Type: 1
                0... .... = Copy on fragmentation: No
                .00. .... = Class: Control (0)
                ...0 0001 = Number: No-Operation (NOP) (1)
        No-Operation (NOP)
            Type: 1
                0... .... = Copy on fragmentation: No
                .00. .... = Class: Control (0)
                ...0 0001 = Number: No-Operation (NOP) (1)
        Timestamps: TSval 1577227, TSecr 1577508
            Kind: Time Stamp Option (8)
            Length: 10
            Timestamp value: 1577227
            Timestamp echo reply: 1577508
    [SEQ/ACK analysis]
        [Bytes in flight: 1]
Telnet
    Data: d

      8 0.200160908    10.0.1.12             10.0.1.11             TELNET   67     Telnet Data ...

Frame 8: 67 bytes on wire (536 bits), 67 bytes captured (536 bits) on interface 0
    Interface id: 0 (eth0)
    Encapsulation type: Ethernet (1)
    Arrival Time: Mar  2, 2017 15:16:40.731532726 CET
    [Time shift for this packet: 0.000000000 seconds]
    Epoch Time: 1488464200.731532726 seconds
    [Time delta from previous captured frame: 0.000519216 seconds]
    [Time delta from previous displayed frame: 0.000519216 seconds]
    [Time since reference or first frame: 0.200160908 seconds]
    Frame Number: 8
    Frame Length: 67 bytes (536 bits)
    Capture Length: 67 bytes (536 bits)
    [Frame is marked: False]
    [Frame is ignored: False]
    [Protocols in frame: eth:ethertype:ip:tcp:telnet]
    [Coloring Rule Name: TCP]
    [Coloring Rule String: tcp]
Ethernet II, Src: 68:05:ca:1a:7c:77, Dst: 68:05:ca:1a:7c:70
    Destination: 68:05:ca:1a:7c:70
        Address: 68:05:ca:1a:7c:70
        .... ..0. .... .... .... .... = LG bit: Globally unique address (factory default)
        .... ...0 .... .... .... .... = IG bit: Individual address (unicast)
    Source: 68:05:ca:1a:7c:77
        Address: 68:05:ca:1a:7c:77
        .... ..0. .... .... .... .... = LG bit: Globally unique address (factory default)
        .... ...0 .... .... .... .... = IG bit: Individual address (unicast)
    Type: IPv4 (0x0800)
Internet Protocol Version 4, Src: 10.0.1.12, Dst: 10.0.1.11
    0100 .... = Version: 4
    .... 0101 = Header Length: 20 bytes
    Differentiated Services Field: 0x10 (DSCP: Unknown, ECN: Not-ECT)
        0001 00.. = Differentiated Services Codepoint: Unknown (4)
        .... ..00 = Explicit Congestion Notification: Not ECN-Capable Transport (0)
    Total Length: 53
    Identification: 0xabd7 (43991)
    Flags: 0x02 (Don't Fragment)
        0... .... = Reserved bit: Not set
        .1.. .... = Don't fragment: Set
        ..0. .... = More fragments: Not set
    Fragment offset: 0
    Time to live: 64
    Protocol: TCP (6)
    Header checksum: 0x78c5 [validation disabled]
        [Good: False]
        [Bad: False]
    Source: 10.0.1.12
    Destination: 10.0.1.11
    [Source GeoIP: Unknown]
    [Destination GeoIP: Unknown]
Transmission Control Protocol, Src Port: 23 (23), Dst Port: 40168 (40168), Seq: 3, Ack: 4, Len: 1
    Source Port: 23
    Destination Port: 40168
    [Stream index: 0]
    [TCP Segment Len: 1]
    Sequence number: 3    (relative sequence number)
    [Next sequence number: 4    (relative sequence number)]
    Acknowledgment number: 4    (relative ack number)
    Header Length: 32 bytes
    Flags: 0x018 (PSH, ACK)
        000. .... .... = Reserved: Not set
        ...0 .... .... = Nonce: Not set
        .... 0... .... = Congestion Window Reduced (CWR): Not set
        .... .0.. .... = ECN-Echo: Not set
        .... ..0. .... = Urgent: Not set
        .... ...1 .... = Acknowledgment: Set
        .... .... 1... = Push: Set
        .... .... .0.. = Reset: Not set
        .... .... ..0. = Syn: Not set
        .... .... ...0 = Fin: Not set
        [TCP Flags: *******AP***]
    Window size value: 227
    [Calculated window size: 227]
    [Window size scaling factor: -1 (unknown)]
    Checksum: 0x53d0 [validation disabled]
        [Good Checksum: False]
        [Bad Checksum: False]
    Urgent pointer: 0
    Options: (12 bytes), No-Operation (NOP), No-Operation (NOP), Timestamps
        No-Operation (NOP)
            Type: 1
                0... .... = Copy on fragmentation: No
                .00. .... = Class: Control (0)
                ...0 0001 = Number: No-Operation (NOP) (1)
        No-Operation (NOP)
            Type: 1
                0... .... = Copy on fragmentation: No
                .00. .... = Class: Control (0)
                ...0 0001 = Number: No-Operation (NOP) (1)
        Timestamps: TSval 1577546, TSecr 1577227
            Kind: Time Stamp Option (8)
            Length: 10
            Timestamp value: 1577546
            Timestamp echo reply: 1577227
    [SEQ/ACK analysis]
        [This is an ACK to the segment in frame: 7]
        [The RTT to ACK the segment was: 0.000519216 seconds]
        [Bytes in flight: 1]
Telnet
    Data: d

      9 0.200183149    10.0.1.11             10.0.1.12             TCP      66     40168 → 23 [ACK] Seq=4 Ack=4 Win=237 Len=0 TSval=1577227 TSecr=1577546

Frame 9: 66 bytes on wire (528 bits), 66 bytes captured (528 bits) on interface 0
    Interface id: 0 (eth0)
    Encapsulation type: Ethernet (1)
    Arrival Time: Mar  2, 2017 15:16:40.731554967 CET
    [Time shift for this packet: 0.000000000 seconds]
    Epoch Time: 1488464200.731554967 seconds
    [Time delta from previous captured frame: 0.000022241 seconds]
    [Time delta from previous displayed frame: 0.000022241 seconds]
    [Time since reference or first frame: 0.200183149 seconds]
    Frame Number: 9
    Frame Length: 66 bytes (528 bits)
    Capture Length: 66 bytes (528 bits)
    [Frame is marked: False]
    [Frame is ignored: False]
    [Protocols in frame: eth:ethertype:ip:tcp]
    [Coloring Rule Name: TCP]
    [Coloring Rule String: tcp]
Ethernet II, Src: 68:05:ca:1a:7c:70, Dst: 68:05:ca:1a:7c:77
    Destination: 68:05:ca:1a:7c:77
        Address: 68:05:ca:1a:7c:77
        .... ..0. .... .... .... .... = LG bit: Globally unique address (factory default)
        .... ...0 .... .... .... .... = IG bit: Individual address (unicast)
    Source: 68:05:ca:1a:7c:70
        Address: 68:05:ca:1a:7c:70
        .... ..0. .... .... .... .... = LG bit: Globally unique address (factory default)
        .... ...0 .... .... .... .... = IG bit: Individual address (unicast)
    Type: IPv4 (0x0800)
Internet Protocol Version 4, Src: 10.0.1.11, Dst: 10.0.1.12
    0100 .... = Version: 4
    .... 0101 = Header Length: 20 bytes
    Differentiated Services Field: 0x10 (DSCP: Unknown, ECN: Not-ECT)
        0001 00.. = Differentiated Services Codepoint: Unknown (4)
        .... ..00 = Explicit Congestion Notification: Not ECN-Capable Transport (0)
    Total Length: 52
    Identification: 0x22fb (8955)
    Flags: 0x02 (Don't Fragment)
        0... .... = Reserved bit: Not set
        .1.. .... = Don't fragment: Set
        ..0. .... = More fragments: Not set
    Fragment offset: 0
    Time to live: 64
    Protocol: TCP (6)
    Header checksum: 0x01a3 [validation disabled]
        [Good: False]
        [Bad: False]
    Source: 10.0.1.11
    Destination: 10.0.1.12
    [Source GeoIP: Unknown]
    [Destination GeoIP: Unknown]
Transmission Control Protocol, Src Port: 40168 (40168), Dst Port: 23 (23), Seq: 4, Ack: 4, Len: 0
    Source Port: 40168
    Destination Port: 23
    [Stream index: 0]
    [TCP Segment Len: 0]
    Sequence number: 4    (relative sequence number)
    Acknowledgment number: 4    (relative ack number)
    Header Length: 32 bytes
    Flags: 0x010 (ACK)
        000. .... .... = Reserved: Not set
        ...0 .... .... = Nonce: Not set
        .... 0... .... = Congestion Window Reduced (CWR): Not set
        .... .0.. .... = ECN-Echo: Not set
        .... ..0. .... = Urgent: Not set
        .... ...1 .... = Acknowledgment: Set
        .... .... 0... = Push: Not set
        .... .... .0.. = Reset: Not set
        .... .... ..0. = Syn: Not set
        .... .... ...0 = Fin: Not set
        [TCP Flags: *******A****]
    Window size value: 237
    [Calculated window size: 237]
    [Window size scaling factor: -1 (unknown)]
    Checksum: 0x163d [validation disabled]
        [Good Checksum: False]
        [Bad Checksum: False]
    Urgent pointer: 0
    Options: (12 bytes), No-Operation (NOP), No-Operation (NOP), Timestamps
        No-Operation (NOP)
            Type: 1
                0... .... = Copy on fragmentation: No
                .00. .... = Class: Control (0)
                ...0 0001 = Number: No-Operation (NOP) (1)
        No-Operation (NOP)
            Type: 1
                0... .... = Copy on fragmentation: No
                .00. .... = Class: Control (0)
                ...0 0001 = Number: No-Operation (NOP) (1)
        Timestamps: TSval 1577227, TSecr 1577546
            Kind: Time Stamp Option (8)
            Length: 10
            Timestamp value: 1577227
            Timestamp echo reply: 1577546
    [SEQ/ACK analysis]
        [This is an ACK to the segment in frame: 8]
        [The RTT to ACK the segment was: 0.000022241 seconds]

     10 0.287704616    10.0.1.11             10.0.1.12             TELNET   67     Telnet Data ...

Frame 10: 67 bytes on wire (536 bits), 67 bytes captured (536 bits) on interface 0
    Interface id: 0 (eth0)
    Encapsulation type: Ethernet (1)
    Arrival Time: Mar  2, 2017 15:16:40.819076434 CET
    [Time shift for this packet: 0.000000000 seconds]
    Epoch Time: 1488464200.819076434 seconds
    [Time delta from previous captured frame: 0.087521467 seconds]
    [Time delta from previous displayed frame: 0.087521467 seconds]
    [Time since reference or first frame: 0.287704616 seconds]
    Frame Number: 10
    Frame Length: 67 bytes (536 bits)
    Capture Length: 67 bytes (536 bits)
    [Frame is marked: False]
    [Frame is ignored: False]
    [Protocols in frame: eth:ethertype:ip:tcp:telnet]
    [Coloring Rule Name: TCP]
    [Coloring Rule String: tcp]
Ethernet II, Src: 68:05:ca:1a:7c:70, Dst: 68:05:ca:1a:7c:77
    Destination: 68:05:ca:1a:7c:77
        Address: 68:05:ca:1a:7c:77
        .... ..0. .... .... .... .... = LG bit: Globally unique address (factory default)
        .... ...0 .... .... .... .... = IG bit: Individual address (unicast)
    Source: 68:05:ca:1a:7c:70
        Address: 68:05:ca:1a:7c:70
        .... ..0. .... .... .... .... = LG bit: Globally unique address (factory default)
        .... ...0 .... .... .... .... = IG bit: Individual address (unicast)
    Type: IPv4 (0x0800)
Internet Protocol Version 4, Src: 10.0.1.11, Dst: 10.0.1.12
    0100 .... = Version: 4
    .... 0101 = Header Length: 20 bytes
    Differentiated Services Field: 0x10 (DSCP: Unknown, ECN: Not-ECT)
        0001 00.. = Differentiated Services Codepoint: Unknown (4)
        .... ..00 = Explicit Congestion Notification: Not ECN-Capable Transport (0)
    Total Length: 53
    Identification: 0x22fc (8956)
    Flags: 0x02 (Don't Fragment)
        0... .... = Reserved bit: Not set
        .1.. .... = Don't fragment: Set
        ..0. .... = More fragments: Not set
    Fragment offset: 0
    Time to live: 64
    Protocol: TCP (6)
    Header checksum: 0x01a1 [validation disabled]
        [Good: False]
        [Bad: False]
    Source: 10.0.1.11
    Destination: 10.0.1.12
    [Source GeoIP: Unknown]
    [Destination GeoIP: Unknown]
Transmission Control Protocol, Src Port: 40168 (40168), Dst Port: 23 (23), Seq: 4, Ack: 4, Len: 1
    Source Port: 40168
    Destination Port: 23
