      1 0.000000000    10.0.1.11             10.0.1.12             TCP      74     40166 → 23 [SYN] Seq=0 Win=29200 Len=0 MSS=1460 SACK_PERM=1 TSval=1491384 TSecr=0 WS=128

Frame 1: 74 bytes on wire (592 bits), 74 bytes captured (592 bits) on interface 0
    Interface id: 0 (eth0)
    Encapsulation type: Ethernet (1)
    Arrival Time: Mar  2, 2017 15:10:57.359088247 CET
    [Time shift for this packet: 0.000000000 seconds]
    Epoch Time: 1488463857.359088247 seconds
    [Time delta from previous captured frame: 0.000000000 seconds]
    [Time delta from previous displayed frame: 0.000000000 seconds]
    [Time since reference or first frame: 0.000000000 seconds]
    Frame Number: 1
    Frame Length: 74 bytes (592 bits)
    Capture Length: 74 bytes (592 bits)
    [Frame is marked: False]
    [Frame is ignored: False]
    [Protocols in frame: eth:ethertype:ip:tcp]
    [Coloring Rule Name: TCP SYN/FIN]
    [Coloring Rule String: tcp.flags & 0x02 || tcp.flags.fin == 1]
Ethernet II, Src: 68:05:ca:1a:7c:70, Dst: 68:05:ca:1a:7c:77
    Destination: 68:05:ca:1a:7c:77
        Address: 68:05:ca:1a:7c:77
        .... ..0. .... .... .... .... = LG bit: Globally unique address (factory default)
        .... ...0 .... .... .... .... = IG bit: Individual address (unicast)
    Source: 68:05:ca:1a:7c:70
        Address: 68:05:ca:1a:7c:70
        .... ..0. .... .... .... .... = LG bit: Globally unique address (factory default)
        .... ...0 .... .... .... .... = IG bit: Individual address (unicast)
    Type: IPv4 (0x0800)
Internet Protocol Version 4, Src: 10.0.1.11, Dst: 10.0.1.12
    0100 .... = Version: 4
    .... 0101 = Header Length: 20 bytes
    Differentiated Services Field: 0x10 (DSCP: Unknown, ECN: Not-ECT)
        0001 00.. = Differentiated Services Codepoint: Unknown (4)
        .... ..00 = Explicit Congestion Notification: Not ECN-Capable Transport (0)
    Total Length: 60
    Identification: 0x33fc (13308)
    Flags: 0x02 (Don't Fragment)
        0... .... = Reserved bit: Not set
        .1.. .... = Don't fragment: Set
        ..0. .... = More fragments: Not set
    Fragment offset: 0
    Time to live: 64
    Protocol: TCP (6)
    Header checksum: 0xf099 [validation disabled]
        [Good: False]
        [Bad: False]
    Source: 10.0.1.11
    Destination: 10.0.1.12
    [Source GeoIP: Unknown]
    [Destination GeoIP: Unknown]
Transmission Control Protocol, Src Port: 40166 (40166), Dst Port: 23 (23), Seq: 0, Len: 0
    Source Port: 40166
    Destination Port: 23
    [Stream index: 0]
    [TCP Segment Len: 0]
    Sequence number: 0    (relative sequence number)
    Acknowledgment number: 0
    Header Length: 40 bytes
    Flags: 0x002 (SYN)
        000. .... .... = Reserved: Not set
        ...0 .... .... = Nonce: Not set
        .... 0... .... = Congestion Window Reduced (CWR): Not set
        .... .0.. .... = ECN-Echo: Not set
        .... ..0. .... = Urgent: Not set
        .... ...0 .... = Acknowledgment: Not set
        .... .... 0... = Push: Not set
        .... .... .0.. = Reset: Not set
        .... .... ..1. = Syn: Set
            [Expert Info (Chat/Sequence): Connection establish request (SYN): server port 23]
                [Connection establish request (SYN): server port 23]
                [Severity level: Chat]
                [Group: Sequence]
        .... .... ...0 = Fin: Not set
        [TCP Flags: **********S*]
    Window size value: 29200
    [Calculated window size: 29200]
    Checksum: 0x1645 [validation disabled]
        [Good Checksum: False]
        [Bad Checksum: False]
    Urgent pointer: 0
    Options: (20 bytes), Maximum segment size, SACK permitted, Timestamps, No-Operation (NOP), Window scale
        Maximum segment size: 1460 bytes
            Kind: Maximum Segment Size (2)
            Length: 4
            MSS Value: 1460
        TCP SACK Permitted Option: True
            Kind: SACK Permitted (4)
            Length: 2
        Timestamps: TSval 1491384, TSecr 0
            Kind: Time Stamp Option (8)
            Length: 10
            Timestamp value: 1491384
            Timestamp echo reply: 0
        No-Operation (NOP)
            Type: 1
                0... .... = Copy on fragmentation: No
                .00. .... = Class: Control (0)
                ...0 0001 = Number: No-Operation (NOP) (1)
        Window scale: 7 (multiply by 128)
            Kind: Window Scale (3)
            Length: 3
            Shift count: 7
            [Multiplier: 128]

      2 0.000383676    10.0.1.12             10.0.1.11             TCP      74     23 → 40166 [SYN, ACK] Seq=0 Ack=1 Win=28960 Len=0 MSS=1460 SACK_PERM=1 TSval=1491703 TSecr=1491384 WS=128

Frame 2: 74 bytes on wire (592 bits), 74 bytes captured (592 bits) on interface 0
    Interface id: 0 (eth0)
    Encapsulation type: Ethernet (1)
    Arrival Time: Mar  2, 2017 15:10:57.359471923 CET
    [Time shift for this packet: 0.000000000 seconds]
    Epoch Time: 1488463857.359471923 seconds
    [Time delta from previous captured frame: 0.000383676 seconds]
    [Time delta from previous displayed frame: 0.000383676 seconds]
    [Time since reference or first frame: 0.000383676 seconds]
    Frame Number: 2
    Frame Length: 74 bytes (592 bits)
    Capture Length: 74 bytes (592 bits)
    [Frame is marked: False]
    [Frame is ignored: False]
    [Protocols in frame: eth:ethertype:ip:tcp]
    [Coloring Rule Name: TCP SYN/FIN]
    [Coloring Rule String: tcp.flags & 0x02 || tcp.flags.fin == 1]
Ethernet II, Src: 68:05:ca:1a:7c:77, Dst: 68:05:ca:1a:7c:70
    Destination: 68:05:ca:1a:7c:70
        Address: 68:05:ca:1a:7c:70
        .... ..0. .... .... .... .... = LG bit: Globally unique address (factory default)
        .... ...0 .... .... .... .... = IG bit: Individual address (unicast)
    Source: 68:05:ca:1a:7c:77
        Address: 68:05:ca:1a:7c:77
        .... ..0. .... .... .... .... = LG bit: Globally unique address (factory default)
        .... ...0 .... .... .... .... = IG bit: Individual address (unicast)
    Type: IPv4 (0x0800)
Internet Protocol Version 4, Src: 10.0.1.12, Dst: 10.0.1.11
    0100 .... = Version: 4
    .... 0101 = Header Length: 20 bytes
    Differentiated Services Field: 0x00 (DSCP: CS0, ECN: Not-ECT)
        0000 00.. = Differentiated Services Codepoint: Default (0)
        .... ..00 = Explicit Congestion Notification: Not ECN-Capable Transport (0)
    Total Length: 60
    Identification: 0x0000 (0)
    Flags: 0x02 (Don't Fragment)
        0... .... = Reserved bit: Not set
        .1.. .... = Don't fragment: Set
        ..0. .... = More fragments: Not set
    Fragment offset: 0
    Time to live: 64
    Protocol: TCP (6)
    Header checksum: 0x24a6 [validation disabled]
        [Good: False]
        [Bad: False]
    Source: 10.0.1.12
    Destination: 10.0.1.11
    [Source GeoIP: Unknown]
    [Destination GeoIP: Unknown]
Transmission Control Protocol, Src Port: 23 (23), Dst Port: 40166 (40166), Seq: 0, Ack: 1, Len: 0
    Source Port: 23
    Destination Port: 40166
    [Stream index: 0]
    [TCP Segment Len: 0]
    Sequence number: 0    (relative sequence number)
    Acknowledgment number: 1    (relative ack number)
    Header Length: 40 bytes
    Flags: 0x012 (SYN, ACK)
        000. .... .... = Reserved: Not set
        ...0 .... .... = Nonce: Not set
        .... 0... .... = Congestion Window Reduced (CWR): Not set
        .... .0.. .... = ECN-Echo: Not set
        .... ..0. .... = Urgent: Not set
        .... ...1 .... = Acknowledgment: Set
        .... .... 0... = Push: Not set
        .... .... .0.. = Reset: Not set
        .... .... ..1. = Syn: Set
            [Expert Info (Chat/Sequence): Connection establish acknowledge (SYN+ACK): server port 23]
                [Connection establish acknowledge (SYN+ACK): server port 23]
                [Severity level: Chat]
                [Group: Sequence]
        .... .... ...0 = Fin: Not set
        [TCP Flags: *******A**S*]
    Window size value: 28960
    [Calculated window size: 28960]
    Checksum: 0x7179 [validation disabled]
        [Good Checksum: False]
        [Bad Checksum: False]
    Urgent pointer: 0
    Options: (20 bytes), Maximum segment size, SACK permitted, Timestamps, No-Operation (NOP), Window scale
        Maximum segment size: 1460 bytes
            Kind: Maximum Segment Size (2)
            Length: 4
            MSS Value: 1460
        TCP SACK Permitted Option: True
            Kind: SACK Permitted (4)
            Length: 2
        Timestamps: TSval 1491703, TSecr 1491384
            Kind: Time Stamp Option (8)
            Length: 10
            Timestamp value: 1491703
            Timestamp echo reply: 1491384
        No-Operation (NOP)
            Type: 1
                0... .... = Copy on fragmentation: No
                .00. .... = Class: Control (0)
                ...0 0001 = Number: No-Operation (NOP) (1)
        Window scale: 7 (multiply by 128)
            Kind: Window Scale (3)
            Length: 3
            Shift count: 7
            [Multiplier: 128]
    [SEQ/ACK analysis]
        [This is an ACK to the segment in frame: 1]
        [The RTT to ACK the segment was: 0.000383676 seconds]
        [iRTT: 0.000418552 seconds]

      3 0.000418552    10.0.1.11             10.0.1.12             TCP      66     40166 → 23 [ACK] Seq=1 Ack=1 Win=29312 Len=0 TSval=1491384 TSecr=1491703

Frame 3: 66 bytes on wire (528 bits), 66 bytes captured (528 bits) on interface 0
    Interface id: 0 (eth0)
    Encapsulation type: Ethernet (1)
    Arrival Time: Mar  2, 2017 15:10:57.359506799 CET
    [Time shift for this packet: 0.000000000 seconds]
    Epoch Time: 1488463857.359506799 seconds
    [Time delta from previous captured frame: 0.000034876 seconds]
    [Time delta from previous displayed frame: 0.000034876 seconds]
    [Time since reference or first frame: 0.000418552 seconds]
    Frame Number: 3
    Frame Length: 66 bytes (528 bits)
    Capture Length: 66 bytes (528 bits)
    [Frame is marked: False]
    [Frame is ignored: False]
    [Protocols in frame: eth:ethertype:ip:tcp]
    [Coloring Rule Name: TCP]
    [Coloring Rule String: tcp]
Ethernet II, Src: 68:05:ca:1a:7c:70, Dst: 68:05:ca:1a:7c:77
    Destination: 68:05:ca:1a:7c:77
        Address: 68:05:ca:1a:7c:77
        .... ..0. .... .... .... .... = LG bit: Globally unique address (factory default)
        .... ...0 .... .... .... .... = IG bit: Individual address (unicast)
    Source: 68:05:ca:1a:7c:70
        Address: 68:05:ca:1a:7c:70
        .... ..0. .... .... .... .... = LG bit: Globally unique address (factory default)
        .... ...0 .... .... .... .... = IG bit: Individual address (unicast)
    Type: IPv4 (0x0800)
Internet Protocol Version 4, Src: 10.0.1.11, Dst: 10.0.1.12
    0100 .... = Version: 4
    .... 0101 = Header Length: 20 bytes
    Differentiated Services Field: 0x10 (DSCP: Unknown, ECN: Not-ECT)
        0001 00.. = Differentiated Services Codepoint: Unknown (4)
        .... ..00 = Explicit Congestion Notification: Not ECN-Capable Transport (0)
    Total Length: 52
    Identification: 0x33fd (13309)
    Flags: 0x02 (Don't Fragment)
        0... .... = Reserved bit: Not set
        .1.. .... = Don't fragment: Set
        ..0. .... = More fragments: Not set
    Fragment offset: 0
    Time to live: 64
    Protocol: TCP (6)
    Header checksum: 0xf0a0 [validation disabled]
        [Good: False]
        [Bad: False]
    Source: 10.0.1.11
    Destination: 10.0.1.12
    [Source GeoIP: Unknown]
    [Destination GeoIP: Unknown]
Transmission Control Protocol, Src Port: 40166 (40166), Dst Port: 23 (23), Seq: 1, Ack: 1, Len: 0
    Source Port: 40166
    Destination Port: 23
    [Stream index: 0]
    [TCP Segment Len: 0]
    Sequence number: 1    (relative sequence number)
    Acknowledgment number: 1    (relative ack number)
    Header Length: 32 bytes
    Flags: 0x010 (ACK)
        000. .... .... = Reserved: Not set
        ...0 .... .... = Nonce: Not set
        .... 0... .... = Congestion Window Reduced (CWR): Not set
        .... .0.. .... = ECN-Echo: Not set
        .... ..0. .... = Urgent: Not set
        .... ...1 .... = Acknowledgment: Set
        .... .... 0... = Push: Not set
        .... .... .0.. = Reset: Not set
        .... .... ..0. = Syn: Not set
        .... .... ...0 = Fin: Not set
        [TCP Flags: *******A****]
    Window size value: 229
    [Calculated window size: 29312]
    [Window size scaling factor: 128]
    Checksum: 0x163d [validation disabled]
        [Good Checksum: False]
        [Bad Checksum: False]
    Urgent pointer: 0
    Options: (12 bytes), No-Operation (NOP), No-Operation (NOP), Timestamps
        No-Operation (NOP)
            Type: 1
                0... .... = Copy on fragmentation: No
                .00. .... = Class: Control (0)
                ...0 0001 = Number: No-Operation (NOP) (1)
        No-Operation (NOP)
            Type: 1
                0... .... = Copy on fragmentation: No
                .00. .... = Class: Control (0)
                ...0 0001 = Number: No-Operation (NOP) (1)
        Timestamps: TSval 1491384, TSecr 1491703
            Kind: Time Stamp Option (8)
            Length: 10
            Timestamp value: 1491384
            Timestamp echo reply: 1491703
    [SEQ/ACK analysis]
        [This is an ACK to the segment in frame: 2]
        [The RTT to ACK the segment was: 0.000034876 seconds]
        [iRTT: 0.000418552 seconds]

      4 0.000532470    10.0.1.11             10.0.1.12             TELNET   93     Telnet Data ...

Frame 4: 93 bytes on wire (744 bits), 93 bytes captured (744 bits) on interface 0
    Interface id: 0 (eth0)
    Encapsulation type: Ethernet (1)
    Arrival Time: Mar  2, 2017 15:10:57.359620717 CET
    [Time shift for this packet: 0.000000000 seconds]
    Epoch Time: 1488463857.359620717 seconds
    [Time delta from previous captured frame: 0.000113918 seconds]
    [Time delta from previous displayed frame: 0.000113918 seconds]
    [Time since reference or first frame: 0.000532470 seconds]
    Frame Number: 4
    Frame Length: 93 bytes (744 bits)
    Capture Length: 93 bytes (744 bits)
    [Frame is marked: False]
    [Frame is ignored: False]
    [Protocols in frame: eth:ethertype:ip:tcp:telnet]
    [Coloring Rule Name: TCP]
    [Coloring Rule String: tcp]
Ethernet II, Src: 68:05:ca:1a:7c:70, Dst: 68:05:ca:1a:7c:77
    Destination: 68:05:ca:1a:7c:77
        Address: 68:05:ca:1a:7c:77
        .... ..0. .... .... .... .... = LG bit: Globally unique address (factory default)
        .... ...0 .... .... .... .... = IG bit: Individual address (unicast)
    Source: 68:05:ca:1a:7c:70
        Address: 68:05:ca:1a:7c:70
        .... ..0. .... .... .... .... = LG bit: Globally unique address (factory default)
        .... ...0 .... .... .... .... = IG bit: Individual address (unicast)
    Type: IPv4 (0x0800)
Internet Protocol Version 4, Src: 10.0.1.11, Dst: 10.0.1.12
    0100 .... = Version: 4
    .... 0101 = Header Length: 20 bytes
    Differentiated Services Field: 0x10 (DSCP: Unknown, ECN: Not-ECT)
        0001 00.. = Differentiated Services Codepoint: Unknown (4)
        .... ..00 = Explicit Congestion Notification: Not ECN-Capable Transport (0)
    Total Length: 79
    Identification: 0x33fe (13310)
    Flags: 0x02 (Don't Fragment)
        0... .... = Reserved bit: Not set
        .1.. .... = Don't fragment: Set
        ..0. .... = More fragments: Not set
    Fragment offset: 0
    Time to live: 64
    Protocol: TCP (6)
    Header checksum: 0xf084 [validation disabled]
        [Good: False]
        [Bad: False]
    Source: 10.0.1.11
    Destination: 10.0.1.12
    [Source GeoIP: Unknown]
    [Destination GeoIP: Unknown]
Transmission Control Protocol, Src Port: 40166 (40166), Dst Port: 23 (23), Seq: 1, Ack: 1, Len: 27
    Source Port: 40166
    Destination Port: 23
    [Stream index: 0]
    [TCP Segment Len: 27]
    Sequence number: 1    (relative sequence number)
    [Next sequence number: 28    (relative sequence number)]
    Acknowledgment number: 1    (relative ack number)
    Header Length: 32 bytes
    Flags: 0x018 (PSH, ACK)
        000. .... .... = Reserved: Not set
        ...0 .... .... = Nonce: Not set
        .... 0... .... = Congestion Window Reduced (CWR): Not set
        .... .0.. .... = ECN-Echo: Not set
        .... ..0. .... = Urgent: Not set
        .... ...1 .... = Acknowledgment: Set
        .... .... 1... = Push: Set
        .... .... .0.. = Reset: Not set
        .... .... ..0. = Syn: Not set
        .... .... ...0 = Fin: Not set
        [TCP Flags: *******AP***]
    Window size value: 229
    [Calculated window size: 29312]
    [Window size scaling factor: 128]
    Checksum: 0x1658 [validation disabled]
        [Good Checksum: False]
        [Bad Checksum: False]
    Urgent pointer: 0
    Options: (12 bytes), No-Operation (NOP), No-Operation (NOP), Timestamps
        No-Operation (NOP)
            Type: 1
                0... .... = Copy on fragmentation: No
                .00. .... = Class: Control (0)
                ...0 0001 = Number: No-Operation (NOP) (1)
        No-Operation (NOP)
            Type: 1
                0... .... = Copy on fragmentation: No
                .00. .... = Class: Control (0)
                ...0 0001 = Number: No-Operation (NOP) (1)
        Timestamps: TSval 1491384, TSecr 1491703
            Kind: Time Stamp Option (8)
            Length: 10
            Timestamp value: 1491384
            Timestamp echo reply: 1491703
    [SEQ/ACK analysis]
        [iRTT: 0.000418552 seconds]
        [Bytes in flight: 27]
Telnet
    Do Suppress Go Ahead
        Command: Do (253)
        Subcommand: Suppress Go Ahead
    Will Terminal Type
        Command: Will (251)
        Subcommand: Terminal Type
    Will Negotiate About Window Size
        Command: Will (251)
        Subcommand: Negotiate About Window Size
    Will Terminal Speed
        Command: Will (251)
        Subcommand: Terminal Speed
    Will Remote Flow Control
        Command: Will (251)
        Subcommand: Remote Flow Control
    Will Linemode
        Command: Will (251)
        Subcommand: Linemode
    Will New Environment Option
        Command: Will (251)
        Subcommand: New Environment Option
    Do Status
        Command: Do (253)
        Subcommand: Status
    Will X Display Location
        Command: Will (251)
        Subcommand: X Display Location

      5 0.000950426    10.0.1.12             10.0.1.11             TCP      66     23 → 40166 [ACK] Seq=1 Ack=28 Win=29056 Len=0 TSval=1491704 TSecr=1491384

Frame 5: 66 bytes on wire (528 bits), 66 bytes captured (528 bits) on interface 0
    Interface id: 0 (eth0)
    Encapsulation type: Ethernet (1)
    Arrival Time: Mar  2, 2017 15:10:57.360038673 CET
    [Time shift for this packet: 0.000000000 seconds]
    Epoch Time: 1488463857.360038673 seconds
    [Time delta from previous captured frame: 0.000417956 seconds]
    [Time delta from previous displayed frame: 0.000417956 seconds]
    [Time since reference or first frame: 0.000950426 seconds]
    Frame Number: 5
    Frame Length: 66 bytes (528 bits)
    Capture Length: 66 bytes (528 bits)
    [Frame is marked: False]
    [Frame is ignored: False]
    [Protocols in frame: eth:ethertype:ip:tcp]
    [Coloring Rule Name: TCP]
    [Coloring Rule String: tcp]
Ethernet II, Src: 68:05:ca:1a:7c:77, Dst: 68:05:ca:1a:7c:70
    Destination: 68:05:ca:1a:7c:70
        Address: 68:05:ca:1a:7c:70
        .... ..0. .... .... .... .... = LG bit: Globally unique address (factory default)
        .... ...0 .... .... .... .... = IG bit: Individual address (unicast)
    Source: 68:05:ca:1a:7c:77
        Address: 68:05:ca:1a:7c:77
        .... ..0. .... .... .... .... = LG bit: Globally unique address (factory default)
        .... ...0 .... .... .... .... = IG bit: Individual address (unicast)
    Type: IPv4 (0x0800)
Internet Protocol Version 4, Src: 10.0.1.12, Dst: 10.0.1.11
    0100 .... = Version: 4
    .... 0101 = Header Length: 20 bytes
    Differentiated Services Field: 0x00 (DSCP: CS0, ECN: Not-ECT)
        0000 00.. = Differentiated Services Codepoint: Default (0)
        .... ..00 = Explicit Congestion Notification: Not ECN-Capable Transport (0)
    Total Length: 52
    Identification: 0xafe4 (45028)
    Flags: 0x02 (Don't Fragment)
        0... .... = Reserved bit: Not set
        .1.. .... = Don't fragment: Set
        ..0. .... = More fragments: Not set
    Fragment offset: 0
    Time to live: 64
    Protocol: TCP (6)
    Header checksum: 0x74c9 [validation disabled]
        [Good: False]
        [Bad: False]
    Source: 10.0.1.12
    Destination: 10.0.1.11
    [Source GeoIP: Unknown]
    [Destination GeoIP: Unknown]
Transmission Control Protocol, Src Port: 23 (23), Dst Port: 40166 (40166), Seq: 1, Ack: 28, Len: 0
    Source Port: 23
    Destination Port: 40166
    [Stream index: 0]
    [TCP Segment Len: 0]
    Sequence number: 1    (relative sequence number)
    Acknowledgment number: 28    (relative ack number)
    Header Length: 32 bytes
    Flags: 0x010 (ACK)
        000. .... .... = Reserved: Not set
        ...0 .... .... = Nonce: Not set
        .... 0... .... = Congestion Window Reduced (CWR): Not set
        .... .0.. .... = ECN-Echo: Not set
        .... ..0. .... = Urgent: Not set
        .... ...1 .... = Acknowledgment: Set
        .... .... 0... = Push: Not set
        .... .... .0.. = Reset: Not set
        .... .... ..0. = Syn: Not set
        .... .... ...0 = Fin: Not set
        [TCP Flags: *******A****]
    Window size value: 227
    [Calculated window size: 29056]
    [Window size scaling factor: 128]
    Checksum: 0x1067 [validation disabled]
        [Good Checksum: False]
        [Bad Checksum: False]
    Urgent pointer: 0
    Options: (12 bytes), No-Operation (NOP), No-Operation (NOP), Timestamps
        No-Operation (NOP)
            Type: 1
                0... .... = Copy on fragmentation: No
                .00. .... = Class: Control (0)
                ...0 0001 = Number: No-Operation (NOP) (1)
        No-Operation (NOP)
            Type: 1
                0... .... = Copy on fragmentation: No
                .00. .... = Class: Control (0)
                ...0 0001 = Number: No-Operation (NOP) (1)
        Timestamps: TSval 1491704, TSecr 1491384
            Kind: Time Stamp Option (8)
            Length: 10
            Timestamp value: 1491704
            Timestamp echo reply: 1491384
    [SEQ/ACK analysis]
        [This is an ACK to the segment in frame: 4]
        [The RTT to ACK the segment was: 0.000417956 seconds]
        [iRTT: 0.000418552 seconds]

      6 0.005847383    10.0.1.12             10.0.1.11             TELNET   78     Telnet Data ...

Frame 6: 78 bytes on wire (624 bits), 78 bytes captured (624 bits) on interface 0
    Interface id: 0 (eth0)
    Encapsulation type: Ethernet (1)
    Arrival Time: Mar  2, 2017 15:10:57.364935630 CET
    [Time shift for this packet: 0.000000000 seconds]
    Epoch Time: 1488463857.364935630 seconds
    [Time delta from previous captured frame: 0.004896957 seconds]
    [Time delta from previous displayed frame: 0.004896957 seconds]
    [Time since reference or first frame: 0.005847383 seconds]
    Frame Number: 6
    Frame Length: 78 bytes (624 bits)
    Capture Length: 78 bytes (624 bits)
    [Frame is marked: False]
    [Frame is ignored: False]
    [Protocols in frame: eth:ethertype:ip:tcp:telnet]
    [Coloring Rule Name: TCP]
    [Coloring Rule String: tcp]
Ethernet II, Src: 68:05:ca:1a:7c:77, Dst: 68:05:ca:1a:7c:70
    Destination: 68:05:ca:1a:7c:70
        Address: 68:05:ca:1a:7c:70
        .... ..0. .... .... .... .... = LG bit: Globally unique address (factory default)
        .... ...0 .... .... .... .... = IG bit: Individual address (unicast)
    Source: 68:05:ca:1a:7c:77
        Address: 68:05:ca:1a:7c:77
        .... ..0. .... .... .... .... = LG bit: Globally unique address (factory default)
        .... ...0 .... .... .... .... = IG bit: Individual address (unicast)
    Type: IPv4 (0x0800)
Internet Protocol Version 4, Src: 10.0.1.12, Dst: 10.0.1.11
    0100 .... = Version: 4
    .... 0101 = Header Length: 20 bytes
    Differentiated Services Field: 0x10 (DSCP: Unknown, ECN: Not-ECT)
        0001 00.. = Differentiated Services Codepoint: Unknown (4)
        .... ..00 = Explicit Congestion Notification: Not ECN-Capable Transport (0)
    Total Length: 64
    Identification: 0xafe5 (45029)
    Flags: 0x02 (Don't Fragment)
        0... .... = Reserved bit: Not set
        .1.. .... = Don't fragment: Set
        ..0. .... = More fragments: Not set
    Fragment offset: 0
    Time to live: 64
    Protocol: TCP (6)
    Header checksum: 0x74ac [validation disabled]
        [Good: False]
        [Bad: False]
    Source: 10.0.1.12
    Destination: 10.0.1.11
    [Source GeoIP: Unknown]
    [Destination GeoIP: Unknown]
Transmission Control Protocol, Src Port: 23 (23), Dst Port: 40166 (40166), Seq: 1, Ack: 28, Len: 12
    Source Port: 23
    Destination Port: 40166
    [Stream index: 0]
    [TCP Segment Len: 12]
    Sequence number: 1    (relative sequence number)
    [Next sequence number: 13    (relative sequence number)]
    Acknowledgment number: 28    (relative ack number)
    Header Length: 32 bytes
    Flags: 0x018 (PSH, ACK)
        000. .... .... = Reserved: Not set
        ...0 .... .... = Nonce: Not set
        .... 0... .... = Congestion Window Reduced (CWR): Not set
        .... .0.. .... = ECN-Echo: Not set
        .... ..0. .... = Urgent: Not set
        .... ...1 .... = Acknowledgment: Set
        .... .... 1... = Push: Set
        .... .... .0.. = Reset: Not set
        .... .... ..0. = Syn: Not set
        .... .... ...0 = Fin: Not set
        [TCP Flags: *******AP***]
    Window size value: 227
    [Calculated window size: 29056]
    [Window size scaling factor: 128]
    Checksum: 0xd90e [validation disabled]
        [Good Checksum: False]
        [Bad Checksum: False]
    Urgent pointer: 0
    Options: (12 bytes), No-Operation (NOP), No-Operation (NOP), Timestamps
        No-Operation (NOP)
            Type: 1
                0... .... = Copy on fragmentation: No
                .00. .... = Class: Control (0)
                ...0 0001 = Number: No-Operation (NOP) (1)
        No-Operation (NOP)
            Type: 1
                0... .... = Copy on fragmentation: No
                .00. .... = Class: Control (0)
                ...0 0001 = Number: No-Operation (NOP) (1)
        Timestamps: TSval 1491705, TSecr 1491384
            Kind: Time Stamp Option (8)
            Length: 10
            Timestamp value: 1491705
            Timestamp echo reply: 1491384
    [SEQ/ACK analysis]
        [iRTT: 0.000418552 seconds]
        [Bytes in flight: 12]
Telnet
    Do Terminal Type
        Command: Do (253)
        Subcommand: Terminal Type
    Do Terminal Speed
        Command: Do (253)
        Subcommand: Terminal Speed
    Do X Display Location
        Command: Do (253)
        Subcommand: X Display Location
    Do New Environment Option
        Command: Do (253)
        Subcommand: New Environment Option

      7 0.005862578    10.0.1.11             10.0.1.12             TCP      66     40166 → 23 [ACK] Seq=28 Ack=13 Win=29312 Len=0 TSval=1491386 TSecr=1491705

Frame 7: 66 bytes on wire (528 bits), 66 bytes captured (528 bits) on interface 0
    Interface id: 0 (eth0)
    Encapsulation type: Ethernet (1)
    Arrival Time: Mar  2, 2017 15:10:57.364950825 CET
    [Time shift for this packet: 0.000000000 seconds]
    Epoch Time: 1488463857.364950825 seconds
    [Time delta from previous captured frame: 0.000015195 seconds]
    [Time delta from previous displayed frame: 0.000015195 seconds]
    [Time since reference or first frame: 0.005862578 seconds]
    Frame Number: 7
    Frame Length: 66 bytes (528 bits)
    Capture Length: 66 bytes (528 bits)
    [Frame is marked: False]
    [Frame is ignored: False]
    [Protocols in frame: eth:ethertype:ip:tcp]
    [Coloring Rule Name: TCP]
    [Coloring Rule String: tcp]
Ethernet II, Src: 68:05:ca:1a:7c:70, Dst: 68:05:ca:1a:7c:77
    Destination: 68:05:ca:1a:7c:77
        Address: 68:05:ca:1a:7c:77
        .... ..0. .... .... .... .... = LG bit: Globally unique address (factory default)
        .... ...0 .... .... .... .... = IG bit: Individual address (unicast)
    Source: 68:05:ca:1a:7c:70
        Address: 68:05:ca:1a:7c:70
        .... ..0. .... .... .... .... = LG bit: Globally unique address (factory default)
        .... ...0 .... .... .... .... = IG bit: Individual address (unicast)
    Type: IPv4 (0x0800)
Internet Protocol Version 4, Src: 10.0.1.11, Dst: 10.0.1.12
    0100 .... = Version: 4
    .... 0101 = Header Length: 20 bytes
    Differentiated Services Field: 0x10 (DSCP: Unknown, ECN: Not-ECT)
        0001 00.. = Differentiated Services Codepoint: Unknown (4)
        .... ..00 = Explicit Congestion Notification: Not ECN-Capable Transport (0)
    Total Length: 52
    Identification: 0x33ff (13311)
    Flags: 0x02 (Don't Fragment)
        0... .... = Reserved bit: Not set
        .1.. .... = Don't fragment: Set
        ..0. .... = More fragments: Not set
    Fragment offset: 0
    Time to live: 64
    Protocol: TCP (6)
    Header checksum: 0xf09e [validation disabled]
        [Good: False]
        [Bad: False]
    Source: 10.0.1.11
    Destination: 10.0.1.12
    [Source GeoIP: Unknown]
    [Destination GeoIP: Unknown]
Transmission Control Protocol, Src Port: 40166 (40166), Dst Port: 23 (23), Seq: 28, Ack: 13, Len: 0
    Source Port: 40166
    Destination Port: 23
    [Stream index: 0]
    [TCP Segment Len: 0]
    Sequence number: 28    (relative sequence number)
    Acknowledgment number: 13    (relative ack number)
    Header Length: 32 bytes
    Flags: 0x010 (ACK)
        000. .... .... = Reserved: Not set
        ...0 .... .... = Nonce: Not set
        .... 0... .... = Congestion Window Reduced (CWR): Not set
        .... .0.. .... = ECN-Echo: Not set
        .... ..0. .... = Urgent: Not set
        .... ...1 .... = Acknowledgment: Set
        .... .... 0... = Push: Not set
        .... .... .0.. = Reset: Not set
        .... .... ..0. = Syn: Not set
        .... .... ...0 = Fin: Not set
        [TCP Flags: *******A****]
    Window size value: 229
    [Calculated window size: 29312]
    [Window size scaling factor: 128]
    Checksum: 0x163d [validation disabled]
        [Good Checksum: False]
        [Bad Checksum: False]
    Urgent pointer: 0
    Options: (12 bytes), No-Operation (NOP), No-Operation (NOP), Timestamps
        No-Operation (NOP)
            Type: 1
                0... .... = Copy on fragmentation: No
                .00. .... = Class: Control (0)
                ...0 0001 = Number: No-Operation (NOP) (1)
        No-Operation (NOP)
            Type: 1
                0... .... = Copy on fragmentation: No
                .00. .... = Class: Control (0)
                ...0 0001 = Number: No-Operation (NOP) (1)
        Timestamps: TSval 1491386, TSecr 1491705
            Kind: Time Stamp Option (8)
            Length: 10
            Timestamp value: 1491386
            Timestamp echo reply: 1491705
    [SEQ/ACK analysis]
        [This is an ACK to the segment in frame: 6]
        [The RTT to ACK the segment was: 0.000015195 seconds]
        [iRTT: 0.000418552 seconds]

      8 0.006233841    10.0.1.12             10.0.1.11             TELNET   105    Telnet Data ...

Frame 8: 105 bytes on wire (840 bits), 105 bytes captured (840 bits) on interface 0
    Interface id: 0 (eth0)
    Encapsulation type: Ethernet (1)
    Arrival Time: Mar  2, 2017 15:10:57.365322088 CET
    [Time shift for this packet: 0.000000000 seconds]
    Epoch Time: 1488463857.365322088 seconds
    [Time delta from previous captured frame: 0.000371263 seconds]
    [Time delta from previous displayed frame: 0.000371263 seconds]
    [Time since reference or first frame: 0.006233841 seconds]
    Frame Number: 8
    Frame Length: 105 bytes (840 bits)
    Capture Length: 105 bytes (840 bits)
    [Frame is marked: False]
    [Frame is ignored: False]
    [Protocols in frame: eth:ethertype:ip:tcp:telnet]
    [Coloring Rule Name: TCP]
    [Coloring Rule String: tcp]
Ethernet II, Src: 68:05:ca:1a:7c:77, Dst: 68:05:ca:1a:7c:70
    Destination: 68:05:ca:1a:7c:70
        Address: 68:05:ca:1a:7c:70
        .... ..0. .... .... .... .... = LG bit: Globally unique address (factory default)
        .... ...0 .... .... .... .... = IG bit: Individual address (unicast)
    Source: 68:05:ca:1a:7c:77
        Address: 68:05:ca:1a:7c:77
        .... ..0. .... .... .... .... = LG bit: Globally unique address (factory default)
        .... ...0 .... .... .... .... = IG bit: Individual address (unicast)
    Type: IPv4 (0x0800)
Internet Protocol Version 4, Src: 10.0.1.12, Dst: 10.0.1.11
    0100 .... = Version: 4
    .... 0101 = Header Length: 20 bytes
    Differentiated Services Field: 0x10 (DSCP: Unknown, ECN: Not-ECT)
        0001 00.. = Differentiated Services Codepoint: Unknown (4)
        .... ..00 = Explicit Congestion Notification: Not ECN-Capable Transport (0)
    Total Length: 91
    Identification: 0xafe6 (45030)
    Flags: 0x02 (Don't Fragment)
        0... .... = Reserved bit: Not set
        .1.. .... = Don't fragment: Set
        ..0. .... = More fragments: Not set
    Fragment offset: 0
    Time to live: 64
    Protocol: TCP (6)
    Header checksum: 0x7490 [validation disabled]
        [Good: False]
        [Bad: False]
    Source: 10.0.1.12
    Destination: 10.0.1.11
    [Source GeoIP: Unknown]
    [Destination GeoIP: Unknown]
Transmission Control Protocol, Src Port: 23 (23), Dst Port: 40166 (40166), Seq: 13, Ack: 28, Len: 39
    Source Port: 23
    Destination Port: 40166
    [Stream index: 0]
    [TCP Segment Len: 39]
    Sequence number: 13    (relative sequence number)
    [Next sequence number: 52    (relative sequence number)]
    Acknowledgment number: 28    (relative ack number)
    Header Length: 32 bytes
    Flags: 0x018 (PSH, ACK)
        000. .... .... = Reserved: Not set
        ...0 .... .... = Nonce: Not set
        .... 0... .... = Congestion Window Reduced (CWR): Not set
        .... .0.. .... = ECN-Echo: Not set
        .... ..0. .... = Urgent: Not set
        .... ...1 .... = Acknowledgment: Set
        .... .... 1... = Push: Set
        .... .... .0.. = Reset: Not set
        .... .... ..0. = Syn: Not set
        .... .... ...0 = Fin: Not set
        [TCP Flags: *******AP***]
    Window size value: 227
    [Calculated window size: 29056]
    [Window size scaling factor: 128]
    Checksum: 0x3570 [validation disabled]
        [Good Checksum: False]
        [Bad Checksum: False]
    Urgent pointer: 0
    Options: (12 bytes), No-Operation (NOP), No-Operation (NOP), Timestamps
        No-Operation (NOP)
            Type: 1
                0... .... = Copy on fragmentation: No
                .00. .... = Class: Control (0)
                ...0 0001 = Number: No-Operation (NOP) (1)
        No-Operation (NOP)
            Type: 1
                0... .... = Copy on fragmentation: No
                .00. .... = Class: Control (0)
                ...0 0001 = Number: No-Operation (NOP) (1)
        Timestamps: TSval 1491705, TSecr 1491386
            Kind: Time Stamp Option (8)
            Length: 10
            Timestamp value: 1491705
            Timestamp echo reply: 1491386
    [SEQ/ACK analysis]
        [iRTT: 0.000418552 seconds]
        [Bytes in flight: 39]
Telnet
    Will Suppress Go Ahead
        Command: Will (251)
        Subcommand: Suppress Go Ahead
    Do Negotiate About Window Size
        Command: Do (253)
        Subcommand: Negotiate About Window Size
    Do Remote Flow Control
        Command: Do (253)
        Subcommand: Remote Flow Control
    Don't Linemode
        Command: Don't (254)
        Subcommand: Linemode
    Will Status
        Command: Will (251)
        Subcommand: Status
    Suboption Terminal Speed
        Command: Suboption (250)
        Subcommand: Terminal Speed
            Option data: 01
    Suboption End
        Command: Suboption End (240)
    Suboption X Display Location
        Command: Suboption (250)
        Subcommand: X Display Location
            Send your X Display Location
    Suboption End
        Command: Suboption End (240)
    Suboption New Environment Option
        Command: Suboption (250)
        Subcommand: New Environment Option
            Option data: 01
    Suboption End
        Command: Suboption End (240)
    Suboption Terminal Type
        Command: Suboption (250)
        Subcommand: Terminal Type
            Send your Terminal Type
    Suboption End
        Command: Suboption End (240)

      9 0.006247899    10.0.1.11             10.0.1.12             TCP      66     40166 → 23 [ACK] Seq=28 Ack=52 Win=29312 Len=0 TSval=1491386 TSecr=1491705

Frame 9: 66 bytes on wire (528 bits), 66 bytes captured (528 bits) on interface 0
    Interface id: 0 (eth0)
    Encapsulation type: Ethernet (1)
    Arrival Time: Mar  2, 2017 15:10:57.365336146 CET
    [Time shift for this packet: 0.000000000 seconds]
    Epoch Time: 1488463857.365336146 seconds
    [Time delta from previous captured frame: 0.000014058 seconds]
    [Time delta from previous displayed frame: 0.000014058 seconds]
    [Time since reference or first frame: 0.006247899 seconds]
    Frame Number: 9
    Frame Length: 66 bytes (528 bits)
    Capture Length: 66 bytes (528 bits)
    [Frame is marked: False]
    [Frame is ignored: False]
    [Protocols in frame: eth:ethertype:ip:tcp]
    [Coloring Rule Name: TCP]
    [Coloring Rule String: tcp]
Ethernet II, Src: 68:05:ca:1a:7c:70, Dst: 68:05:ca:1a:7c:77
    Destination: 68:05:ca:1a:7c:77
        Address: 68:05:ca:1a:7c:77
        .... ..0. .... .... .... .... = LG bit: Globally unique address (factory default)
        .... ...0 .... .... .... .... = IG bit: Individual address (unicast)
    Source: 68:05:ca:1a:7c:70
        Address: 68:05:ca:1a:7c:70
        .... ..0. .... .... .... .... = LG bit: Globally unique address (factory default)
        .... ...0 .... .... .... .... = IG bit: Individual address (unicast)
    Type: IPv4 (0x0800)
Internet Protocol Version 4, Src: 10.0.1.11, Dst: 10.0.1.12
    0100 .... = Version: 4
    .... 0101 = Header Length: 20 bytes
    Differentiated Services Field: 0x10 (DSCP: Unknown, ECN: Not-ECT)
        0001 00.. = Differentiated Services Codepoint: Unknown (4)
        .... ..00 = Explicit Congestion Notification: Not ECN-Capable Transport (0)
    Total Length: 52
    Identification: 0x3400 (13312)
    Flags: 0x02 (Don't Fragment)
        0... .... = Reserved bit: Not set
        .1.. .... = Don't fragment: Set
        ..0. .... = More fragments: Not set
    Fragment offset: 0
    Time to live: 64
    Protocol: TCP (6)
    Header checksum: 0xf09d [validation disabled]
        [Good: False]
        [Bad: False]
    Source: 10.0.1.11
    Destination: 10.0.1.12
    [Source GeoIP: Unknown]
    [Destination GeoIP: Unknown]
Transmission Control Protocol, Src Port: 40166 (40166), Dst Port: 23 (23), Seq: 28, Ack: 52, Len: 0
    Source Port: 40166
    Destination Port: 23
    [Stream index: 0]
    [TCP Segment Len: 0]
    Sequence number: 28    (relative sequence number)
    Acknowledgment number: 52    (relative ack number)
    Header Length: 32 bytes
    Flags: 0x010 (ACK)
        000. .... .... = Reserved: Not set
        ...0 .... .... = Nonce: Not set
        .... 0... .... = Congestion Window Reduced (CWR): Not set
        .... .0.. .... = ECN-Echo: Not set
        .... ..0. .... = Urgent: Not set
        .... ...1 .... = Acknowledgment: Set
        .... .... 0... = Push: Not set
        .... .... .0.. = Reset: Not set
        .... .... ..0. = Syn: Not set
        .... .... ...0 = Fin: Not set
        [TCP Flags: *******A****]
    Window size value: 229
    [Calculated window size: 29312]
    [Window size scaling factor: 128]
    Checksum: 0x163d [validation disabled]
        [Good Checksum: False]
        [Bad Checksum: False]
    Urgent pointer: 0
